A1: \n \n\t \n\t历时5天的杨杯完满结束，公开组冠军姚洪新、海外组冠军梁达民、专业男子组冠军洪智、女子组冠军唐丹。 \n\t p1030156.jpg p1030157.jpg p1030158.jpg p1030159.jpg p1030160.jpg \n\t \n \n

A1: \n \n\t \n\t p1030161.jpg p1030162.jpg p1030165.jpg p1030166.jpg p1030167.jpg \n\t \n \n

A1: \n \n\t \n\t p1030169.jpg p1030170.jpg p1030171.jpg p1030172.jpg p1030173.jpg \n\t \n \n

A1: \n \n\t \n\t p1030174.jpg p1030177.jpg p1030178.jpg p1030179.jpg p1030180.jpg \n\t \n \n

A1: \n \n\t \n\t p1030182.jpg p1030183.jpg p1030184.jpg p1030185.jpg p1030186.jpg \n\t \n \n

A1: \n \n\t \n\t p1030188.jpg p1030189.jpg p1030190.jpg p1030191.jpg p1030192.jpg p1030193.jpg \n\t \n \n

A1: \n \n\t \n\t公开组冠军奖金也应该是三万元，怎么我看姚洪新前面好象是两万元，有没有搞错啊？不会是组委会故意刁难人吧？？？ \n\t \n \n

A1: \n \n\t \n\t \n\t \n \n

A1: \n \n\t \n\t \n \n \n \n\t \n \n

A1: 2012年第5届杨官璘杯全国象棋公开赛最终名次表 \n
A2: \n[本帖被加为精华]
A3: 单帖管理 \n举报帖子复制帖子解除精华单帖屏蔽版主评定| 引用 | 回复 | 编辑 |

A1: \n \n \n \n裁判长：蔡伟林 2012年9月17日—21日·凤岗 \n[此贴子已经被作者于2012-9-21 12:43:04编辑过]

A1: \n第5届“杨官璘杯”全国象棋公开赛 专业组（男子）名次
A2: \n | B2: \n | C2: \n | D2: \n | E2: \n | F2: \n | G2: \n | H2: \n
A3: \n名次 | B3: \n代表队 | C3: \n姓 名 | D3: \n积分 | E3: \n对手分 | F3: \n胜局 | G3: \n犯规 | H3: \n备注
A4: \n 1 | B4: \n湖北 | C4: \n洪 智 | D4: \n14 | E4: \n88 | F4: \n5 | G4: \n\u3000 | H4: \n\u3000
A5: \n 2 | B5: \n湖北 | C5: \n汪 洋 | D5: \n13 | E5: \n92 | F5: \n4 | G5: \n\u3000 | H5: \n\u3000
A6: \n 3 | B6: \n浙江 | C6: \n赵鑫鑫 | D6: \n12 | E6: \n95 | F6: \n3 | G6: \n\u3000 | H6: \n\u3000
A7: \n 4 | B7: \n厦门 | C7: \n郑一泓 | D7: \n11 | E7: \n88 | F7: \n4 | G7: \n\u3000 | H7: \n\u3000
A8: \n 5 | B8: \n北京 | C8: \n蒋 川 | D8: \n10 | E8: \n89 | F8: \n2 | G8: \n\u3000 | H8: \n\u3000
A9: \n 6 | B9: \n上海 | C9: \n孙勇征 | D9: \n10 | E9: \n87 | F9: \n3 | G9: \n\u3000 | H9: \n\u3000
A10: \n 7 | B10: \n河北 | C10: \n申 鹏 | D10: \n10 | E10: \n85 | F10: \n3 | G10: \n\u3000 | H10: \n\u3000
A11: \n 8 | B11: \n北京 | C11: \n张 强 | D11: \n10 | E11: \n84 | F11: \n3 | G11: \n\u3000 | H11: \n\u3000
A12: \n 9 | B12: \n黑龙江 | C12: \n聂铁文 | D12: \n9 | E12: \n93 | F12: \n2 | G12: \n\u3000 | H12: \n\u3000
A13: \n10 | B13: \n四川 | C13: \n郑惟桐 | D13: \n9 | E13: \n89 | F13: \n2 | G13: \n\u3000 | H13: \n\u3000
A14: \n11 | B14: \n浙江 | C14: \n黄竹风 | D14: \n9 | E14: \n88 | F14: \n1 | G14: \n\u3000 | H14: \n\u3000
A15: \n12 | B15: \n上海 | C15: \n谢 靖 | D15: \n9 | E15: \n87 | F15: \n2 | G15: \n\u3000 | H15: \n\u3000
A16: \n13 | B16: \n上海 | C16: \n万春林 | D16: \n9 | E16: \n73 | F16: \n3 | G16: \n\u3000 | H16: \n\u3000
A17: \n14 | B17: \n浙江 | C17: \n于幼华 | D17: \n9 | E17: \n67 | F17: \n3 | G17: \n\u3000 | H17: \n\u3000
A18: \n15 | B18: \n广东 | C18: \n张学潮 | D18: \n8 | E18: \n80 | F18: \n2 | G18: \n\u3000 | H18: \n\u3000
A19: \n16 | B19: \n河南 | C19: \n李少庚 | D19: \n8 | E19: \n73 | F19: \n2 | G19: \n\u3000 | H19: \n\u3000
A20: \n17 | B20: \n湖北 | C20: \n李雪松 | D20: \n8 | E20: \n64 | F20: \n0 | G20: \n\u3000 | H20: \n\u3000
A21: \n18 | B21: \n江苏 | C21: \n徐天红 | D21: \n7 | E21: \n75 | F21: \n1 | G21: \n\u3000 | H21: \n\u3000
A22: \n19 | B22: \n湖北 | C22: \n柳大华 | D22: \n7 | E22: \n72 | F22: \n2 | G22: \n\u3000 | H22: \n\u3000
A23: \n20 | B23: \n黑龙江 | C23: \n陶汉明 | D23: \n7 | E23: \n70 | F23: \n2 | G23: \n\u3000 | H23: \n\u3000
A24: \n21 | B24: \n河北 | C24: \n陆伟韬 | D24: \n6 | E24: \n71 | F24: \n1 | G24: \n\u3000 | H24: \n\u3000
A25: \n22 | B25: \n火车头 | C25: \n孙 博 | D25: \n3 | E25: \n72 | F25: \n1 | G25: \n\u3000 | H25: \n\u3000
A26: \n

A1: \n打虎将 | B1: 小大2楼 | 信息 | 搜索 时间:2012-9-21 12:32:00 [只看该作者]
A2: 加好友 发短信 汕头棋院网 等级：管理员 帖子：2052 积分：21273 威望：0 精华：28 注册：2004-8-2 0:04:00 | B2: 第五届“杨官璘杯”全国象棋公开赛 女子组 成绩表 \n
B4: 单帖管理 \n举报帖子删除单帖复制帖子加为精华单帖屏蔽版主评定| 引用 | 回复 | 编辑 |

A1: \n \n \n \n \n比赛地点：凤岗 比赛时间：2012年9月17-21日 \n裁判长：蔡伟林 编排：刘 征 \n[此贴子已经被作者于2012-9-21 12:33:45编辑过]

A1: \n第五届“杨官璘杯”全国象棋公开赛 女子组 成绩表
A3: \n代号 | B3: \n单 位 | C3: \n姓 名 | D3: \n对手号及成绩 | N3: \n积 分 | O3: \n小 分 | P3: \n胜局 | Q3: \n备注 | R3: \n名次
D4: \n1 | E4: \n2 | F4: \n3 | G4: \n4 | H4: \n5 | I4: \n6 | J4: \n7 | K4: \n8 | L4: \n9 | M4: \n10
A5: \n1 | B5: \n云南 | C5: \n \n \n | D5: \n\u3000 | E5: 1 | F5: 1 | G5: 0 | H5: 1 | I5: 1 | J5: 0 | K5: 2 | L5: 1 | M5: 2 | N5: =SUM(D5:M5) -> 9 | O5: =(D5*N$5+E5*N$6+F5*N$7+G5*N$8+H5*N$9+I5*N$10+J5*N$11+K5*N$12+L5*N$13+M5*N$14)/2 -> 37 | P5: =COUNTIF(D5:M5,2) -> \n2 | Q5: \n\u3000 | R5: \n7
A6: \n2 | B6: \n江苏 | C6: \n杨伊 | D6: 1 | E6: \n\u3000 | F6: 0 | G6: 1 | H6: 1 | I6: 2 | J6: 1 | K6: 1 | L6: 0 | M6: 2 | N6: =SUM(D6:M6) -> 9 | O6: =(D6*N$5+E6*N$6+F6*N$7+G6*N$8+H6*N$9+I6*N$10+J6*N$11+K6*N$12+L6*N$13+M6*N$14)/2 -> 37 | P6: =COUNTIF(D6:M6,2) -> \n2 | Q6: \n对局时后走 | R6: \n6
A7: \n3 | B7: \n河北 | C7: \n玉思源 | D7: 1 | E7: 2 | F7: \n\u3000 | G7: 1 | H7: 1 | I7: 1 | J7: 1 | K7: 1 | L7: 0 | M7: 1 | N7: =SUM(D7:M7) -> 9 | O7: =(D7*N$5+E7*N$6+F7*N$7+G7*N$8+H7*N$9+I7*N$10+J7*N$11+K7*N$12+L7*N$13+M7*N$14)/2 -> 39 | P7: =COUNTIF(D7:M7,2) -> \n1 | Q7: \n\u3000 | R7: \n5
A8: \n4 | B8: \n广东 | C8: \n陈幸琳 | D8: 2 | E8: 1 | F8: 1 | G8: \n\u3000 | H8: 1 | I8: 2 | J8: 0 | K8: 1 | L8: 0 | M8: 0 | N8: =SUM(D8:M8) -> 8 | O8: =(D8*N$5+E8*N$6+F8*N$7+G8*N$8+H8*N$9+I8*N$10+J8*N$11+K8*N$12+L8*N$13+M8*N$14)/2 -> 29.5 | P8: =COUNTIF(D8:M8,2) -> \n2 | Q8: \n\u3000 | R8: \n8
A9: \n5 | B9: \n河北 | C9: \n张婷婷 | D9: 1 | E9: 1 | F9: 1 | G9: 1 | H9: \n\u3000 | I9: 1 | J9: 0 | K9: 2 | L9: 1 | M9: 2 | N9: =SUM(D9:M9) -> 10 | O9: =(D9*N$5+E9*N$6+F9*N$7+G9*N$8+H9*N$9+I9*N$10+J9*N$11+K9*N$12+L9*N$13+M9*N$14)/2 -> 40.5 | P9: =COUNTIF(D9:M9,2) -> \n2 | Q9: \n\u3000 | R9: \n4
A10: \n6 | B10: \n广东 | C10: \n蒋倩仪 | D10: 1 | E10: 0 | F10: 1 | G10: 0 | H10: 1 | I10: \n\u3000 | J10: 0 | K10: 1 | L10: 0 | M10: 0 | N10: =SUM(D10:M10) -> 4 | O10: =(D10*N$5+E10*N$6+F10*N$7+G10*N$8+H10*N$9+I10*N$10+J10*N$11+K10*N$12+L10*N$13+M10*N$14)/2 -> 16.5 | P10: =COUNTIF(D10:M10,2) -> \n0 | Q10: \n\u3000 | R10: \n10
A11: \n7 | B11: \n北京 | C11: \n唐丹 | D11: 2 | E11: 1 | F11: 1 | G11: 2 | H11: 2 | I11: 2 | J11: \n\u3000 | K11: 2 | L11: 1 | M11: 1 | N11: =SUM(D11:M11) -> 14 | O11: =(D11*N$5+E11*N$6+F11*N$7+G11*N$8+H11*N$9+I11*N$10+J11*N$11+K11*N$12+L11*N$13+M11*N$14)/2 -> 56 | P11: =COUNTIF(D11:M11,2) -> \n5 | Q11: \n\u3000 | R11: \n1
A12: \n8 | B12: \n广东 | C12: \n时凤兰 | D12: 0 | E12: 1 | F12: 1 | G12: 1 | H12: 0 | I12: 1 | J12: 0 | K12: \n\u3000 | L12: 1 | M12: 0 | N12: =SUM(D12:M12) -> 5 | O12: =(D12*N$5+E12*N$6+F12*N$7+G12*N$8+H12*N$9+I12*N$10+J12*N$11+K12*N$12+L12*N$13+M12*N$14)/2 -> 21 | P12: =COUNTIF(D12:M12,2) -> \n0 | Q12: \n\u3000 | R12: \n9
A13: \n9 | B13: \n河北 | C13: \n尤颖钦 | D13: 1 | E13: 2 | F13: 2 | G13: 2 | H13: 1 | I13: 2 | J13: 1 | K13: 1 | L13: \n\u3000 | M13: 0 | N13: =SUM(D13:M13) -> 12 | O13: =(D13*N$5+E13*N$6+F13*N$7+G13*N$8+H13*N$9+I13*N$10+J13*N$11+K13*N$12+L13*N$13+M13*N$14)/2 -> 49 | P13: =COUNTIF(D13:M13,2) -> \n4 | Q13: \n\u3000 | R13: \n2
A14: \n10 | B14: \n广东 | C14: \n陈丽淳 | D14: 0 | E14: 0 | F14: 1 | G14: 2 | H14: 0 | I14: 2 | J14: 1 | K14: 2 | L14: 2 | M14: \n\u3000 | N14: =SUM(D14:M14) -> 10 | O14: =(D14*N$5+E14*N$6+F14*N$7+G14*N$8+H14*N$9+I14*N$10+J14*N$11+K14*N$12+L14*N$13+M14*N$14)/2 -> 40.5 | P14: =COUNTIF(D14:M14,2) -> \n4 | Q14: \n\u3000 | R14: \n3

A1: 党国蕾

A1: \n打虎将 | B1: 小大3楼 | 信息 | 搜索 时间:2012-9-21 12:39:00 [只看该作者]
A2: 加好友 发短信 汕头棋院网 等级：管理员 帖子：2052 积分：21273 威望：0 精华：28 注册：2004-8-2 0:04:00 | B2: 第五届“杨官璘杯”全国象棋公开赛公开组成绩表 \n
B4: 单帖管理 \n举报帖子删除单帖复制帖子加为精华单帖屏蔽版主评定| 引用 | 回复 | 编辑 |

A1: \n \n \n[此贴子已经被作者于2012-9-21 12:53:15编辑过]

A1: \n \n第五届“杨官璘杯”全国象棋公开赛 公开组 成绩表 \n
A2: 比赛地点：凤岗镇体育馆 比赛时间：2012年9月17-21日 注：* 表示先手、 + 未对弈得分、- 弃权
A3: \n代号 | B3: \n代表队 | C3: \n姓名 | D3: \n第一轮 | G3: \n第二轮 | J3: \n第三轮 | M3: \n第四轮 | P3: \n第五轮 | S3: \n第六轮 | V3: \n第七轮 | Y3: \n第八轮 | AB3: \n第九轮 | AE3: \n对手分 | AF3: \n胜局 | AG3: \n备注 | AH3: \n名次
D4: \n对手 | F4: \n积分 | G4: \n对手 | I4: \n积分 | J4: \n对手 | L4: \n积分 | M4: \n对手 | O4: \n积分 | P4: \n对手 | R4: \n积分 | S4: \n对手 | U4: \n积分 | V4: \n对手 | X4: \n积分 | Y4: \n对手 | AA4: \n积分 | AB4: \n对手 | AD4: \n积分
A5: \n22 | B5: \n河南 | C5: \n姚洪新 | D5: \n21 | E5: \n\u3000 | F5: \n2 | G5: \n27 | H5: \n* | I5: \n4 | J5: \n14 | K5: \n* | L5: \n6 | M5: \n34 | N5: \n\u3000 | O5: \n7 | P5: \n11 | Q5: \n* | R5: \n9 | S5: \n46 | T5: \n* | U5: \n11 | V5: \n38 | W5: \n\u3000 | X5: \n12 | Y5: \n48 | Z5: \n\u3000 | AA5: \n13 | AB5: \n29 | AC5: \n* | AD5: \n15 | AE5: \n100 | AF5: \n6 | AG5: \n\u3000 | AH5: \n1
A6: \n11 | B6: \n山东 | C6: \n张申宏 | D6: \n12 | E6: \n\u3000 | F6: \n1 | G6: \n8 | H6: \n* | I6: \n3 | J6: \n15 | K6: \n\u3000 | L6: \n5 | M6: \n43 | N6: \n* | O6: \n7 | P6: \n22 | Q6: \n\u3000 | R6: \n7 | S6: \n6 | T6: \n* | U6: \n9 | V6: \n46 | W6: \n\u3000 | X6: \n10 | Y6: \n16 | Z6: \n* | AA6: \n12 | AB6: \n34 | AC6: \n* | AD6: \n14 | AE6: \n98 | AF6: \n6 | AG6: \n\u3000 | AH6: \n2
A7: \n46 | B7: \n上海 | C7: \n赵玮 | D7: \n45 | E7: \n\u3000 | F7: \n2 | G7: \n48 | H7: \n* | I7: \n4 | J7: \n43 | K7: \n\u3000 | L7: \n5 | M7: \n31 | N7: \n* | O7: \n7 | P7: \n34 | Q7: \n* | R7: \n9 | S7: \n22 | T7: \n\u3000 | U7: \n9 | V7: \n11 | W7: \n* | X7: \n10 | Y7: \n36 | Z7: \n\u3000 | AA7: \n12 | AB7: \n38 | AC7: \n* | AD7: \n13 | AE7: \n94 | AF7: \n5 | AG7: \n\u3000 | AH7: \n3
A8: \n48 | B8: \n广西 | C8: \n唐中平 | D8: \n47 | E8: \n* | F8: \n2 | G8: \n46 | H8: \n\u3000 | I8: \n2 | J8: \n10 | K8: \n* | L8: \n4 | M8: \n20 | N8: \n\u3000 | O8: \n4 | P8: \n41 | Q8: \n\u3000 | R8: \n6 | S8: \n43 | T8: \n* | U8: \n8 | V8: \n6 | W8: \n\u3000 | X8: \n10 | Y8: \n22 | Z8: \n* | AA8: \n11 | AB8: \n5 | AC8: \n\u3000 | AD8: \n13 | AE8: \n87 | AF8: \n6 | AG8: \n\u3000 | AH8: \n4
A9: \n38 | B9: \n广东 | C9: \n陈富杰 | D9: \n37 | E9: \n\u3000 | F9: \n2 | G9: \n29 | H9: \n* | I9: \n3 | J9: \n6 | K9: \n\u3000 | L9: \n4 | M9: \n41 | N9: \n* | O9: \n6 | P9: \n12 | Q9: \n\u3000 | R9: \n7 | S9: \n13 | T9: \n* | U9: \n9 | V9: \n22 | W9: \n* | X9: \n10 | Y9: \n34 | Z9: \n\u3000 | AA9: \n11 | AB9: \n46 | AC9: \n\u3000 | AD9: \n12 | AE9: \n95 | AF9: \n3 | AG9: \n\u3000 | AH9: \n5
A10: \n15 | B10: \n山东 | C10: \n赵勇霖 | D10: \n16 | E10: \n\u3000 | F10: \n1 | G10: \n12 | H10: \n* | I10: \n3 | J10: \n11 | K10: \n* | L10: \n3 | M10: \n2 | N10: \n\u3000 | O10: \n4 | P10: \n24 | Q10: \n* | R10: \n6 | S10: \n5 | T10: \n* | U10: \n7 | V10: \n13 | W10: \n\u3000 | X10: \n8 | Y10: \n20 | Z10: \n* | AA10: \n10 | AB10: \n7 | AC10: \n\u3000 | AD10: \n12 | AE10: \n94 | AF10: \n4 | AG10: \n\u3000 | AH10: \n6
A11: \n13 | B11: \n湖北 | C11: \n刘宗泽 | D11: \n14 | E11: \n* | F11: \n0 | G11: \n21 | H11: \n\u3000 | I11: \n2 | J11: \n42 | K11: \n* | L11: \n3 | M11: \n27 | N11: \n\u3000 | O11: \n5 | P11: \n23 | Q11: \n* | R11: \n7 | S11: \n38 | T11: \n\u3000 | U11: \n7 | V11: \n15 | W11: \n* | X11: \n8 | Y11: \n12 | Z11: \n\u3000 | AA11: \n10 | AB11: \n3 | AC11: \n* | AD11: \n12 | AE11: \n87 | AF11: \n5 | AG11: \n\u3000 | AH11: \n7
A12: \n34 | B12: \n北京 | C12: \n才溢 | D12: \n33 | E12: \n\u3000 | F12: \n2 | G12: \n17 | H12: \n* | I12: \n4 | J12: \n31 | K12: \n\u3000 | L12: \n6 | M12: \n22 | N12: \n* | O12: \n7 | P12: \n46 | Q12: \n\u3000 | R12: \n7 | S12: \n29 | T12: \n* | U12: \n8 | V12: \n7 | W12: \n\u3000 | X12: \n10 | Y12: \n38 | Z12: \n* | AA12: \n11 | AB12: \n11 | AC12: \n\u3000 | AD12: \n11 | AE12: \n97 | AF12: \n4 | AG12: \n\u3000 | AH12: \n8
A13: \n29 | B13: \n广东 | C13: \n李鸿嘉 | D13: \n30 | E13: \n* | F13: \n2 | G13: \n38 | H13: \n\u3000 | I13: \n3 | J13: \n7 | K13: \n* | L13: \n4 | M13: \n23 | N13: \n\u3000 | O13: \n5 | P13: \n33 | Q13: \n* | R13: \n7 | S13: \n34 | T13: \n\u3000 | U13: \n8 | V13: \n3 | W13: \n* | X13: \n9 | Y13: \n14 | Z13: \n\u3000 | AA13: \n11 | AB13: \n22 | AC13: \n\u3000 | AD13: \n11 | AE13: \n96 | AF13: \n3 | AG13: \n\u3000 | AH13: \n9
A14: \n16 | B14: \n湖南 | C14: \n向有权 | D14: \n15 | E14: \n* | F14: \n1 | G14: \n19 | H14: \n\u3000 | I14: \n3 | J14: \n2 | K14: \n* | L14: \n4 | M14: \n7 | N14: \n\u3000 | O14: \n4 | P14: \n25 | Q14: \n* | R14: \n6 | S14: \n31 | T14: \n\u3000 | U14: \n8 | V14: \n14 | W14: \n* | X14: \n10 | Y14: \n11 | Z14: \n\u3000 | AA14: \n10 | AB14: \n33 | AC14: \n* | AD14: \n11 | AE14: \n89 | AF14: \n4 | AG14: \n\u3000 | AH14: \n10
A15: \n33 | B15: \n山东 | C15: \n李翰林 | D15: \n34 | E15: \n* | F15: \n0 | G15: \n30 | H15: \n\u3000 | I15: \n2 | J15: \n24 | K15: \n\u3000 | L15: \n3 | M15: \n40 | N15: \n* | O15: \n5 | P15: \n29 | Q15: \n\u3000 | R15: \n5 | S15: \n8 | T15: \n* | U15: \n7 | V15: \n20 | W15: \n\u3000 | X15: \n8 | Y15: \n26 | Z15: \n* | AA15: \n10 | AB15: \n16 | AC15: \n\u3000 | AD15: \n11 | AE15: \n88 | AF15: \n4 | AG15: \n\u3000 | AH15: \n11
A16: \n14 | B16: \n广东 | C16: \n许国义 | D16: \n13 | E16: \n\u3000 | F16: \n2 | G16: \n6 | H16: \n* | I16: \n4 | J16: \n22 | K16: \n\u3000 | L16: \n4 | M16: \n25 | N16: \n* | O16: \n6 | P16: \n20 | Q16: \n\u3000 | R16: \n8 | S16: \n7 | T16: \n* | U16: \n9 | V16: \n16 | W16: \n\u3000 | X16: \n9 | Y16: \n29 | Z16: \n* | AA16: \n9 | AB16: \n8 | AC16: \n\u3000 | AD16: \n10 | AE16: \n96 | AF16: \n4 | AG16: \n\u3000 | AH16: \n12
A17: \n7 | B17: \n江苏 | C17: \n程鸣 | D17: \n8 | E17: \n\u3000 | F17: \n1 | G17: \n4 | H17: \n* | I17: \n3 | J17: \n29 | K17: \n\u3000 | L17: \n4 | M17: \n16 | N17: \n* | O17: \n6 | P17: \n3 | Q17: \n* | R17: \n7 | S17: \n14 | T17: \n\u3000 | U17: \n8 | V17: \n34 | W17: \n* | X17: \n8 | Y17: \n47 | Z17: \n\u3000 | AA17: \n10 | AB17: \n15 | AC17: \n* | AD17: \n10 | AE17: \n93 | AF17: \n3 | AG17: \n\u3000 | AH17: \n13
A18: \n8 | B18: \n广东 | C18: \n黄海林 | D18: \n7 | E18: \n* | F18: \n1 | G18: \n11 | H18: \n\u3000 | I18: \n1 | J18: \n35 | K18: \n* | L18: \n2 | M18: \n26 | N18: \n\u3000 | O18: \n4 | P18: \n9 | Q18: \n* | R18: \n5 | S18: \n33 | T18: \n\u3000 | U18: \n5 | V18: \n25 | W18: \n* | X18: \n7 | Y18: \n2 | Z18: \n\u3000 | AA18: \n9 | AB18: \n14 | AC18: \n* | AD18: \n10 | AE18: \n86 | AF18: \n3 | AG18: \n\u3000 | AH18: \n14
A19: \n23 | B19: \n福建 | C19: \n卓赞烽 | D19: \n24 | E19: \n\u3000 | F19: \n1 | G19: \n20 | H19: \n* | I19: \n2 | J19: \n1 | K19: \n\u3000 | L19: \n4 | M19: \n29 | N19: \n* | O19: \n5 | P19: \n13 | Q19: \n\u3000 | R19: \n5 | S19: \n40 | T19: \n* | U19: \n7 | V19: \n12 | W19: \n\u3000 | X19: \n8 | Y19: \n28 | Z19: \n* | AA19: \n9 | AB19: \n36 | AC19: \n* | AD19: \n10 | AE19: \n85 | AF19: \n2 | AG19: \n\u3000 | AH19: \n15
A20: \n24 | B20: \n厦门 | C20: \n林文汉 | D20: \n23 | E20: \n* | F20: \n1 | G20: \n26 | H20: \n\u3000 | I20: \n2 | J20: \n33 | K20: \n* | L20: \n3 | M20: \n42 | N20: \n\u3000 | O20: \n4 | P20: \n15 | Q20: \n\u3000 | R20: \n4 | S20: \n30 | T20: \n* | U20: \n6 | V20: \n43 | W20: \n\u3000 | X20: \n7 | Y20: \n6 | Z20: \n* | AA20: \n9 | AB20: \n28 | AC20: \n\u3000 | AD20: \n10 | AE20: \n84 | AF20: \n2 | AG20: \n\u3000 | AH20: \n16
A21: \n3 | B21: \n广东 | C21: \n朱少钧 | D21: \n4 | E21: \n\u3000 | F21: \n1 | G21: \n45 | H21: \n*+ | I21: \n3 | J21: \n25 | K21: \n\u3000 | L21: \n4 | M21: \n9 | N21: \n* | O21: \n6 | P21: \n7 | Q21: \n\u3000 | R21: \n7 | S21: \n20 | T21: \n* | U21: \n8 | V21: \n29 | W21: \n\u3000 | X21: \n9 | Y21: \n5 | Z21: \n* | AA21: \n10 | AB21: \n13 | AC21: \n\u3000 | AD21: \n10 | AE21: \n81 | AF21: \n2 | AG21: \n\u3000 | AH21: \n17
A22: \n5 | B22: \n浙江 | C22: \n程吉俊 | D22: \n6 | E22: \n* | F22: \n0 | G22: \n1 | H22: \n* | I22: \n0 | J22: \n32 | K22: \n\u3000 | L22: \n2 | M22: \n35 | N22: \n\u3000 | O22: \n4 | P22: \n42 | Q22: \n* | R22: \n6 | S22: \n15 | T22: \n\u3000 | U22: \n7 | V22: \n2 | W22: \n* | X22: \n9 | Y22: \n3 | Z22: \n\u3000 | AA22: \n10 | AB22: \n48 | AC22: \n* | AD22: \n10 | AE22: \n80 | AF22: \n4 | AG22: \n\u3000 | AH22: \n18
A23: \n36 | B23: \n江苏 | C23: \n朱晓虎 | D23: \n35 | E23: \n* | F23: \n1 | G23: \n42 | H23: \n\u3000 | I23: \n2 | J23: \n40 | K23: \n\u3000 | L23: \n3 | M23: \n28 | N23: \n* | O23: \n4 | P23: \n43 | Q23: \n\u3000 | R23: \n5 | S23: \n21 | T23: \n* | U23: \n7 | V23: \n18 | W23: \n\u3000 | X23: \n9 | Y23: \n46 | Z23: \n* | AA23: \n9 | AB23: \n23 | AC23: \n\u3000 | AD23: \n10 | AE23: \n80 | AF23: \n2 | AG23: \n\u3000 | AH23: \n19
A24: \n40 | B24: \n广东 | C24: \n林楚强 | D24: \n39 | E24: \n* | F24: \n2 | G24: \n43 | H24: \n\u3000 | I24: \n2 | J24: \n36 | K24: \n* | L24: \n3 | M24: \n33 | N24: \n\u3000 | O24: \n3 | P24: \n27 | Q24: \n* | R24: \n5 | S24: \n23 | T24: \n\u3000 | U24: \n5 | V24: \n42 | W24: \n* | X24: \n6 | Y24: \n44 | Z24: \n\u3000 | AA24: \n8 | AB24: \n32 | AC24: \n* | AD24: \n10 | AE24: \n75 | AF24: \n4 | AG24: \n\u3000 | AH24: \n20
A25: \n28 | B25: \n河南 | C25: \n李海 | D25: \n27 | E25: \n* | F25: \n0 | G25: \n10 | H25: \n\u3000 | I25: \n1 | J25: \n37 | K25: \n* | L25: \n3 | M25: \n36 | N25: \n\u3000 | O25: \n4 | P25: \n31 | Q25: \n* | R25: \n4 | S25: \n44 | T25: \n\u3000 | U25: \n6 | V25: \n9 | W25: \n* | X25: \n8 | Y25: \n23 | Z25: \n\u3000 | AA25: \n9 | AB25: \n24 | AC25: \n* | AD25: \n10 | AE25: \n70 | AF25: \n3 | AG25: \n\u3000 | AH25: \n21
A26: \n6 | B26: \n广东 | C26: \n吴亚利 | D26: \n5 | E26: \n\u3000 | F26: \n2 | G26: \n14 | H26: \n\u3000 | I26: \n2 | J26: \n38 | K26: \n* | L26: \n3 | M26: \n18 | N26: \n\u3000 | O26: \n5 | P26: \n2 | Q26: \n* | R26: \n7 | S26: \n11 | T26: \n\u3000 | U26: \n7 | V26: \n48 | W26: \n* | X26: \n7 | Y26: \n24 | Z26: \n\u3000 | AA26: \n7 | AB26: \n31 | AC26: \n* | AD26: \n9 | AE26: \n92 | AF26: \n4 | AG26: \n\u3000 | AH26: \n22
A27: \n12 | B27: \n广东 | C27: \n黎德志 | D27: \n11 | E27: \n* | F27: \n1 | G27: \n15 | H27: \n\u3000 | I27: \n1 | J27: \n39 | K27: \n* | L27: \n3 | M27: \n19 | N27: \n\u3000 | O27: \n5 | P27: \n38 | Q27: \n* | R27: \n6 | S27: \n9 | T27: \n\u3000 | U27: \n7 | V27: \n23 | W27: \n* | X27: \n8 | Y27: \n13 | Z27: \n* | AA27: \n8 | AB27: \n20 | AC27: \n\u3000 | AD27: \n9 | AE27: \n88 | AF27: \n2 | AG27: \n\u3000 | AH27: \n23
A28: \n20 | B28: \n广东 | C28: \n刘立山 | D28: \n19 | E28: \n* | F28: \n1 | G28: \n23 | H28: \n\u3000 | I28: \n2 | J28: \n17 | K28: \n\u3000 | L28: \n4 | M28: \n48 | N28: \n* | O28: \n6 | P28: \n14 | Q28: \n* | R28: \n6 | S28: \n3 | T28: \n\u3000 | U28: \n7 | V28: \n33 | W28: \n* | X28: \n8 | Y28: \n15 | Z28: \n\u3000 | AA28: \n8 | AB28: \n12 | AC28: \n* | AD28: \n9 | AE28: \n86 | AF28: \n2 | AG28: \n\u3000 | AH28: \n24
A29: \n27 | B29: \n广东 | C29: \n伍世钦 | D29: \n28 | E29: \n\u3000 | F29: \n2 | G29: \n22 | H29: \n\u3000 | I29: \n2 | J29: \n18 | K29: \n* | L29: \n3 | M29: \n13 | N29: \n* | O29: \n3 | P29: \n40 | Q29: \n\u3000 | R29: \n3 | S29: \n19 | T29: \n* | U29: \n5 | V29: \n21 | W29: \n\u3000 | X29: \n7 | Y29: \n43 | Z29: \n* | AA29: \n8 | AB29: \n26 | AC29: \n\u3000 | AD29: \n9 | AE29: \n85 | AF29: \n3 | AG29: \n\u3000 | AH29: \n25
A30: \n2 | B30: \n广东 | C30: \n李进 | D30: \n1 | E30: \n\u3000 | F30: \n2 | G30: \n41 | H30: \n* | I30: \n3 | J30: \n16 | K30: \n\u3000 | L30: \n4 | M30: \n15 | N30: \n* | O30: \n5 | P30: \n6 | Q30: \n\u3000 | R30: \n5 | S30: \n32 | T30: \n* | U30: \n7 | V30: \n5 | W30: \n\u3000 | X30: \n7 | Y30: \n8 | Z30: \n* | AA30: \n7 | AB30: \n43 | AC30: \n\u3000 | AD30: \n9 | AE30: \n81 | AF30: \n3 | AG30: \n\u3000 | AH30: \n26
A31: \n25 | B31: \n湖南 | C31: \n刘泉 | D31: \n26 | E31: \n* | F31: \n1 | G31: \n35 | H31: \n\u3000 | I31: \n3 | J31: \n3 | K31: \n* | L31: \n4 | M31: \n14 | N31: \n\u3000 | O31: \n4 | P31: \n16 | Q31: \n\u3000 | R31: \n4 | S31: \n41 | T31: \n* | U31: \n5 | V31: \n8 | W31: \n\u3000 | X31: \n5 | Y31: \n30 | Z31: \n\u3000 | AA31: \n7 | AB31: \n9 | AC31: \n* | AD31: \n9 | AE31: \n80 | AF31: \n3 | AG31: \n\u3000 | AH31: \n27
A32: \n41 | B32: \n福建 | C32: \n黄卿耀 | D32: \n42 | E32: \n* | F32: \n1 | G32: \n2 | H32: \n\u3000 | I32: \n2 | J32: \n44 | K32: \n* | L32: \n4 | M32: \n38 | N32: \n\u3000 | O32: \n4 | P32: \n48 | Q32: \n* | R32: \n4 | S32: \n25 | T32: \n\u3000 | U32: \n5 | V32: \n32 | W32: \n\u3000 | X32: \n5 | Y32: \n21 | Z32: \n* | AA32: \n7 | AB32: \n18 | AC32: \n\u3000 | AD32: \n9 | AE32: \n79 | AF32: \n3 | AG32: \n\u3000 | AH32: \n28
A33: \n26 | B33: \n广东 | C33: \n陈红标 | D33: \n25 | E33: \n\u3000 | F33: \n1 | G33: \n24 | H33: \n* | I33: \n2 | J33: \n9 | K33: \n\u3000 | L33: \n2 | M33: \n8 | N33: \n* | O33: \n2 | P33: \n17 | Q33: \n\u3000 | R33: \n4 | S33: \n37 | T33: \n* | U33: \n6 | V33: \n31 | W33: \n* | X33: \n8 | Y33: \n33 | Z33: \n\u3000 | AA33: \n8 | AB33: \n27 | AC33: \n* | AD33: \n9 | AE33: \n73 | AF33: \n3 | AG33: \n\u3000 | AH33: \n29
A34: \n47 | B34: \n安徽 | C34: \n王建鸣 | D34: \n48 | E34: \n\u3000 | F34: \n0 | G34: \n44 | H34: \n* | I34: \n0 | J34: \n30 | K34: \n\u3000 | L34: \n2 | M34: \n17 | N34: \n* | O34: \n4 | P34: \n21 | Q34: \n\u3000 | R34: \n5 | S34: \n18 | T34: \n* | U34: \n6 | V34: \n4 | W34: \n\u3000 | X34: \n7 | Y34: \n7 | Z34: \n* | AA34: \n7 | AB34: \n37 | AC34: \n* | AD34: \n9 | AE34: \n69 | AF34: \n3 | AG34: \n\u3000 | AH34: \n30
A35: \n4 | B35: \n沈阳 | C35: \n苗永鹏 | D35: \n3 | E35: \n* | F35: \n1 | G35: \n7 | H35: \n\u3000 | I35: \n1 | J35: \n19 | K35: \n* | L35: \n1 | M35: \n39 | N35: \n\u3000 | O35: \n2 | P35: \n37 | Q35: \n* | R35: \n4 | S35: \n42 | T35: \n\u3000 | U35: \n5 | V35: \n47 | W35: \n* | X35: \n6 | Y35: \n9 | Z35: \n\u3000 | AA35: \n7 | AB35: \n35 | AC35: \n* | AD35: \n9 | AE35: \n69 | AF35: \n2 | AG35: \n\u3000 | AH35: \n31
A36: \n43 | B36: \n湖北 | C36: \n肖八武 | D36: \n44 | E36: \n\u3000 | F36: \n2 | G36: \n40 | H36: \n* | I36: \n4 | J36: \n46 | K36: \n* | L36: \n5 | M36: \n11 | N36: \n\u3000 | O36: \n5 | P36: \n36 | Q36: \n* | R36: \n6 | S36: \n48 | T36: \n\u3000 | U36: \n6 | V36: \n24 | W36: \n* | X36: \n7 | Y36: \n27 | Z36: \n\u3000 | AA36: \n8 | AB36: \n2 | AC36: \n* | AD36: \n8 | AE36: \n94 | AF36: \n2 | AG36: \n\u3000 | AH36: \n32
A37: \n42 | B37: \n广东 | C37: \n林进春 | D37: \n41 | E37: \n\u3000 | F37: \n1 | G37: \n36 | H37: \n* | I37: \n2 | J37: \n13 | K37: \n\u3000 | L37: \n3 | M37: \n24 | N37: \n* | O37: \n4 | P37: \n5 | Q37: \n\u3000 | R37: \n4 | S37: \n4 | T37: \n* | U37: \n5 | V37: \n40 | W37: \n\u3000 | X37: \n6 | Y37: \n32 | Z37: \n* | AA37: \n6 | AB37: \n44 | AC37: \n\u3000 | AD37: \n8 | AE37: \n84 | AF37: \n1 | AG37: \n\u3000 | AH37: \n33
A38: \n32 | B38: \n宁波 | C38: \n谢丹枫 | D38: \n31 | E38: \n* | F38: \n0 | G38: \n18 | H38: \n\u3000 | I38: \n0 | J38: \n5 | K38: \n* | L38: \n0 | M38: \n45 | N38: \n* | O38: \n2 | P38: \n1 | Q38: \n\u3000 | R38: \n4 | S38: \n2 | T38: \n\u3000 | U38: \n4 | V38: \n41 | W38: \n* | X38: \n6 | Y38: \n42 | Z38: \n\u3000 | AA38: \n8 | AB38: \n40 | AC38: \n\u3000 | AD38: \n8 | AE38: \n68 | AF38: \n4 | AG38: \n\u3000 | AH38: \n34
A39: \n31 | B39: \n湖北 | C39: \n胡克华 | D39: \n32 | E39: \n\u3000 | F39: \n2 | G39: \n9 | H39: \n* | I39: \n4 | J39: \n34 | K39: \n* | L39: \n4 | M39: \n46 | N39: \n\u3000 | O39: \n4 | P39: \n28 | Q39: \n\u3000 | R39: \n6 | S39: \n16 | T39: \n* | U39: \n6 | V39: \n26 | W39: \n\u3000 | X39: \n6 | Y39: \n18 | Z39: \n* | AA39: \n7 | AB39: \n6 | AC39: \n\u3000 | AD39: \n7 | AE39: \n85 | AF39: \n3 | AG39: \n\u3000 | AH39: \n35
A40: \n21 | B40: \n北京 | C40: \n周涛 | D40: \n22 | E40: \n* | F40: \n0 | G40: \n13 | H40: \n* | I40: \n0 | J40: \n45 | K40: \n\u3000 | L40: \n2 | M40: \n44 | N40: \n\u3000 | O40: \n4 | P40: \n47 | Q40: \n* | R40: \n5 | S40: \n36 | T40: \n\u3000 | U40: \n5 | V40: \n27 | W40: \n* | X40: \n5 | Y40: \n41 | Z40: \n\u3000 | AA40: \n5 | AB40: \n10 | AC40: \n* | AD40: \n7 | AE40: \n79 | AF40: \n3 | AG40: \n\u3000 | AH40: \n36
A41: \n9 | B41: \n河南 | C41: \n赵子雨 | D41: \n10 | E41: \n* | F41: \n2 | G41: \n31 | H41: \n\u3000 | I41: \n2 | J41: \n26 | K41: \n* | L41: \n4 | M41: \n3 | N41: \n\u3000 | O41: \n4 | P41: \n8 | Q41: \n\u3000 | R41: \n5 | S41: \n12 | T41: \n* | U41: \n6 | V41: \n28 | W41: \n\u3000 | X41: \n6 | Y41: \n4 | Z41: \n* | AA41: \n7 | AB41: \n25 | AC41: \n\u3000 | AD41: \n7 | AE41: \n78 | AF41: \n2 | AG41: \n\u3000 | AH41: \n37
A42: \n30 | B42: \n广西 | C42: \n欧照芳 | D42: \n29 | E42: \n\u3000 | F42: \n0 | G42: \n33 | H42: \n* | I42: \n0 | J42: \n47 | K42: \n* | L42: \n0 | M42: \n10 | N42: \n\u3000 | O42: \n2 | P42: \n35 | Q42: \n* | R42: \n4 | S42: \n24 | T42: \n\u3000 | U42: \n4 | V42: \n19 | W42: \n\u3000 | X42: \n5 | Y42: \n25 | Z42: \n* | AA42: \n5 | AB42: \n1 | AC42: \n\u3000 | AD42: \n7 | AE42: \n73 | AF42: \n3 | AG42: \n\u3000 | AH42: \n38
A43: \n18 | B43: \n四川 | C43: \n梁妍婷（女） | D43: \n17 | E43: \n\u3000 | F43: \n0 | G43: \n32 | H43: \n* | I43: \n2 | J43: \n27 | K43: \n\u3000 | L43: \n3 | M43: \n6 | N43: \n* | O43: \n3 | P43: \n19 | Q43: \n* | R43: \n5 | S43: \n47 | T43: \n\u3000 | U43: \n6 | V43: \n36 | W43: \n* | X43: \n6 | Y43: \n31 | Z43: \n\u3000 | AA43: \n7 | AB43: \n41 | AC43: \n* | AD43: \n7 | AE43: \n72 | AF43: \n2 | AG43: \n\u3000 | AH43: \n39
A44: \n19 | B44: \n湖北 | C44: \n王文志 | D44: \n20 | E44: \n\u3000 | F44: \n1 | G44: \n16 | H44: \n* | I44: \n1 | J44: \n4 | K44: \n\u3000 | L44: \n3 | M44: \n12 | N44: \n* | O44: \n3 | P44: \n18 | Q44: \n\u3000 | R44: \n3 | S44: \n27 | T44: \n\u3000 | U44: \n3 | V44: \n30 | W44: \n* | X44: \n4 | Y44: \n10 | Z44: \n\u3000 | AA44: \n5 | AB44: \n39 | AC44: \n* | AD44: \n7 | AE44: \n71 | AF44: \n2 | AG44: \n\u3000 | AH44: \n40
A45: \n35 | B45: \n山东 | C45: \n王新光 | D45: \n36 | E45: \n\u3000 | F45: \n1 | G45: \n25 | H45: \n* | I45: \n1 | J45: \n8 | K45: \n\u3000 | L45: \n2 | M45: \n5 | N45: \n* | O45: \n2 | P45: \n30 | Q45: \n\u3000 | R45: \n2 | S45: \n39 | T45: \n* | U45: \n3 | V45: \n17 | W45: \n\u3000 | X45: \n5 | Y45: \n1 | Z45: \n* | AA45: \n7 | AB45: \n4 | AC45: \n\u3000 | AD45: \n7 | AE45: \n68 | AF45: \n2 | AG45: \n\u3000 | AH45: \n41
A46: \n44 | B46: \n广东 | C46: \n林进明 | D46: \n43 | E46: \n* | F46: \n0 | G46: \n47 | H46: \n\u3000 | I46: \n2 | J46: \n41 | K46: \n\u3000 | L46: \n2 | M46: \n21 | N46: \n* | O46: \n2 | P46: \n39 | Q46: \n\u3000 | R46: \n4 | S46: \n28 | T46: \n* | U46: \n4 | V46: \n1 | W46: \n\u3000 | X46: \n6 | Y46: \n40 | Z46: \n* | AA46: \n6 | AB46: \n42 | AC46: \n* | AD46: \n6 | AE46: \n70 | AF46: \n3 | AG46: \n\u3000 | AH46: \n42
A47: \n37 | B47: \n江苏 | C47: \n许波 | D47: \n38 | E47: \n* | F47: \n0 | G47: \n39 | H47: \n\u3000 | I47: \n1 | J47: \n28 | K47: \n\u3000 | L47: \n1 | M47: \n1 | N47: \n* | O47: \n3 | P47: \n4 | Q47: \n\u3000 | R47: \n3 | S47: \n26 | T47: \n\u3000 | U47: \n3 | V47: \n10 | W47: \n* | X47: \n4 | Y47: \n45 | Z47: \n* | AA47: \n6 | AB47: \n47 | AC47: \n\u3000 | AD47: \n6 | AE47: \n67 | AF47: \n2 | AG47: \n\u3000 | AH47: \n43
A48: \n10 | B48: \n广东 | C48: \n梁运龙 | D48: \n9 | E48: \n\u3000 | F48: \n0 | G48: \n28 | H48: \n* | I48: \n1 | J48: \n48 | K48: \n\u3000 | L48: \n1 | M48: \n30 | N48: \n* | O48: \n1 | P48: \n45 | Q48: \n\u3000 | R48: \n2 | S48: \n17 | T48: \n* | U48: \n3 | V48: \n37 | W48: \n\u3000 | X48: \n4 | Y48: \n19 | Z48: \n* | AA48: \n5 | AB48: \n21 | AC48: \n\u3000 | AD48: \n5 | AE48: \n65 | AF48: \n0 | AG48: \n\u3000 | AH48: \n44
A49: \n39 | B49: \n湖南 | C49: \n王清 | D49: \n40 | E49: \n\u3000 | F49: \n0 | G49: \n37 | H49: \n* | I49: \n1 | J49: \n12 | K49: \n\u3000 | L49: \n1 | M49: \n4 | N49: \n* | O49: \n2 | P49: \n44 | Q49: \n* | R49: \n2 | S49: \n35 | T49: \n\u3000 | U49: \n3 | V49: \n45 | W49: \n* | X49: \n3 | Y49: \n17 | Z49: \n* | AA49: \n5 | AB49: \n19 | AC49: \n\u3000 | AD49: \n5 | AE49: \n62 | AF49: \n1 | AG49: \n\u3000 | AH49: \n45
A50: \n1 | B50: \n湖南 | C50: \n梁林 | D50: \n2 | E50: \n* | F50: \n0 | G50: \n5 | H50: \n\u3000 | I50: \n2 | J50: \n23 | K50: \n* | L50: \n2 | M50: \n37 | N50: \n\u3000 | O50: \n2 | P50: \n32 | Q50: \n* | R50: \n2 | S50: \n45 | T50: \n\u3000 | U50: \n4 | V50: \n44 | W50: \n* | X50: \n4 | Y50: \n35 | Z50: \n\u3000 | AA50: \n4 | AB50: \n30 | AC50: \n* | AD50: \n4 | AE50: \n67 | AF50: \n2 | AG50: \n\u3000 | AH50: \n46
A51: \n17 | B51: \n山东 | C51: \n张卫东 | D51: \n18 | E51: \n* | F51: \n2 | G51: \n34 | H51: \n\u3000 | I51: \n2 | J51: \n20 | K51: \n* | L51: \n2 | M51: \n47 | N51: \n\u3000 | O51: \n2 | P51: \n26 | Q51: \n* | R51: \n2 | S51: \n10 | T51: \n\u3000 | U51: \n3 | V51: \n35 | W51: \n* | X51: \n3 | Y51: \n39 | Z51: \n\u3000 | AA51: \n3 | AB51: \n45 | AC51: \n\u3000 | AD51: \n4 | AE51: \n66 | AF51: \n1 | AG51: \n\u3000 | AH51: \n47
A52: \n45 | B52: \n广东 | C52: \n张亮 | D52: \n46 | E52: \n* | F52: \n0 | G52: \n3 | H52: \n- | I52: \n0 | J52: \n21 | K52: \n* | L52: \n0 | M52: \n32 | N52: \n\u3000 | O52: \n0 | P52: \n10 | Q52: \n* | R52: \n1 | S52: \n1 | T52: \n* | U52: \n1 | V52: \n39 | W52: \n\u3000 | X52: \n3 | Y52: \n37 | Z52: \n\u3000 | AA52: \n3 | AB52: \n17 | AC52: \n* | AD52: \n4 | AE52: \n62 | AF52: \n1 | AG52: \n\u3000 | AH52: \n48

A1: \n打虎将 | B1: 小大4楼 | 信息 | 搜索 时间:2012-9-21 12:42:00 [只看该作者]
A2: 加好友 发短信 汕头棋院网 等级：管理员 帖子：2052 积分：21273 威望：0 精华：28 注册：2004-8-2 0:04:00 | B2: \n

A1: \n \n \n[此贴子已经被作者于2012-9-21 12:57:10编辑过]

A1: \n第五届“杨官璘杯”全国象棋公开赛 海外组 成绩表
A2: 比赛地点：凤岗镇体育馆 比赛时间：2012年9月17-21日 注：* 表示先手、 + 未对弈得分、- 弃权
A3: \n代号 | B3: \n代表队 | C3: \n姓名 | D3: \n第一轮 | G3: \n第二轮 | J3: \n第三轮 | M3: \n第四轮 | P3: \n第五轮 | S3: \n第六轮 | V3: \n第七轮 | Y3: \n第八轮 | AB3: \n第九轮 | AE3: \n对手分 | AF3: \n胜局 | AG3: \n备注 | AH3: \n名次
D4: \n对手 | F4: \n积分 | G4: \n对手 | I4: \n积分 | J4: \n对手 | L4: \n积分 | M4: \n对手 | O4: \n积分 | P4: \n对手 | R4: \n积分 | S4: \n对手 | U4: \n积分 | V4: \n对手 | X4: \n积分 | Y4: \n对手 | AA4: \n积分 | AB4: \n对手 | AD4: \n积分
A5: \n28 | B5: \n中国香港 | C5: \n梁达民 | D5: \n27 | E5: \n\u3000 | F5: \n2 | G5: \n31 | H5: \n* | I5: \n4 | J5: \n30 | K5: \n+ | L5: \n6 | M5: \n42 | N5: \n\u3000 | O5: \n7 | P5: \n53 | Q5: \n* | R5: \n9 | S5: \n13 | T5: \n* | U5: \n10 | V5: \n25 | W5: \n\u3000 | X5: \n11 | Y5: \n49 | Z5: \n* | AA5: \n13 | AB5: \n3 | AC5: \n* | AD5: \n14 | AE5: \n102 | AF5: \n5 | AG5: \n\u3000 | AH5: \n1
A6: \n3 | B6: \n中国香港 | C6: \n吴震熙 | D6: \n4 | E6: \n* | F6: \n2 | G6: \n1 | H6: \n* | I6: \n4 | J6: \n13 | K6: \n\u3000 | L6: \n4 | M6: \n55 | N6: \n* | O6: \n6 | P6: \n24 | Q6: \n\u3000 | R6: \n7 | S6: \n15 | T6: \n* | U6: \n9 | V6: \n33 | W6: \n\u3000 | X6: \n10 | Y6: \n16 | Z6: \n* | AA6: \n12 | AB6: \n28 | AC6: \n\u3000 | AD6: \n13 | AE6: \n102 | AF6: \n5 | AG6: \n\u3000 | AH6: \n2
A7: \n42 | B7: \n中国香港 | C7: \n陈振杰 | D7: \n41 | E7: \n\u3000 | F7: \n2 | G7: \n51 | H7: \n* | I7: \n4 | J7: \n48 | K7: \n\u3000 | L7: \n6 | M7: \n28 | N7: \n* | O7: \n7 | P7: \n13 | Q7: \n\u3000 | R7: \n8 | S7: \n40 | T7: \n* | U7: \n9 | V7: \n38 | W7: \n* | X7: \n11 | Y7: \n60 | Z7: \n\u3000 | AA7: \n12 | AB7: \n18 | AC7: \n* | AD7: \n13 | AE7: \n100 | AF7: \n4 | AG7: \n\u3000 | AH7: \n3
A8: \n13 | B8: \n越南 | C8: \n郑亚生 | D8: \n14 | E8: \n* | F8: \n2 | G8: \n10 | H8: \n\u3000 | I8: \n4 | J8: \n3 | K8: \n* | L8: \n6 | M8: \n60 | N8: \n\u3000 | O8: \n7 | P8: \n42 | Q8: \n* | R8: \n8 | S8: \n28 | T8: \n\u3000 | U8: \n9 | V8: \n40 | W8: \n* | X8: \n11 | Y8: \n18 | Z8: \n\u3000 | AA8: \n11 | AB8: \n24 | AC8: \n* | AD8: \n13 | AE8: \n98 | AF8: \n5 | AG8: \n\u3000 | AH8: \n4
A9: \n1 | B9: \n越南 | C9: \n阮成保 | D9: \n2 | E9: \n* | F9: \n2 | G9: \n3 | H9: \n\u3000 | I9: \n2 | J9: \n10 | K9: \n* | L9: \n4 | M9: \n11 | N9: \n\u3000 | O9: \n6 | P9: \n25 | Q9: \n* | R9: \n7 | S9: \n20 | T9: \n\u3000 | U9: \n9 | V9: \n18 | W9: \n* | X9: \n10 | Y9: \n48 | Z9: \n\u3000 | AA9: \n11 | AB9: \n60 | AC9: \n* | AD9: \n13 | AE9: \n96 | AF9: \n5 | AG9: \n\u3000 | AH9: \n5
A10: \n25 | B10: \n中国香港 | C10: \n赵汝权 | D10: \n26 | E10: \n* | F10: \n2 | G10: \n24 | H10: \n\u3000 | I10: \n2 | J10: \n14 | K10: \n* | L10: \n4 | M10: \n19 | N10: \n* | O10: \n6 | P10: \n1 | Q10: \n\u3000 | R10: \n7 | S10: \n22 | T10: \n\u3000 | U10: \n9 | V10: \n28 | W10: \n* | X10: \n10 | Y10: \n33 | Z10: \n\u3000 | AA10: \n11 | AB10: \n38 | AC10: \n* | AD10: \n13 | AE10: \n95 | AF10: \n5 | AG10: \n\u3000 | AH10: \n6
A11: \n18 | B11: \n中国澳门 | C11: \n曹岩磊 | D11: \n17 | E11: \n\u3000 | F11: \n2 | G11: \n15 | H11: \n* | I11: \n3 | J11: \n11 | K11: \n\u3000 | L11: \n4 | M11: \n30 | N11: \n* | O11: \n5 | P11: \n43 | Q11: \n\u3000 | R11: \n7 | S11: \n24 | T11: \n* | U11: \n9 | V11: \n1 | W11: \n\u3000 | X11: \n10 | Y11: \n13 | Z11: \n* | AA11: \n12 | AB11: \n42 | AC11: \n\u3000 | AD11: \n13 | AE11: \n92 | AF11: \n4 | AG11: \n\u3000 | AH11: \n7
A12: \n60 | B12: \n菲律宾 | C12: \n庄宏明 | D12: \n59 | E12: \n\u3000 | F12: \n2 | G12: \n57 | H12: \n* | I12: \n4 | J12: \n5 | K12: \n\u3000 | L12: \n6 | M12: \n13 | N12: \n* | O12: \n7 | P12: \n40 | Q12: \n\u3000 | R12: \n8 | S12: \n33 | T12: \n* | U12: \n9 | V12: \n39 | W12: \n\u3000 | X12: \n11 | Y12: \n42 | Z12: \n* | AA12: \n12 | AB12: \n1 | AC12: \n\u3000 | AD12: \n12 | AE12: \n100 | AF12: \n4 | AG12: \n\u3000 | AH12: \n8
A13: \n33 | B13: \n美国 | C13: \n牟海勤 | D13: \n34 | E13: \n* | F13: \n2 | G13: \n30 | H13: \n\u3000 | I13: \n2 | J13: \n20 | K13: \n* | L13: \n4 | M13: \n35 | N13: \n\u3000 | O13: \n6 | P13: \n16 | Q13: \n* | R13: \n8 | S13: \n60 | T13: \n\u3000 | U13: \n9 | V13: \n3 | W13: \n* | X13: \n10 | Y13: \n25 | Z13: \n* | AA13: \n11 | AB13: \n15 | AC13: \n\u3000 | AD13: \n12 | AE13: \n95 | AF13: \n4 | AG13: \n\u3000 | AH13: \n9
A14: \n53 | B14: \n越南 | C14: \n武明一 | D14: \n54 | E14: \n* | F14: \n1 | G14: \n6 | H14: \n\u3000 | I14: \n3 | J14: \n46 | K14: \n* | L14: \n5 | M14: \n15 | N14: \n* | O14: \n7 | P14: \n28 | Q14: \n\u3000 | R14: \n7 | S14: \n38 | T14: \n\u3000 | U14: \n7 | V14: \n36 | W14: \n* | X14: \n9 | Y14: \n40 | Z14: \n\u3000 | AA14: \n10 | AB14: \n4 | AC14: \n* | AD14: \n12 | AE14: \n92 | AF14: \n5 | AG14: \n\u3000 | AH14: \n10
A15: \n20 | B15: \n中华台北 | C15: \n刘安生 | D15: \n19 | E15: \n\u3000 | F15: \n0 | G15: \n21 | H15: \n* | I15: \n2 | J15: \n33 | K15: \n\u3000 | L15: \n2 | M15: \n14 | N15: \n* | O15: \n4 | P15: \n55 | Q15: \n\u3000 | R15: \n6 | S15: \n1 | T15: \n* | U15: \n6 | V15: \n11 | W15: \n\u3000 | X15: \n8 | Y15: \n59 | Z15: \n* | AA15: \n10 | AB15: \n57 | AC15: \n\u3000 | AD15: \n12 | AE15: \n88 | AF15: \n6 | AG15: \n\u3000 | AH15: \n11
A16: \n48 | B16: \n新加坡 | C16: \n许正豪 | D16: \n47 | E16: \n\u3000 | F16: \n2 | G16: \n61 | H16: \n* | I16: \n4 | J16: \n42 | K16: \n* | L16: \n4 | M16: \n34 | N16: \n\u3000 | O16: \n5 | P16: \n22 | Q16: \n* | R16: \n5 | S16: \n54 | T16: \n\u3000 | U16: \n7 | V16: \n37 | W16: \n\u3000 | X16: \n9 | Y16: \n1 | Z16: \n* | AA16: \n10 | AB16: \n40 | AC16: \n* | AD16: \n12 | AE16: \n86 | AF16: \n5 | AG16: \n\u3000 | AH16: \n12
A17: \n49 | B17: \n中国香港 | C17: \n黄学谦 | D17: \n50 | E17: \n* | F17: \n2 | G17: \n40 | H17: \n\u3000 | I17: \n2 | J17: \n51 | K17: \n* | L17: \n4 | M17: \n43 | N17: \n* | O17: \n5 | P17: \n6 | Q17: \n\u3000 | R17: \n6 | S17: \n57 | T17: \n* | U17: \n8 | V17: \n19 | W17: \n* | X17: \n10 | Y17: \n28 | Z17: \n\u3000 | AA17: \n10 | AB17: \n16 | AC17: \n\u3000 | AD17: \n12 | AE17: \n84 | AF17: \n5 | AG17: \n\u3000 | AH17: \n13
A18: \n24 | B18: \n越南 | C18: \n宗室日新 | D18: \n23 | E18: \n\u3000 | F18: \n2 | G18: \n25 | H18: \n* | I18: \n4 | J18: \n22 | K18: \n* | L18: \n5 | M18: \n38 | N18: \n\u3000 | O18: \n6 | P18: \n3 | Q18: \n* | R18: \n7 | S18: \n18 | T18: \n\u3000 | U18: \n7 | V18: \n34 | W18: \n* | X18: \n9 | Y18: \n39 | Z18: \n* | AA18: \n11 | AB18: \n13 | AC18: \n\u3000 | AD18: \n11 | AE18: \n99 | AF18: \n4 | AG18: \n\u3000 | AH18: \n14
A19: \n38 | B19: \n越南 | C19: \n阮黄林 | D19: \n37 | E19: \n\u3000 | F19: \n2 | G19: \n43 | H19: \n* | I19: \n4 | J19: \n40 | K19: \n\u3000 | L19: \n5 | M19: \n24 | N19: \n* | O19: \n6 | P19: \n39 | Q19: \n\u3000 | R19: \n7 | S19: \n53 | T19: \n* | U19: \n9 | V19: \n42 | W19: \n\u3000 | X19: \n9 | Y19: \n30 | Z19: \n* | AA19: \n11 | AB19: \n25 | AC19: \n\u3000 | AD19: \n11 | AE19: \n97 | AF19: \n4 | AG19: \n后胜1局 | AH19: \n15
A20: \n15 | B20: \n中国澳门 | C20: \n李锦欢 | D20: \n16 | E20: \n* | F20: \n2 | G20: \n18 | H20: \n\u3000 | I20: \n3 | J20: \n8 | K20: \n* | L20: \n5 | M20: \n53 | N20: \n\u3000 | O20: \n5 | P20: \n4 | Q20: \n* | R20: \n7 | S20: \n3 | T20: \n\u3000 | U20: \n7 | V20: \n12 | W20: \n* | X20: \n9 | Y20: \n21 | Z20: \n\u3000 | AA20: \n10 | AB20: \n33 | AC20: \n* | AD20: \n11 | AE20: \n97 | AF20: \n4 | AG20: \n后胜0局 | AH20: \n16
A21: \n22 | B21: \n中国香港 | C21: \n黄志强 | D21: \n21 | E21: \n\u3000 | F21: \n2 | G21: \n19 | H21: \n* | I21: \n4 | J21: \n24 | K21: \n\u3000 | L21: \n5 | M21: \n40 | N21: \n* | O21: \n5 | P21: \n48 | Q21: \n\u3000 | R21: \n7 | S21: \n25 | T21: \n* | U21: \n7 | V21: \n30 | W21: \n\u3000 | X21: \n7 | Y21: \n12 | Z21: \n* | AA21: \n9 | AB21: \n43 | AC21: \n\u3000 | AD21: \n11 | AE21: \n93 | AF21: \n5 | AG21: \n\u3000 | AH21: \n17
A22: \n39 | B22: \n马来西亚 | C22: \n陈有发 | D22: \n40 | E22: \n* | F22: \n0 | G22: \n50 | H22: \n\u3000 | I22: \n2 | J22: \n54 | K22: \n* | L22: \n4 | M22: \n41 | N22: \n\u3000 | O22: \n6 | P22: \n38 | Q22: \n* | R22: \n7 | S22: \n34 | T22: \n\u3000 | U22: \n9 | V22: \n60 | W22: \n* | X22: \n9 | Y22: \n24 | Z22: \n\u3000 | AA22: \n9 | AB22: \n36 | AC22: \n* | AD22: \n11 | AE22: \n84 | AF22: \n5 | AG22: \n\u3000 | AH22: \n18
A23: \n21 | B23: \n越南 | C23: \n范启源 | D23: \n22 | E23: \n* | F23: \n0 | G23: \n20 | H23: \n\u3000 | I23: \n0 | J23: \n17 | K23: \n\u3000 | L23: \n2 | M23: \n31 | N23: \n* | O23: \n4 | P23: \n57 | Q23: \n\u3000 | R23: \n4 | S23: \n14 | T23: \n* | U23: \n6 | V23: \n51 | W23: \n\u3000 | X23: \n8 | Y23: \n15 | Z23: \n* | AA23: \n9 | AB23: \n30 | AC23: \n\u3000 | AD23: \n11 | AE23: \n78 | AF23: \n5 | AG23: \n\u3000 | AH23: \n19
A24: \n40 | B24: \n中华台北 | C24: \n阮明昭 | D24: \n39 | E24: \n\u3000 | F24: \n2 | G24: \n49 | H24: \n* | I24: \n4 | J24: \n38 | K24: \n* | L24: \n5 | M24: \n22 | N24: \n\u3000 | O24: \n7 | P24: \n60 | Q24: \n* | R24: \n8 | S24: \n42 | T24: \n\u3000 | U24: \n9 | V24: \n13 | W24: \n\u3000 | X24: \n9 | Y24: \n53 | Z24: \n* | AA24: \n10 | AB24: \n48 | AC24: \n\u3000 | AD24: \n10 | AE24: \n107 | AF24: \n3 | AG24: \n\u3000 | AH24: \n20
A25: \n57 | B25: \n越南 | C25: \n阮黄燕(女) | D25: \n58 | E25: \n* | F25: \n2 | G25: \n60 | H25: \n\u3000 | I25: \n2 | J25: \n61 | K25: \n* | L25: \n4 | M25: \n16 | N25: \n\u3000 | O25: \n4 | P25: \n21 | Q25: \n* | R25: \n6 | S25: \n49 | T25: \n\u3000 | U25: \n6 | V25: \n29 | W25: \n* | X25: \n8 | Y25: \n6 | Z25: \n\u3000 | AA25: \n10 | AB25: \n20 | AC25: \n* | AD25: \n10 | AE25: \n90 | AF25: \n5 | AG25: \n\u3000 | AH25: \n21
A26: \n16 | B26: \n越南 | C26: \n阮明日光 | D26: \n15 | E26: \n\u3000 | F26: \n0 | G26: \n17 | H26: \n* | I26: \n2 | J26: \n31 | K26: \n\u3000 | L26: \n4 | M26: \n57 | N26: \n* | O26: \n6 | P26: \n33 | Q26: \n\u3000 | R26: \n6 | S26: \n51 | T26: \n* | U26: \n8 | V26: \n6 | W26: \n* | X26: \n10 | Y26: \n3 | Z26: \n\u3000 | AA26: \n10 | AB26: \n49 | AC26: \n* | AD26: \n10 | AE26: \n86 | AF26: \n5 | AG26: \n\u3000 | AH26: \n22
A27: \n59 | B27: \n马来西亚 | C27: \n黄运兴 | D27: \n60 | E27: \n* | F27: \n0 | G27: \n58 | H27: \n\u3000 | I27: \n1 | J27: \n32 | K27: \n* | L27: \n2 | M27: \n61 | N27: \n\u3000 | O27: \n4 | P27: \n46 | Q27: \n* | R27: \n6 | S27: \n6 | T27: \n\u3000 | U27: \n6 | V27: \n56 | W27: \n* | X27: \n8 | Y27: \n20 | Z27: \n\u3000 | AA27: \n8 | AB27: \n29 | AC27: \n* | AD27: \n10 | AE27: \n84 | AF27: \n4 | AG27: \n\u3000 | AH27: \n23
A28: \n4 | B28: \n越南 | C28: \n汪洋北 | D28: \n3 | E28: \n\u3000 | F28: \n0 | G28: \n2 | H28: \n* | I28: \n2 | J28: \n55 | K28: \n\u3000 | L28: \n3 | M28: \n58 | N28: \n* | O28: \n5 | P28: \n15 | Q28: \n\u3000 | R28: \n5 | S28: \n11 | T28: \n* | U28: \n6 | V28: \n5 | W28: \n\u3000 | X28: \n8 | Y28: \n19 | Z28: \n* | AA28: \n10 | AB28: \n53 | AC28: \n\u3000 | AD28: \n10 | AE28: \n83 | AF28: \n4 | AG28: \n\u3000 | AH28: \n24
A29: \n46 | B29: \n荷兰 | C29: \n吴永生 | D29: \n45 | E29: \n\u3000 | F29: \n2 | G29: \n55 | H29: \n* | I29: \n3 | J29: \n53 | K29: \n\u3000 | L29: \n3 | M29: \n5 | N29: \n* | O29: \n4 | P29: \n59 | Q29: \n\u3000 | R29: \n4 | S29: \n9 | T29: \n* | U29: \n6 | V29: \n41 | W29: \n\u3000 | X29: \n7 | Y29: \n32 | Z29: \n* | AA29: \n8 | AB29: \n27 | AC29: \n\u3000 | AD29: \n10 | AE29: \n77 | AF29: \n3 | AG29: \n\u3000 | AH29: \n25
A30: \n30 | B30: \n新加坡 | C30: \n黄俊铭 | D30: \n29 | E30: \n\u3000 | F30: \n2 | G30: \n33 | H30: \n* | I30: \n4 | J30: \n28 | K30: \n*- | L30: \n4 | M30: \n18 | N30: \n\u3000 | O30: \n5 | P30: \n34 | Q30: \n* | R30: \n5 | S30: \n26 | T30: \n\u3000 | U30: \n7 | V30: \n22 | W30: \n* | X30: \n9 | Y30: \n38 | Z30: \n\u3000 | AA30: \n9 | AB30: \n21 | AC30: \n* | AD30: \n9 | AE30: \n95 | AF30: \n4 | AG30: \n\u3000 | AH30: \n26
A31: \n19 | B31: \n中国香港 | C31: \n翁德強 | D31: \n20 | E31: \n* | F31: \n2 | G31: \n22 | H31: \n\u3000 | I31: \n2 | J31: \n12 | K31: \n* | L31: \n4 | M31: \n25 | N31: \n\u3000 | O31: \n4 | P31: \n41 | Q31: \n* | R31: \n6 | S31: \n5 | T31: \n* | U31: \n8 | V31: \n49 | W31: \n\u3000 | X31: \n8 | Y31: \n4 | Z31: \n\u3000 | AA31: \n8 | AB31: \n11 | AC31: \n* | AD31: \n9 | AE31: \n93 | AF31: \n4 | AG31: \n\u3000 | AH31: \n27
A32: \n11 | B32: \n越南 | C32: \n吴兰香(女) | D32: \n12 | E32: \n* | F32: \n2 | G32: \n8 | H32: \n\u3000 | I32: \n3 | J32: \n18 | K32: \n* | L32: \n4 | M32: \n1 | N32: \n* | O32: \n4 | P32: \n36 | Q32: \n\u3000 | R32: \n5 | S32: \n4 | T32: \n\u3000 | U32: \n6 | V32: \n20 | W32: \n* | X32: \n6 | Y32: \n9 | Z32: \n* | AA32: \n8 | AB32: \n19 | AC32: \n\u3000 | AD32: \n9 | AE32: \n90 | AF32: \n2 | AG32: \n\u3000 | AH32: \n28
A33: \n6 | B33: \n马来西亚 | C33: \n黎金福 | D33: \n5 | E33: \n\u3000 | F33: \n1 | G33: \n53 | H33: \n* | I33: \n1 | J33: \n27 | K33: \n\u3000 | L33: \n3 | M33: \n8 | N33: \n\u3000 | O33: \n5 | P33: \n49 | Q33: \n* | R33: \n6 | S33: \n59 | T33: \n* | U33: \n8 | V33: \n16 | W33: \n\u3000 | X33: \n8 | Y33: \n57 | Z33: \n* | AA33: \n8 | AB33: \n31 | AC33: \n\u3000 | AD33: \n9 | AE33: \n86 | AF33: \n3 | AG33: \n\u3000 | AH33: \n29
A34: \n31 | B34: \n德国 | C34: \n濮方尧 | D34: \n32 | E34: \n* | F34: \n2 | G34: \n28 | H34: \n\u3000 | I34: \n2 | J34: \n16 | K34: \n* | L34: \n2 | M34: \n21 | N34: \n\u3000 | O34: \n2 | P34: \n61 | Q34: \n* | R34: \n4 | S34: \n50 | T34: \n\u3000 | U34: \n5 | V34: \n26 | W34: \n* | X34: \n6 | Y34: \n56 | Z34: \n\u3000 | AA34: \n8 | AB34: \n6 | AC34: \n* | AD34: \n9 | AE34: \n85 | AF34: \n3 | AG34: \n\u3000 | AH34: \n30
A35: \n43 | B35: \n新加坡 | C35: \n康德荣 | D35: \n44 | E35: \n* | F35: \n2 | G35: \n38 | H35: \n\u3000 | I35: \n2 | J35: \n47 | K35: \n* | L35: \n4 | M35: \n49 | N35: \n\u3000 | O35: \n5 | P35: \n18 | Q35: \n* | R35: \n5 | S35: \n36 | T35: \n\u3000 | U35: \n5 | V35: \n50 | W35: \n* | X35: \n7 | Y35: \n34 | Z35: \n\u3000 | AA35: \n9 | AB35: \n22 | AC35: \n* | AD35: \n9 | AE35: \n80 | AF35: \n4 | AG35: \n\u3000 | AH35: \n31
A36: \n41 | B36: \n新加坡 | C36: \n蔡俊杰 | D36: \n42 | E36: \n* | F36: \n0 | G36: \n52 | H36: \n\u3000 | I36: \n2 | J36: \n56 | K36: \n* | L36: \n4 | M36: \n39 | N36: \n* | O36: \n4 | P36: \n19 | Q36: \n\u3000 | R36: \n4 | S36: \n58 | T36: \n\u3000 | U36: \n5 | V36: \n46 | W36: \n* | X36: \n6 | Y36: \n54 | Z36: \n\u3000 | AA36: \n7 | AB36: \n34 | AC36: \n* | AD36: \n9 | AE36: \n79 | AF36: \n3 | AG36: \n\u3000 | AH36: \n32
A37: \n36 | B37: \n中国香港 | C37: \n陈永乐 | D37: \n35 | E37: \n\u3000 | F37: \n1 | G37: \n5 | H37: \n* | I37: \n1 | J37: \n58 | K37: \n\u3000 | L37: \n2 | M37: \n44 | N37: \n\u3000 | O37: \n4 | P37: \n11 | Q37: \n* | R37: \n5 | S37: \n43 | T37: \n* | U37: \n7 | V37: \n53 | W37: \n\u3000 | X37: \n7 | Y37: \n37 | Z37: \n* | AA37: \n9 | AB37: \n39 | AC37: \n\u3000 | AD37: \n9 | AE37: \n77 | AF37: \n3 | AG37: \n\u3000 | AH37: \n33
A38: \n32 | B38: \n越南 | C38: \n黎明智 | D38: \n31 | E38: \n\u3000 | F38: \n0 | G38: \n27 | H38: \n* | I38: \n1 | J38: \n59 | K38: \n\u3000 | L38: \n2 | M38: \n26 | N38: \n* | O38: \n3 | P38: \n23 | Q38: \n\u3000 | R38: \n5 | S38: \n37 | T38: \n* | U38: \n5 | V38: \n8 | W38: \n* | X38: \n7 | Y38: \n46 | Z38: \n\u3000 | AA38: \n8 | AB38: \n61 | AC38: \n* | AD38: \n9 | AE38: \n77 | AF38: \n2 | AG38: \n\u3000 | AH38: \n34
A39: \n37 | B39: \n中国香港 | C39: \n蓝政鸿 | D39: \n38 | E39: \n* | F39: \n0 | G39: \n44 | H39: \n\u3000 | I39: \n2 | J39: \n34 | K39: \n* | L39: \n2 | M39: \n47 | N39: \n\u3000 | O39: \n4 | P39: \n12 | Q39: \n* | R39: \n5 | S39: \n32 | T39: \n\u3000 | U39: \n7 | V39: \n48 | W39: \n* | X39: \n7 | Y39: \n36 | Z39: \n\u3000 | AA39: \n7 | AB39: \n50 | AC39: \n* | AD39: \n9 | AE39: \n74 | AF39: \n4 | AG39: \n后胜3局 | AH39: \n35
A40: \n12 | B40: \n加拿大 | C40: \n顾亿庆 | D40: \n11 | E40: \n\u3000 | F40: \n0 | G40: \n7 | H40: \n* | I40: \n2 | J40: \n19 | K40: \n\u3000 | L40: \n2 | M40: \n10 | N40: \n* | O40: \n4 | P40: \n37 | Q40: \n\u3000 | R40: \n5 | S40: \n55 | T40: \n* | U40: \n7 | V40: \n15 | W40: \n\u3000 | X40: \n7 | Y40: \n22 | Z40: \n\u3000 | AA40: \n7 | AB40: \n8 | AC40: \n* | AD40: \n9 | AE40: \n74 | AF40: \n4 | AG40: \n后胜0局 | AH40: \n36
A41: \n61 | B41: \n马来西亚 | C41: \n吴将玮 | D41: \n62 | E41: \n*+ | F41: \n2 | G41: \n48 | H41: \n\u3000 | I41: \n2 | J41: \n57 | K41: \n\u3000 | L41: \n2 | M41: \n59 | N41: \n* | O41: \n2 | P41: \n31 | Q41: \n\u3000 | R41: \n2 | S41: \n45 | T41: \n* | U41: \n4 | V41: \n14 | W41: \n\u3000 | X41: \n6 | Y41: \n51 | Z41: \n* | AA41: \n8 | AB41: \n32 | AC41: \n\u3000 | AD41: \n9 | AE41: \n71 | AF41: \n4 | AG41: \n\u3000 | AH41: \n37
A42: \n55 | B42: \n马来西亚 | C42: \n姚威和 | D42: \n56 | E42: \n* | F42: \n2 | G42: \n46 | H42: \n\u3000 | I42: \n3 | J42: \n4 | K42: \n* | L42: \n4 | M42: \n3 | N42: \n\u3000 | O42: \n4 | P42: \n20 | Q42: \n* | R42: \n4 | S42: \n12 | T42: \n\u3000 | U42: \n4 | V42: \n52 | W42: \n\u3000 | X42: \n6 | Y42: \n58 | Z42: \n* | AA42: \n7 | AB42: \n54 | AC42: \n\u3000 | AD42: \n8 | AE42: \n83 | AF42: \n2 | AG42: \n\u3000 | AH42: \n38
A43: \n5 | B43: \n中国香港 | C43: \n雷雄才 | D43: \n6 | E43: \n* | F43: \n1 | G43: \n36 | H43: \n\u3000 | I43: \n3 | J43: \n60 | K43: \n* | L43: \n3 | M43: \n46 | N43: \n\u3000 | O43: \n4 | P43: \n35 | Q43: \n* | R43: \n6 | S43: \n19 | T43: \n\u3000 | U43: \n6 | V43: \n4 | W43: \n* | X43: \n6 | Y43: \n8 | Z43: \n\u3000 | AA43: \n6 | AB43: \n10 | AC43: \n\u3000 | AD43: \n8 | AE43: \n80 | AF43: \n3 | AG43: \n\u3000 | AH43: \n39
A44: \n54 | B44: \n中国香港 | C44: \n谭伟伦 | D44: \n53 | E44: \n\u3000 | F44: \n1 | G44: \n35 | H44: \n* | I44: \n2 | J44: \n39 | K44: \n\u3000 | L44: \n2 | M44: \n50 | N44: \n* | O44: \n3 | P44: \n10 | Q44: \n\u3000 | R44: \n5 | S44: \n48 | T44: \n* | U44: \n5 | V44: \n58 | W44: \n\u3000 | X44: \n6 | Y44: \n41 | Z44: \n* | AA44: \n7 | AB44: \n55 | AC44: \n* | AD44: \n8 | AE44: \n80 | AF44: \n1 | AG44: \n\u3000 | AH44: \n40
A45: \n26 | B45: \n中华台北 | C45: \n游原硕 | D45: \n25 | E45: \n\u3000 | F45: \n0 | G45: \n23 | H45: \n* | I45: \n2 | J45: \n35 | K45: \n\u3000 | L45: \n2 | M45: \n32 | N45: \n\u3000 | O45: \n3 | P45: \n8 | Q45: \n* | R45: \n5 | S45: \n30 | T45: \n* | U45: \n5 | V45: \n31 | W45: \n\u3000 | X45: \n6 | Y45: \n27 | Z45: \n* | AA45: \n6 | AB45: \n58 | AC45: \n\u3000 | AD45: \n8 | AE45: \n77 | AF45: \n3 | AG45: \n\u3000 | AH45: \n41
A46: \n27 | B46: \n马来西亚 | C46: \n苏怡龙 | D46: \n28 | E46: \n* | F46: \n0 | G46: \n32 | H46: \n\u3000 | I46: \n1 | J46: \n6 | K46: \n* | L46: \n1 | M46: \n29 | N46: \n\u3000 | O46: \n1 | P46: \n52 | Q46: \n* | R46: \n2 | S46: \n47 | T46: \n\u3000 | U46: \n4 | V46: \n17 | W46: \n* | X46: \n6 | Y46: \n26 | Z46: \n\u3000 | AA46: \n8 | AB46: \n46 | AC46: \n* | AD46: \n8 | AE46: \n74 | AF46: \n3 | AG46: \n\u3000 | AH46: \n42
A47: \n35 | B47: \n中华台北 | C47: \n许明龙 | D47: \n36 | E47: \n* | F47: \n1 | G47: \n54 | H47: \n\u3000 | I47: \n2 | J47: \n26 | K47: \n* | L47: \n4 | M47: \n33 | N47: \n* | O47: \n4 | P47: \n5 | Q47: \n\u3000 | R47: \n4 | S47: \n56 | T47: \n\u3000 | U47: \n4 | V47: \n2 | W47: \n* | X47: \n6 | Y47: \n29 | Z47: \n\u3000 | AA47: \n6 | AB47: \n14 | AC47: \n\u3000 | AD47: \n8 | AE47: \n73 | AF47: \n3 | AG47: \n\u3000 | AH47: \n43
A48: \n29 | B48: \n越南 | C48: \n陈慧莹(女) | D48: \n30 | E48: \n* | F48: \n0 | G48: \n34 | H48: \n\u3000 | I48: \n0 | J48: \n23 | K48: \n\u3000 | L48: \n1 | M48: \n27 | N48: \n* | O48: \n3 | P48: \n50 | Q48: \n\u3000 | R48: \n4 | S48: \n7 | T48: \n* | U48: \n6 | V48: \n57 | W48: \n\u3000 | X48: \n6 | Y48: \n35 | Z48: \n* | AA48: \n8 | AB48: \n59 | AC48: \n\u3000 | AD48: \n8 | AE48: \n70 | AF48: \n3 | AG48: \n\u3000 | AH48: \n44
A49: \n56 | B49: \n日本 | C49: \n所司和晴 | D49: \n55 | E49: \n\u3000 | F49: \n0 | G49: \n45 | H49: \n* | I49: \n2 | J49: \n41 | K49: \n\u3000 | L49: \n2 | M49: \n9 | N49: \n* | O49: \n4 | P49: \n51 | Q49: \n\u3000 | R49: \n4 | S49: \n35 | T49: \n* | U49: \n6 | V49: \n59 | W49: \n\u3000 | X49: \n6 | Y49: \n31 | Z49: \n* | AA49: \n6 | AB49: \n47 | AC49: \n\u3000 | AD49: \n8 | AE49: \n69 | AF49: \n4 | AG49: \n\u3000 | AH49: \n45
A50: \n9 | B50: \n美国 | C50: \n李新达 | D50: \n10 | E50: \n* | F50: \n0 | G50: \n14 | H50: \n\u3000 | I50: \n0 | J50: \n52 | K50: \n* | L50: \n2 | M50: \n56 | N50: \n\u3000 | O50: \n2 | P50: \n47 | Q50: \n* | R50: \n4 | S50: \n46 | T50: \n\u3000 | U50: \n4 | V50: \n7 | W50: \n* | X50: \n6 | Y50: \n11 | Z50: \n\u3000 | AA50: \n6 | AB50: \n51 | AC50: \n\u3000 | AD50: \n8 | AE50: \n61 | AF50: \n4 | AG50: \n\u3000 | AH50: \n46
A51: \n34 | B51: \n汶莱 | C51: \n庄力铭 | D51: \n33 | E51: \n\u3000 | F51: \n0 | G51: \n29 | H51: \n* | I51: \n2 | J51: \n37 | K51: \n\u3000 | L51: \n4 | M51: \n48 | N51: \n* | O51: \n5 | P51: \n30 | Q51: \n\u3000 | R51: \n7 | S51: \n39 | T51: \n* | U51: \n7 | V51: \n24 | W51: \n\u3000 | X51: \n7 | Y51: \n43 | Z51: \n* | AA51: \n7 | AB51: \n41 | AC51: \n\u3000 | AD51: \n7 | AE51: \n90 | AF51: \n3 | AG51: \n\u3000 | AH51: \n47
A52: \n50 | B52: \n新加坡 | C52: \n赵金山 | D52: \n49 | E52: \n\u3000 | F52: \n0 | G52: \n39 | H52: \n* | I52: \n0 | J52: \n7 | K52: \n\u3000 | L52: \n2 | M52: \n54 | N52: \n\u3000 | O52: \n3 | P52: \n29 | Q52: \n* | R52: \n4 | S52: \n31 | T52: \n* | U52: \n5 | V52: \n43 | W52: \n\u3000 | X52: \n5 | Y52: \n23 | Z52: \n* | AA52: \n7 | AB52: \n37 | AC52: \n\u3000 | AD52: \n7 | AE52: \n77 | AF52: \n2 | AG52: \n\u3000 | AH52: \n48
A53: \n58 | B53: \n中国香港 | C53: \n欧志强 | D53: \n57 | E53: \n\u3000 | F53: \n0 | G53: \n59 | H53: \n* | I53: \n1 | J53: \n36 | K53: \n* | L53: \n2 | M53: \n4 | N53: \n\u3000 | O53: \n2 | P53: \n45 | Q53: \n\u3000 | R53: \n4 | S53: \n41 | T53: \n* | U53: \n5 | V53: \n54 | W53: \n* | X53: \n6 | Y53: \n55 | Z53: \n\u3000 | AA53: \n7 | AB53: \n26 | AC53: \n* | AD53: \n7 | AE53: \n77 | AF53: \n1 | AG53: \n\u3000 | AH53: \n49
A54: \n8 | B54: \n法国 | C54: \n胡伟长 | D54: \n7 | E54: \n\u3000 | F54: \n2 | G54: \n11 | H54: \n* | I54: \n3 | J54: \n15 | K54: \n\u3000 | L54: \n3 | M54: \n6 | N54: \n* | O54: \n3 | P54: \n26 | Q54: \n\u3000 | R54: \n3 | S54: \n23 | T54: \n* | U54: \n5 | V54: \n32 | W54: \n\u3000 | X54: \n5 | Y54: \n5 | Z54: \n* | AA54: \n7 | AB54: \n12 | AC54: \n\u3000 | AD54: \n7 | AE54: \n74 | AF54: \n3 | AG54: \n\u3000 | AH54: \n50
A55: \n23 | B55: \n中国香港 | C55: \n黄树楷 | D55: \n24 | E55: \n* | F55: \n0 | G55: \n26 | H55: \n\u3000 | I55: \n0 | J55: \n29 | K55: \n* | L55: \n1 | M55: \n52 | N55: \n\u3000 | O55: \n3 | P55: \n32 | Q55: \n* | R55: \n3 | S55: \n8 | T55: \n\u3000 | U55: \n3 | V55: \n44 | W55: \n* | X55: \n5 | Y55: \n50 | Z55: \n\u3000 | AA55: \n5 | AB55: \n17 | AC55: \n*+ | AD55: \n7 | AE55: \n64 | AF55: \n3 | AG55: \n\u3000 | AH55: \n51
A56: \n14 | B56: \n新加坡 | C56: \n巫宇斌 | D56: \n13 | E56: \n\u3000 | F56: \n0 | G56: \n9 | H56: \n* | I56: \n2 | J56: \n25 | K56: \n\u3000 | L56: \n2 | M56: \n20 | N56: \n\u3000 | O56: \n2 | P56: \n2 | Q56: \n* | R56: \n4 | S56: \n21 | T56: \n\u3000 | U56: \n4 | V56: \n61 | W56: \n* | X56: \n4 | Y56: \n17 | Z56: \n\u3000 | AA56: \n6 | AB56: \n35 | AC56: \n* | AD56: \n6 | AE56: \n84 | AF56: \n3 | AG56: \n\u3000 | AH56: \n52
A57: \n51 | B57: \n英国 | C57: \n彭铂 | D57: \n52 | E57: \n* | F57: \n2 | G57: \n42 | H57: \n\u3000 | I57: \n2 | J57: \n49 | K57: \n\u3000 | L57: \n2 | M57: \n45 | N57: \n* | O57: \n4 | P57: \n56 | Q57: \n* | R57: \n6 | S57: \n16 | T57: \n\u3000 | U57: \n6 | V57: \n21 | W57: \n* | X57: \n6 | Y57: \n61 | Z57: \n\u3000 | AA57: \n6 | AB57: \n9 | AC57: \n* | AD57: \n6 | AE57: \n82 | AF57: \n3 | AG57: \n\u3000 | AH57: \n53
A58: \n10 | B58: \n中国香港 | C58: \n黄照 | D58: \n9 | E58: \n\u3000 | F58: \n2 | G58: \n13 | H58: \n* | I58: \n2 | J58: \n1 | K58: \n\u3000 | L58: \n2 | M58: \n12 | N58: \n\u3000 | O58: \n2 | P58: \n54 | Q58: \n* | R58: \n2 | S58: \n2 | T58: \n\u3000 | U58: \n2 | V58: \n62 | W58: \n*+ | X58: \n4 | Y58: \n7 | Z58: \n\u3000 | AA58: \n6 | AB58: \n5 | AC58: \n* | AD58: \n6 | AE58: \n73 | AF58: \n3 | AG58: \n\u3000 | AH58: \n54
A59: \n47 | B59: \n澳大利亚 | C59: \n邓宜兵 | D59: \n48 | E59: \n* | F59: \n0 | G59: \n62 | H59: \n+ | I59: \n2 | J59: \n43 | K59: \n\u3000 | L59: \n2 | M59: \n37 | N59: \n* | O59: \n2 | P59: \n9 | Q59: \n\u3000 | R59: \n2 | S59: \n27 | T59: \n* | U59: \n2 | V59: \n45 | W59: \n\u3000 | X59: \n4 | Y59: \n2 | Z59: \n\u3000 | AA59: \n6 | AB59: \n56 | AC59: \n* | AD59: \n6 | AE59: \n69 | AF59: \n3 | AG59: \n\u3000 | AH59: \n55
A60: \n2 | B60: \n加拿大 | C60: \n郑世豪 | D60: \n1 | E60: \n\u3000 | F60: \n0 | G60: \n4 | H60: \n\u3000 | I60: \n0 | J60: \n44 | K60: \n* | L60: \n0 | M60: \n17 | N60: \n* | O60: \n2 | P60: \n14 | Q60: \n\u3000 | R60: \n2 | S60: \n10 | T60: \n* | U60: \n4 | V60: \n35 | W60: \n\u3000 | X60: \n4 | Y60: \n47 | Z60: \n* | AA60: \n4 | AB60: \n62 | AC60: \n*+ | AD60: \n6 | AE60: \n61 | AF60: \n3 | AG60: \n\u3000 | AH60: \n56
A61: \n52 | B61: \n澳大利亚 | C61: \n余穗康 | D61: \n51 | E61: \n\u3000 | F61: \n0 | G61: \n41 | H61: \n* | I61: \n0 | J61: \n9 | K61: \n\u3000 | L61: \n0 | M61: \n23 | N61: \n* | O61: \n0 | P61: \n27 | Q61: \n\u3000 | R61: \n1 | S61: \n62 | T61: \n+ | U61: \n3 | V61: \n55 | W61: \n* | X61: \n3 | Y61: \n45 | Z61: \n* | AA61: \n4 | AB61: \n7 | AC61: \n\u3000 | AD61: \n6 | AE61: \n59 | AF61: \n2 | AG61: \n\u3000 | AH61: \n57
A62: \n45 | B62: \n芬兰 | C62: \n邓明高 | D62: \n46 | E62: \n* | F62: \n0 | G62: \n56 | H62: \n\u3000 | I62: \n0 | J62: \n62 | K62: \n*+ | L62: \n2 | M62: \n51 | N62: \n\u3000 | O62: \n2 | P62: \n58 | Q62: \n* | R62: \n2 | S62: \n61 | T62: \n\u3000 | U62: \n2 | V62: \n47 | W62: \n* | X62: \n2 | Y62: \n52 | Z62: \n\u3000 | AA62: \n3 | AB62: \n44 | AC62: \n* | AD62: \n5 | AE62: \n60 | AF62: \n2 | AG62: \n\u3000 | AH62: \n58
A63: \n17 | B63: \n荷兰 | C63: \n余晓兰(女) | D63: \n18 | E63: \n* | F63: \n0 | G63: \n16 | H63: \n\u3000 | I63: \n0 | J63: \n21 | K63: \n* | L63: \n0 | M63: \n2 | N63: \n\u3000 | O63: \n0 | P63: \n62 | Q63: \n*+ | R63: \n2 | S63: \n44 | T63: \n\u3000 | U63: \n4 | V63: \n27 | W63: \n\u3000 | X63: \n4 | Y63: \n14 | Z63: \n* | AA63: \n4 | AB63: \n23 | AC63: \n- | AD63: \n4 | AE63: \n69 | AF63: \n2 | AG63: \n\u3000 | AH63: \n59
A64: \n7 | B64: \n澳大利亚 | C64: \n陈一鸣 | D64: \n8 | E64: \n* | F64: \n0 | G64: \n12 | H64: \n\u3000 | I64: \n0 | J64: \n50 | K64: \n* | L64: \n0 | M64: \n62 | N64: \n+ | O64: \n2 | P64: \n44 | Q64: \n* | R64: \n4 | S64: \n29 | T64: \n\u3000 | U64: \n4 | V64: \n9 | W64: \n\u3000 | X64: \n4 | Y64: \n10 | Z64: \n* | AA64: \n4 | AB64: \n52 | AC64: \n* | AD64: \n4 | AE64: \n59 | AF64: \n2 | AG64: \n\u3000 | AH64: \n60
A65: \n44 | B65: \n日本 | C65: \n三桥泰朗 | D65: \n43 | E65: \n\u3000 | F65: \n0 | G65: \n37 | H65: \n* | I65: \n0 | J65: \n2 | K65: \n\u3000 | L65: \n2 | M65: \n36 | N65: \n* | O65: \n2 | P65: \n7 | Q65: \n\u3000 | R65: \n2 | S65: \n17 | T65: \n* | U65: \n2 | V65: \n23 | W65: \n\u3000 | X65: \n2 | Y65: \n62 | Z65: \n*+ | AA65: \n4 | AB65: \n45 | AC65: \n\u3000 | AD65: \n4 | AE65: \n57 | AF65: \n2 | AG65: \n\u3000 | AH65: \n61
A66: \n62 | B66: \n轮空 | C66: \n轮空 | D66: \n61 | E66: \n- | F66: \n0 | G66: \n47 | H66: \n*- | I66: \n0 | J66: \n45 | K66: \n- | L66: \n0 | M66: \n7 | N66: \n*- | O66: \n0 | P66: \n17 | Q66: \n- | R66: \n0 | S66: \n52 | T66: \n*- | U66: \n0 | V66: \n10 | W66: \n- | X66: \n0 | Y66: \n44 | Z66: \n- | AA66: \n0 | AB66: \n2 | AC66: \n*- | AD66: \n0 | AE66: \n50 | AF66: \n0 | AG66: \n\u3000 | AH66: \n62

A1: \n \n \n \n裁判长：蔡伟林 2012年9月17日—21日·凤岗 \n[此贴子已经被作者于2012-9-21 12:43:04编辑过]

A1: \n第5届“杨官璘杯”全国象棋公开赛 专业组（男子）名次
A2: \n | B2: \n | C2: \n | D2: \n | E2: \n | F2: \n | G2: \n | H2: \n
A3: \n名次 | B3: \n代表队 | C3: \n姓 名 | D3: \n积分 | E3: \n对手分 | F3: \n胜局 | G3: \n犯规 | H3: \n备注
A4: \n 1 | B4: \n湖北 | C4: \n洪 智 | D4: \n14 | E4: \n88 | F4: \n5 | G4: \n\u3000 | H4: \n\u3000
A5: \n 2 | B5: \n湖北 | C5: \n汪 洋 | D5: \n13 | E5: \n92 | F5: \n4 | G5: \n\u3000 | H5: \n\u3000
A6: \n 3 | B6: \n浙江 | C6: \n赵鑫鑫 | D6: \n12 | E6: \n95 | F6: \n3 | G6: \n\u3000 | H6: \n\u3000
A7: \n 4 | B7: \n厦门 | C7: \n郑一泓 | D7: \n11 | E7: \n88 | F7: \n4 | G7: \n\u3000 | H7: \n\u3000
A8: \n 5 | B8: \n北京 | C8: \n蒋 川 | D8: \n10 | E8: \n89 | F8: \n2 | G8: \n\u3000 | H8: \n\u3000
A9: \n 6 | B9: \n上海 | C9: \n孙勇征 | D9: \n10 | E9: \n87 | F9: \n3 | G9: \n\u3000 | H9: \n\u3000
A10: \n 7 | B10: \n河北 | C10: \n申 鹏 | D10: \n10 | E10: \n85 | F10: \n3 | G10: \n\u3000 | H10: \n\u3000
A11: \n 8 | B11: \n北京 | C11: \n张 强 | D11: \n10 | E11: \n84 | F11: \n3 | G11: \n\u3000 | H11: \n\u3000
A12: \n 9 | B12: \n黑龙江 | C12: \n聂铁文 | D12: \n9 | E12: \n93 | F12: \n2 | G12: \n\u3000 | H12: \n\u3000
A13: \n10 | B13: \n四川 | C13: \n郑惟桐 | D13: \n9 | E13: \n89 | F13: \n2 | G13: \n\u3000 | H13: \n\u3000
A14: \n11 | B14: \n浙江 | C14: \n黄竹风 | D14: \n9 | E14: \n88 | F14: \n1 | G14: \n\u3000 | H14: \n\u3000
A15: \n12 | B15: \n上海 | C15: \n谢 靖 | D15: \n9 | E15: \n87 | F15: \n2 | G15: \n\u3000 | H15: \n\u3000
A16: \n13 | B16: \n上海 | C16: \n万春林 | D16: \n9 | E16: \n73 | F16: \n3 | G16: \n\u3000 | H16: \n\u3000
A17: \n14 | B17: \n浙江 | C17: \n于幼华 | D17: \n9 | E17: \n67 | F17: \n3 | G17: \n\u3000 | H17: \n\u3000
A18: \n15 | B18: \n广东 | C18: \n张学潮 | D18: \n8 | E18: \n80 | F18: \n2 | G18: \n\u3000 | H18: \n\u3000
A19: \n16 | B19: \n河南 | C19: \n李少庚 | D19: \n8 | E19: \n73 | F19: \n2 | G19: \n\u3000 | H19: \n\u3000
A20: \n17 | B20: \n湖北 | C20: \n李雪松 | D20: \n8 | E20: \n64 | F20: \n0 | G20: \n\u3000 | H20: \n\u3000
A21: \n18 | B21: \n江苏 | C21: \n徐天红 | D21: \n7 | E21: \n75 | F21: \n1 | G21: \n\u3000 | H21: \n\u3000
A22: \n19 | B22: \n湖北 | C22: \n柳大华 | D22: \n7 | E22: \n72 | F22: \n2 | G22: \n\u3000 | H22: \n\u3000
A23: \n20 | B23: \n黑龙江 | C23: \n陶汉明 | D23: \n7 | E23: \n70 | F23: \n2 | G23: \n\u3000 | H23: \n\u3000
A24: \n21 | B24: \n河北 | C24: \n陆伟韬 | D24: \n6 | E24: \n71 | F24: \n1 | G24: \n\u3000 | H24: \n\u3000
A25: \n22 | B25: \n火车头 | C25: \n孙 博 | D25: \n3 | E25: \n72 | F25: \n1 | G25: \n\u3000 | H25: \n\u3000
A26: \n

A1: \n \n \n \n \n比赛地点：凤岗 比赛时间：2012年9月17-21日 \n裁判长：蔡伟林 编排：刘 征 \n[此贴子已经被作者于2012-9-21 12:33:45编辑过]

A1: \n第五届“杨官璘杯”全国象棋公开赛 女子组 成绩表
A3: \n代号 | B3: \n单 位 | C3: \n姓 名 | D3: \n对手号及成绩 | N3: \n积 分 | O3: \n小 分 | P3: \n胜局 | Q3: \n备注 | R3: \n名次
D4: \n1 | E4: \n2 | F4: \n3 | G4: \n4 | H4: \n5 | I4: \n6 | J4: \n7 | K4: \n8 | L4: \n9 | M4: \n10
A5: \n1 | B5: \n云南 | C5: \n \n \n | D5: \n\u3000 | E5: 1 | F5: 1 | G5: 0 | H5: 1 | I5: 1 | J5: 0 | K5: 2 | L5: 1 | M5: 2 | N5: =SUM(D5:M5) -> 9 | O5: =(D5*N$5+E5*N$6+F5*N$7+G5*N$8+H5*N$9+I5*N$10+J5*N$11+K5*N$12+L5*N$13+M5*N$14)/2 -> 37 | P5: =COUNTIF(D5:M5,2) -> \n2 | Q5: \n\u3000 | R5: \n7
A6: \n2 | B6: \n江苏 | C6: \n杨伊 | D6: 1 | E6: \n\u3000 | F6: 0 | G6: 1 | H6: 1 | I6: 2 | J6: 1 | K6: 1 | L6: 0 | M6: 2 | N6: =SUM(D6:M6) -> 9 | O6: =(D6*N$5+E6*N$6+F6*N$7+G6*N$8+H6*N$9+I6*N$10+J6*N$11+K6*N$12+L6*N$13+M6*N$14)/2 -> 37 | P6: =COUNTIF(D6:M6,2) -> \n2 | Q6: \n对局时后走 | R6: \n6
A7: \n3 | B7: \n河北 | C7: \n玉思源 | D7: 1 | E7: 2 | F7: \n\u3000 | G7: 1 | H7: 1 | I7: 1 | J7: 1 | K7: 1 | L7: 0 | M7: 1 | N7: =SUM(D7:M7) -> 9 | O7: =(D7*N$5+E7*N$6+F7*N$7+G7*N$8+H7*N$9+I7*N$10+J7*N$11+K7*N$12+L7*N$13+M7*N$14)/2 -> 39 | P7: =COUNTIF(D7:M7,2) -> \n1 | Q7: \n\u3000 | R7: \n5
A8: \n4 | B8: \n广东 | C8: \n陈幸琳 | D8: 2 | E8: 1 | F8: 1 | G8: \n\u3000 | H8: 1 | I8: 2 | J8: 0 | K8: 1 | L8: 0 | M8: 0 | N8: =SUM(D8:M8) -> 8 | O8: =(D8*N$5+E8*N$6+F8*N$7+G8*N$8+H8*N$9+I8*N$10+J8*N$11+K8*N$12+L8*N$13+M8*N$14)/2 -> 29.5 | P8: =COUNTIF(D8:M8,2) -> \n2 | Q8: \n\u3000 | R8: \n8
A9: \n5 | B9: \n河北 | C9: \n张婷婷 | D9: 1 | E9: 1 | F9: 1 | G9: 1 | H9: \n\u3000 | I9: 1 | J9: 0 | K9: 2 | L9: 1 | M9: 2 | N9: =SUM(D9:M9) -> 10 | O9: =(D9*N$5+E9*N$6+F9*N$7+G9*N$8+H9*N$9+I9*N$10+J9*N$11+K9*N$12+L9*N$13+M9*N$14)/2 -> 40.5 | P9: =COUNTIF(D9:M9,2) -> \n2 | Q9: \n\u3000 | R9: \n4
A10: \n6 | B10: \n广东 | C10: \n蒋倩仪 | D10: 1 | E10: 0 | F10: 1 | G10: 0 | H10: 1 | I10: \n\u3000 | J10: 0 | K10: 1 | L10: 0 | M10: 0 | N10: =SUM(D10:M10) -> 4 | O10: =(D10*N$5+E10*N$6+F10*N$7+G10*N$8+H10*N$9+I10*N$10+J10*N$11+K10*N$12+L10*N$13+M10*N$14)/2 -> 16.5 | P10: =COUNTIF(D10:M10,2) -> \n0 | Q10: \n\u3000 | R10: \n10
A11: \n7 | B11: \n北京 | C11: \n唐丹 | D11: 2 | E11: 1 | F11: 1 | G11: 2 | H11: 2 | I11: 2 | J11: \n\u3000 | K11: 2 | L11: 1 | M11: 1 | N11: =SUM(D11:M11) -> 14 | O11: =(D11*N$5+E11*N$6+F11*N$7+G11*N$8+H11*N$9+I11*N$10+J11*N$11+K11*N$12+L11*N$13+M11*N$14)/2 -> 56 | P11: =COUNTIF(D11:M11,2) -> \n5 | Q11: \n\u3000 | R11: \n1
A12: \n8 | B12: \n广东 | C12: \n时凤兰 | D12: 0 | E12: 1 | F12: 1 | G12: 1 | H12: 0 | I12: 1 | J12: 0 | K12: \n\u3000 | L12: 1 | M12: 0 | N12: =SUM(D12:M12) -> 5 | O12: =(D12*N$5+E12*N$6+F12*N$7+G12*N$8+H12*N$9+I12*N$10+J12*N$11+K12*N$12+L12*N$13+M12*N$14)/2 -> 21 | P12: =COUNTIF(D12:M12,2) -> \n0 | Q12: \n\u3000 | R12: \n9
A13: \n9 | B13: \n河北 | C13: \n尤颖钦 | D13: 1 | E13: 2 | F13: 2 | G13: 2 | H13: 1 | I13: 2 | J13: 1 | K13: 1 | L13: \n\u3000 | M13: 0 | N13: =SUM(D13:M13) -> 12 | O13: =(D13*N$5+E13*N$6+F13*N$7+G13*N$8+H13*N$9+I13*N$10+J13*N$11+K13*N$12+L13*N$13+M13*N$14)/2 -> 49 | P13: =COUNTIF(D13:M13,2) -> \n4 | Q13: \n\u3000 | R13: \n2
A14: \n10 | B14: \n广东 | C14: \n陈丽淳 | D14: 0 | E14: 0 | F14: 1 | G14: 2 | H14: 0 | I14: 2 | J14: 1 | K14: 2 | L14: 2 | M14: \n\u3000 | N14: =SUM(D14:M14) -> 10 | O14: =(D14*N$5+E14*N$6+F14*N$7+G14*N$8+H14*N$9+I14*N$10+J14*N$11+K14*N$12+L14*N$13+M14*N$14)/2 -> 40.5 | P14: =COUNTIF(D14:M14,2) -> \n4 | Q14: \n\u3000 | R14: \n3

A1: 党国蕾

A1: \n \n \n[此贴子已经被作者于2012-9-21 12:53:15编辑过]

A1: \n \n第五届“杨官璘杯”全国象棋公开赛 公开组 成绩表 \n
A2: 比赛地点：凤岗镇体育馆 比赛时间：2012年9月17-21日 注：* 表示先手、 + 未对弈得分、- 弃权
A3: \n代号 | B3: \n代表队 | C3: \n姓名 | D3: \n第一轮 | G3: \n第二轮 | J3: \n第三轮 | M3: \n第四轮 | P3: \n第五轮 | S3: \n第六轮 | V3: \n第七轮 | Y3: \n第八轮 | AB3: \n第九轮 | AE3: \n对手分 | AF3: \n胜局 | AG3: \n备注 | AH3: \n名次
D4: \n对手 | F4: \n积分 | G4: \n对手 | I4: \n积分 | J4: \n对手 | L4: \n积分 | M4: \n对手 | O4: \n积分 | P4: \n对手 | R4: \n积分 | S4: \n对手 | U4: \n积分 | V4: \n对手 | X4: \n积分 | Y4: \n对手 | AA4: \n积分 | AB4: \n对手 | AD4: \n积分
A5: \n22 | B5: \n河南 | C5: \n姚洪新 | D5: \n21 | E5: \n\u3000 | F5: \n2 | G5: \n27 | H5: \n* | I5: \n4 | J5: \n14 | K5: \n* | L5: \n6 | M5: \n34 | N5: \n\u3000 | O5: \n7 | P5: \n11 | Q5: \n* | R5: \n9 | S5: \n46 | T5: \n* | U5: \n11 | V5: \n38 | W5: \n\u3000 | X5: \n12 | Y5: \n48 | Z5: \n\u3000 | AA5: \n13 | AB5: \n29 | AC5: \n* | AD5: \n15 | AE5: \n100 | AF5: \n6 | AG5: \n\u3000 | AH5: \n1
A6: \n11 | B6: \n山东 | C6: \n张申宏 | D6: \n12 | E6: \n\u3000 | F6: \n1 | G6: \n8 | H6: \n* | I6: \n3 | J6: \n15 | K6: \n\u3000 | L6: \n5 | M6: \n43 | N6: \n* | O6: \n7 | P6: \n22 | Q6: \n\u3000 | R6: \n7 | S6: \n6 | T6: \n* | U6: \n9 | V6: \n46 | W6: \n\u3000 | X6: \n10 | Y6: \n16 | Z6: \n* | AA6: \n12 | AB6: \n34 | AC6: \n* | AD6: \n14 | AE6: \n98 | AF6: \n6 | AG6: \n\u3000 | AH6: \n2
A7: \n46 | B7: \n上海 | C7: \n赵玮 | D7: \n45 | E7: \n\u3000 | F7: \n2 | G7: \n48 | H7: \n* | I7: \n4 | J7: \n43 | K7: \n\u3000 | L7: \n5 | M7: \n31 | N7: \n* | O7: \n7 | P7: \n34 | Q7: \n* | R7: \n9 | S7: \n22 | T7: \n\u3000 | U7: \n9 | V7: \n11 | W7: \n* | X7: \n10 | Y7: \n36 | Z7: \n\u3000 | AA7: \n12 | AB7: \n38 | AC7: \n* | AD7: \n13 | AE7: \n94 | AF7: \n5 | AG7: \n\u3000 | AH7: \n3
A8: \n48 | B8: \n广西 | C8: \n唐中平 | D8: \n47 | E8: \n* | F8: \n2 | G8: \n46 | H8: \n\u3000 | I8: \n2 | J8: \n10 | K8: \n* | L8: \n4 | M8: \n20 | N8: \n\u3000 | O8: \n4 | P8: \n41 | Q8: \n\u3000 | R8: \n6 | S8: \n43 | T8: \n* | U8: \n8 | V8: \n6 | W8: \n\u3000 | X8: \n10 | Y8: \n22 | Z8: \n* | AA8: \n11 | AB8: \n5 | AC8: \n\u3000 | AD8: \n13 | AE8: \n87 | AF8: \n6 | AG8: \n\u3000 | AH8: \n4
A9: \n38 | B9: \n广东 | C9: \n陈富杰 | D9: \n37 | E9: \n\u3000 | F9: \n2 | G9: \n29 | H9: \n* | I9: \n3 | J9: \n6 | K9: \n\u3000 | L9: \n4 | M9: \n41 | N9: \n* | O9: \n6 | P9: \n12 | Q9: \n\u3000 | R9: \n7 | S9: \n13 | T9: \n* | U9: \n9 | V9: \n22 | W9: \n* | X9: \n10 | Y9: \n34 | Z9: \n\u3000 | AA9: \n11 | AB9: \n46 | AC9: \n\u3000 | AD9: \n12 | AE9: \n95 | AF9: \n3 | AG9: \n\u3000 | AH9: \n5
A10: \n15 | B10: \n山东 | C10: \n赵勇霖 | D10: \n16 | E10: \n\u3000 | F10: \n1 | G10: \n12 | H10: \n* | I10: \n3 | J10: \n11 | K10: \n* | L10: \n3 | M10: \n2 | N10: \n\u3000 | O10: \n4 | P10: \n24 | Q10: \n* | R10: \n6 | S10: \n5 | T10: \n* | U10: \n7 | V10: \n13 | W10: \n\u3000 | X10: \n8 | Y10: \n20 | Z10: \n* | AA10: \n10 | AB10: \n7 | AC10: \n\u3000 | AD10: \n12 | AE10: \n94 | AF10: \n4 | AG10: \n\u3000 | AH10: \n6
A11: \n13 | B11: \n湖北 | C11: \n刘宗泽 | D11: \n14 | E11: \n* | F11: \n0 | G11: \n21 | H11: \n\u3000 | I11: \n2 | J11: \n42 | K11: \n* | L11: \n3 | M11: \n27 | N11: \n\u3000 | O11: \n5 | P11: \n23 | Q11: \n* | R11: \n7 | S11: \n38 | T11: \n\u3000 | U11: \n7 | V11: \n15 | W11: \n* | X11: \n8 | Y11: \n12 | Z11: \n\u3000 | AA11: \n10 | AB11: \n3 | AC11: \n* | AD11: \n12 | AE11: \n87 | AF11: \n5 | AG11: \n\u3000 | AH11: \n7
A12: \n34 | B12: \n北京 | C12: \n才溢 | D12: \n33 | E12: \n\u3000 | F12: \n2 | G12: \n17 | H12: \n* | I12: \n4 | J12: \n31 | K12: \n\u3000 | L12: \n6 | M12: \n22 | N12: \n* | O12: \n7 | P12: \n46 | Q12: \n\u3000 | R12: \n7 | S12: \n29 | T12: \n* | U12: \n8 | V12: \n7 | W12: \n\u3000 | X12: \n10 | Y12: \n38 | Z12: \n* | AA12: \n11 | AB12: \n11 | AC12: \n\u3000 | AD12: \n11 | AE12: \n97 | AF12: \n4 | AG12: \n\u3000 | AH12: \n8
A13: \n29 | B13: \n广东 | C13: \n李鸿嘉 | D13: \n30 | E13: \n* | F13: \n2 | G13: \n38 | H13: \n\u3000 | I13: \n3 | J13: \n7 | K13: \n* | L13: \n4 | M13: \n23 | N13: \n\u3000 | O13: \n5 | P13: \n33 | Q13: \n* | R13: \n7 | S13: \n34 | T13: \n\u3000 | U13: \n8 | V13: \n3 | W13: \n* | X13: \n9 | Y13: \n14 | Z13: \n\u3000 | AA13: \n11 | AB13: \n22 | AC13: \n\u3000 | AD13: \n11 | AE13: \n96 | AF13: \n3 | AG13: \n\u3000 | AH13: \n9
A14: \n16 | B14: \n湖南 | C14: \n向有权 | D14: \n15 | E14: \n* | F14: \n1 | G14: \n19 | H14: \n\u3000 | I14: \n3 | J14: \n2 | K14: \n* | L14: \n4 | M14: \n7 | N14: \n\u3000 | O14: \n4 | P14: \n25 | Q14: \n* | R14: \n6 | S14: \n31 | T14: \n\u3000 | U14: \n8 | V14: \n14 | W14: \n* | X14: \n10 | Y14: \n11 | Z14: \n\u3000 | AA14: \n10 | AB14: \n33 | AC14: \n* | AD14: \n11 | AE14: \n89 | AF14: \n4 | AG14: \n\u3000 | AH14: \n10
A15: \n33 | B15: \n山东 | C15: \n李翰林 | D15: \n34 | E15: \n* | F15: \n0 | G15: \n30 | H15: \n\u3000 | I15: \n2 | J15: \n24 | K15: \n\u3000 | L15: \n3 | M15: \n40 | N15: \n* | O15: \n5 | P15: \n29 | Q15: \n\u3000 | R15: \n5 | S15: \n8 | T15: \n* | U15: \n7 | V15: \n20 | W15: \n\u3000 | X15: \n8 | Y15: \n26 | Z15: \n* | AA15: \n10 | AB15: \n16 | AC15: \n\u3000 | AD15: \n11 | AE15: \n88 | AF15: \n4 | AG15: \n\u3000 | AH15: \n11
A16: \n14 | B16: \n广东 | C16: \n许国义 | D16: \n13 | E16: \n\u3000 | F16: \n2 | G16: \n6 | H16: \n* | I16: \n4 | J16: \n22 | K16: \n\u3000 | L16: \n4 | M16: \n25 | N16: \n* | O16: \n6 | P16: \n20 | Q16: \n\u3000 | R16: \n8 | S16: \n7 | T16: \n* | U16: \n9 | V16: \n16 | W16: \n\u3000 | X16: \n9 | Y16: \n29 | Z16: \n* | AA16: \n9 | AB16: \n8 | AC16: \n\u3000 | AD16: \n10 | AE16: \n96 | AF16: \n4 | AG16: \n\u3000 | AH16: \n12
A17: \n7 | B17: \n江苏 | C17: \n程鸣 | D17: \n8 | E17: \n\u3000 | F17: \n1 | G17: \n4 | H17: \n* | I17: \n3 | J17: \n29 | K17: \n\u3000 | L17: \n4 | M17: \n16 | N17: \n* | O17: \n6 | P17: \n3 | Q17: \n* | R17: \n7 | S17: \n14 | T17: \n\u3000 | U17: \n8 | V17: \n34 | W17: \n* | X17: \n8 | Y17: \n47 | Z17: \n\u3000 | AA17: \n10 | AB17: \n15 | AC17: \n* | AD17: \n10 | AE17: \n93 | AF17: \n3 | AG17: \n\u3000 | AH17: \n13
A18: \n8 | B18: \n广东 | C18: \n黄海林 | D18: \n7 | E18: \n* | F18: \n1 | G18: \n11 | H18: \n\u3000 | I18: \n1 | J18: \n35 | K18: \n* | L18: \n2 | M18: \n26 | N18: \n\u3000 | O18: \n4 | P18: \n9 | Q18: \n* | R18: \n5 | S18: \n33 | T18: \n\u3000 | U18: \n5 | V18: \n25 | W18: \n* | X18: \n7 | Y18: \n2 | Z18: \n\u3000 | AA18: \n9 | AB18: \n14 | AC18: \n* | AD18: \n10 | AE18: \n86 | AF18: \n3 | AG18: \n\u3000 | AH18: \n14
A19: \n23 | B19: \n福建 | C19: \n卓赞烽 | D19: \n24 | E19: \n\u3000 | F19: \n1 | G19: \n20 | H19: \n* | I19: \n2 | J19: \n1 | K19: \n\u3000 | L19: \n4 | M19: \n29 | N19: \n* | O19: \n5 | P19: \n13 | Q19: \n\u3000 | R19: \n5 | S19: \n40 | T19: \n* | U19: \n7 | V19: \n12 | W19: \n\u3000 | X19: \n8 | Y19: \n28 | Z19: \n* | AA19: \n9 | AB19: \n36 | AC19: \n* | AD19: \n10 | AE19: \n85 | AF19: \n2 | AG19: \n\u3000 | AH19: \n15
A20: \n24 | B20: \n厦门 | C20: \n林文汉 | D20: \n23 | E20: \n* | F20: \n1 | G20: \n26 | H20: \n\u3000 | I20: \n2 | J20: \n33 | K20: \n* | L20: \n3 | M20: \n42 | N20: \n\u3000 | O20: \n4 | P20: \n15 | Q20: \n\u3000 | R20: \n4 | S20: \n30 | T20: \n* | U20: \n6 | V20: \n43 | W20: \n\u3000 | X20: \n7 | Y20: \n6 | Z20: \n* | AA20: \n9 | AB20: \n28 | AC20: \n\u3000 | AD20: \n10 | AE20: \n84 | AF20: \n2 | AG20: \n\u3000 | AH20: \n16
A21: \n3 | B21: \n广东 | C21: \n朱少钧 | D21: \n4 | E21: \n\u3000 | F21: \n1 | G21: \n45 | H21: \n*+ | I21: \n3 | J21: \n25 | K21: \n\u3000 | L21: \n4 | M21: \n9 | N21: \n* | O21: \n6 | P21: \n7 | Q21: \n\u3000 | R21: \n7 | S21: \n20 | T21: \n* | U21: \n8 | V21: \n29 | W21: \n\u3000 | X21: \n9 | Y21: \n5 | Z21: \n* | AA21: \n10 | AB21: \n13 | AC21: \n\u3000 | AD21: \n10 | AE21: \n81 | AF21: \n2 | AG21: \n\u3000 | AH21: \n17
A22: \n5 | B22: \n浙江 | C22: \n程吉俊 | D22: \n6 | E22: \n* | F22: \n0 | G22: \n1 | H22: \n* | I22: \n0 | J22: \n32 | K22: \n\u3000 | L22: \n2 | M22: \n35 | N22: \n\u3000 | O22: \n4 | P22: \n42 | Q22: \n* | R22: \n6 | S22: \n15 | T22: \n\u3000 | U22: \n7 | V22: \n2 | W22: \n* | X22: \n9 | Y22: \n3 | Z22: \n\u3000 | AA22: \n10 | AB22: \n48 | AC22: \n* | AD22: \n10 | AE22: \n80 | AF22: \n4 | AG22: \n\u3000 | AH22: \n18
A23: \n36 | B23: \n江苏 | C23: \n朱晓虎 | D23: \n35 | E23: \n* | F23: \n1 | G23: \n42 | H23: \n\u3000 | I23: \n2 | J23: \n40 | K23: \n\u3000 | L23: \n3 | M23: \n28 | N23: \n* | O23: \n4 | P23: \n43 | Q23: \n\u3000 | R23: \n5 | S23: \n21 | T23: \n* | U23: \n7 | V23: \n18 | W23: \n\u3000 | X23: \n9 | Y23: \n46 | Z23: \n* | AA23: \n9 | AB23: \n23 | AC23: \n\u3000 | AD23: \n10 | AE23: \n80 | AF23: \n2 | AG23: \n\u3000 | AH23: \n19
A24: \n40 | B24: \n广东 | C24: \n林楚强 | D24: \n39 | E24: \n* | F24: \n2 | G24: \n43 | H24: \n\u3000 | I24: \n2 | J24: \n36 | K24: \n* | L24: \n3 | M24: \n33 | N24: \n\u3000 | O24: \n3 | P24: \n27 | Q24: \n* | R24: \n5 | S24: \n23 | T24: \n\u3000 | U24: \n5 | V24: \n42 | W24: \n* | X24: \n6 | Y24: \n44 | Z24: \n\u3000 | AA24: \n8 | AB24: \n32 | AC24: \n* | AD24: \n10 | AE24: \n75 | AF24: \n4 | AG24: \n\u3000 | AH24: \n20
A25: \n28 | B25: \n河南 | C25: \n李海 | D25: \n27 | E25: \n* | F25: \n0 | G25: \n10 | H25: \n\u3000 | I25: \n1 | J25: \n37 | K25: \n* | L25: \n3 | M25: \n36 | N25: \n\u3000 | O25: \n4 | P25: \n31 | Q25: \n* | R25: \n4 | S25: \n44 | T25: \n\u3000 | U25: \n6 | V25: \n9 | W25: \n* | X25: \n8 | Y25: \n23 | Z25: \n\u3000 | AA25: \n9 | AB25: \n24 | AC25: \n* | AD25: \n10 | AE25: \n70 | AF25: \n3 | AG25: \n\u3000 | AH25: \n21
A26: \n6 | B26: \n广东 | C26: \n吴亚利 | D26: \n5 | E26: \n\u3000 | F26: \n2 | G26: \n14 | H26: \n\u3000 | I26: \n2 | J26: \n38 | K26: \n* | L26: \n3 | M26: \n18 | N26: \n\u3000 | O26: \n5 | P26: \n2 | Q26: \n* | R26: \n7 | S26: \n11 | T26: \n\u3000 | U26: \n7 | V26: \n48 | W26: \n* | X26: \n7 | Y26: \n24 | Z26: \n\u3000 | AA26: \n7 | AB26: \n31 | AC26: \n* | AD26: \n9 | AE26: \n92 | AF26: \n4 | AG26: \n\u3000 | AH26: \n22
A27: \n12 | B27: \n广东 | C27: \n黎德志 | D27: \n11 | E27: \n* | F27: \n1 | G27: \n15 | H27: \n\u3000 | I27: \n1 | J27: \n39 | K27: \n* | L27: \n3 | M27: \n19 | N27: \n\u3000 | O27: \n5 | P27: \n38 | Q27: \n* | R27: \n6 | S27: \n9 | T27: \n\u3000 | U27: \n7 | V27: \n23 | W27: \n* | X27: \n8 | Y27: \n13 | Z27: \n* | AA27: \n8 | AB27: \n20 | AC27: \n\u3000 | AD27: \n9 | AE27: \n88 | AF27: \n2 | AG27: \n\u3000 | AH27: \n23
A28: \n20 | B28: \n广东 | C28: \n刘立山 | D28: \n19 | E28: \n* | F28: \n1 | G28: \n23 | H28: \n\u3000 | I28: \n2 | J28: \n17 | K28: \n\u3000 | L28: \n4 | M28: \n48 | N28: \n* | O28: \n6 | P28: \n14 | Q28: \n* | R28: \n6 | S28: \n3 | T28: \n\u3000 | U28: \n7 | V28: \n33 | W28: \n* | X28: \n8 | Y28: \n15 | Z28: \n\u3000 | AA28: \n8 | AB28: \n12 | AC28: \n* | AD28: \n9 | AE28: \n86 | AF28: \n2 | AG28: \n\u3000 | AH28: \n24
A29: \n27 | B29: \n广东 | C29: \n伍世钦 | D29: \n28 | E29: \n\u3000 | F29: \n2 | G29: \n22 | H29: \n\u3000 | I29: \n2 | J29: \n18 | K29: \n* | L29: \n3 | M29: \n13 | N29: \n* | O29: \n3 | P29: \n40 | Q29: \n\u3000 | R29: \n3 | S29: \n19 | T29: \n* | U29: \n5 | V29: \n21 | W29: \n\u3000 | X29: \n7 | Y29: \n43 | Z29: \n* | AA29: \n8 | AB29: \n26 | AC29: \n\u3000 | AD29: \n9 | AE29: \n85 | AF29: \n3 | AG29: \n\u3000 | AH29: \n25
A30: \n2 | B30: \n广东 | C30: \n李进 | D30: \n1 | E30: \n\u3000 | F30: \n2 | G30: \n41 | H30: \n* | I30: \n3 | J30: \n16 | K30: \n\u3000 | L30: \n4 | M30: \n15 | N30: \n* | O30: \n5 | P30: \n6 | Q30: \n\u3000 | R30: \n5 | S30: \n32 | T30: \n* | U30: \n7 | V30: \n5 | W30: \n\u3000 | X30: \n7 | Y30: \n8 | Z30: \n* | AA30: \n7 | AB30: \n43 | AC30: \n\u3000 | AD30: \n9 | AE30: \n81 | AF30: \n3 | AG30: \n\u3000 | AH30: \n26
A31: \n25 | B31: \n湖南 | C31: \n刘泉 | D31: \n26 | E31: \n* | F31: \n1 | G31: \n35 | H31: \n\u3000 | I31: \n3 | J31: \n3 | K31: \n* | L31: \n4 | M31: \n14 | N31: \n\u3000 | O31: \n4 | P31: \n16 | Q31: \n\u3000 | R31: \n4 | S31: \n41 | T31: \n* | U31: \n5 | V31: \n8 | W31: \n\u3000 | X31: \n5 | Y31: \n30 | Z31: \n\u3000 | AA31: \n7 | AB31: \n9 | AC31: \n* | AD31: \n9 | AE31: \n80 | AF31: \n3 | AG31: \n\u3000 | AH31: \n27
A32: \n41 | B32: \n福建 | C32: \n黄卿耀 | D32: \n42 | E32: \n* | F32: \n1 | G32: \n2 | H32: \n\u3000 | I32: \n2 | J32: \n44 | K32: \n* | L32: \n4 | M32: \n38 | N32: \n\u3000 | O32: \n4 | P32: \n48 | Q32: \n* | R32: \n4 | S32: \n25 | T32: \n\u3000 | U32: \n5 | V32: \n32 | W32: \n\u3000 | X32: \n5 | Y32: \n21 | Z32: \n* | AA32: \n7 | AB32: \n18 | AC32: \n\u3000 | AD32: \n9 | AE32: \n79 | AF32: \n3 | AG32: \n\u3000 | AH32: \n28
A33: \n26 | B33: \n广东 | C33: \n陈红标 | D33: \n25 | E33: \n\u3000 | F33: \n1 | G33: \n24 | H33: \n* | I33: \n2 | J33: \n9 | K33: \n\u3000 | L33: \n2 | M33: \n8 | N33: \n* | O33: \n2 | P33: \n17 | Q33: \n\u3000 | R33: \n4 | S33: \n37 | T33: \n* | U33: \n6 | V33: \n31 | W33: \n* | X33: \n8 | Y33: \n33 | Z33: \n\u3000 | AA33: \n8 | AB33: \n27 | AC33: \n* | AD33: \n9 | AE33: \n73 | AF33: \n3 | AG33: \n\u3000 | AH33: \n29
A34: \n47 | B34: \n安徽 | C34: \n王建鸣 | D34: \n48 | E34: \n\u3000 | F34: \n0 | G34: \n44 | H34: \n* | I34: \n0 | J34: \n30 | K34: \n\u3000 | L34: \n2 | M34: \n17 | N34: \n* | O34: \n4 | P34: \n21 | Q34: \n\u3000 | R34: \n5 | S34: \n18 | T34: \n* | U34: \n6 | V34: \n4 | W34: \n\u3000 | X34: \n7 | Y34: \n7 | Z34: \n* | AA34: \n7 | AB34: \n37 | AC34: \n* | AD34: \n9 | AE34: \n69 | AF34: \n3 | AG34: \n\u3000 | AH34: \n30
A35: \n4 | B35: \n沈阳 | C35: \n苗永鹏 | D35: \n3 | E35: \n* | F35: \n1 | G35: \n7 | H35: \n\u3000 | I35: \n1 | J35: \n19 | K35: \n* | L35: \n1 | M35: \n39 | N35: \n\u3000 | O35: \n2 | P35: \n37 | Q35: \n* | R35: \n4 | S35: \n42 | T35: \n\u3000 | U35: \n5 | V35: \n47 | W35: \n* | X35: \n6 | Y35: \n9 | Z35: \n\u3000 | AA35: \n7 | AB35: \n35 | AC35: \n* | AD35: \n9 | AE35: \n69 | AF35: \n2 | AG35: \n\u3000 | AH35: \n31
A36: \n43 | B36: \n湖北 | C36: \n肖八武 | D36: \n44 | E36: \n\u3000 | F36: \n2 | G36: \n40 | H36: \n* | I36: \n4 | J36: \n46 | K36: \n* | L36: \n5 | M36: \n11 | N36: \n\u3000 | O36: \n5 | P36: \n36 | Q36: \n* | R36: \n6 | S36: \n48 | T36: \n\u3000 | U36: \n6 | V36: \n24 | W36: \n* | X36: \n7 | Y36: \n27 | Z36: \n\u3000 | AA36: \n8 | AB36: \n2 | AC36: \n* | AD36: \n8 | AE36: \n94 | AF36: \n2 | AG36: \n\u3000 | AH36: \n32
A37: \n42 | B37: \n广东 | C37: \n林进春 | D37: \n41 | E37: \n\u3000 | F37: \n1 | G37: \n36 | H37: \n* | I37: \n2 | J37: \n13 | K37: \n\u3000 | L37: \n3 | M37: \n24 | N37: \n* | O37: \n4 | P37: \n5 | Q37: \n\u3000 | R37: \n4 | S37: \n4 | T37: \n* | U37: \n5 | V37: \n40 | W37: \n\u3000 | X37: \n6 | Y37: \n32 | Z37: \n* | AA37: \n6 | AB37: \n44 | AC37: \n\u3000 | AD37: \n8 | AE37: \n84 | AF37: \n1 | AG37: \n\u3000 | AH37: \n33
A38: \n32 | B38: \n宁波 | C38: \n谢丹枫 | D38: \n31 | E38: \n* | F38: \n0 | G38: \n18 | H38: \n\u3000 | I38: \n0 | J38: \n5 | K38: \n* | L38: \n0 | M38: \n45 | N38: \n* | O38: \n2 | P38: \n1 | Q38: \n\u3000 | R38: \n4 | S38: \n2 | T38: \n\u3000 | U38: \n4 | V38: \n41 | W38: \n* | X38: \n6 | Y38: \n42 | Z38: \n\u3000 | AA38: \n8 | AB38: \n40 | AC38: \n\u3000 | AD38: \n8 | AE38: \n68 | AF38: \n4 | AG38: \n\u3000 | AH38: \n34
A39: \n31 | B39: \n湖北 | C39: \n胡克华 | D39: \n32 | E39: \n\u3000 | F39: \n2 | G39: \n9 | H39: \n* | I39: \n4 | J39: \n34 | K39: \n* | L39: \n4 | M39: \n46 | N39: \n\u3000 | O39: \n4 | P39: \n28 | Q39: \n\u3000 | R39: \n6 | S39: \n16 | T39: \n* | U39: \n6 | V39: \n26 | W39: \n\u3000 | X39: \n6 | Y39: \n18 | Z39: \n* | AA39: \n7 | AB39: \n6 | AC39: \n\u3000 | AD39: \n7 | AE39: \n85 | AF39: \n3 | AG39: \n\u3000 | AH39: \n35
A40: \n21 | B40: \n北京 | C40: \n周涛 | D40: \n22 | E40: \n* | F40: \n0 | G40: \n13 | H40: \n* | I40: \n0 | J40: \n45 | K40: \n\u3000 | L40: \n2 | M40: \n44 | N40: \n\u3000 | O40: \n4 | P40: \n47 | Q40: \n* | R40: \n5 | S40: \n36 | T40: \n\u3000 | U40: \n5 | V40: \n27 | W40: \n* | X40: \n5 | Y40: \n41 | Z40: \n\u3000 | AA40: \n5 | AB40: \n10 | AC40: \n* | AD40: \n7 | AE40: \n79 | AF40: \n3 | AG40: \n\u3000 | AH40: \n36
A41: \n9 | B41: \n河南 | C41: \n赵子雨 | D41: \n10 | E41: \n* | F41: \n2 | G41: \n31 | H41: \n\u3000 | I41: \n2 | J41: \n26 | K41: \n* | L41: \n4 | M41: \n3 | N41: \n\u3000 | O41: \n4 | P41: \n8 | Q41: \n\u3000 | R41: \n5 | S41: \n12 | T41: \n* | U41: \n6 | V41: \n28 | W41: \n\u3000 | X41: \n6 | Y41: \n4 | Z41: \n* | AA41: \n7 | AB41: \n25 | AC41: \n\u3000 | AD41: \n7 | AE41: \n78 | AF41: \n2 | AG41: \n\u3000 | AH41: \n37
A42: \n30 | B42: \n广西 | C42: \n欧照芳 | D42: \n29 | E42: \n\u3000 | F42: \n0 | G42: \n33 | H42: \n* | I42: \n0 | J42: \n47 | K42: \n* | L42: \n0 | M42: \n10 | N42: \n\u3000 | O42: \n2 | P42: \n35 | Q42: \n* | R42: \n4 | S42: \n24 | T42: \n\u3000 | U42: \n4 | V42: \n19 | W42: \n\u3000 | X42: \n5 | Y42: \n25 | Z42: \n* | AA42: \n5 | AB42: \n1 | AC42: \n\u3000 | AD42: \n7 | AE42: \n73 | AF42: \n3 | AG42: \n\u3000 | AH42: \n38
A43: \n18 | B43: \n四川 | C43: \n梁妍婷（女） | D43: \n17 | E43: \n\u3000 | F43: \n0 | G43: \n32 | H43: \n* | I43: \n2 | J43: \n27 | K43: \n\u3000 | L43: \n3 | M43: \n6 | N43: \n* | O43: \n3 | P43: \n19 | Q43: \n* | R43: \n5 | S43: \n47 | T43: \n\u3000 | U43: \n6 | V43: \n36 | W43: \n* | X43: \n6 | Y43: \n31 | Z43: \n\u3000 | AA43: \n7 | AB43: \n41 | AC43: \n* | AD43: \n7 | AE43: \n72 | AF43: \n2 | AG43: \n\u3000 | AH43: \n39
A44: \n19 | B44: \n湖北 | C44: \n王文志 | D44: \n20 | E44: \n\u3000 | F44: \n1 | G44: \n16 | H44: \n* | I44: \n1 | J44: \n4 | K44: \n\u3000 | L44: \n3 | M44: \n12 | N44: \n* | O44: \n3 | P44: \n18 | Q44: \n\u3000 | R44: \n3 | S44: \n27 | T44: \n\u3000 | U44: \n3 | V44: \n30 | W44: \n* | X44: \n4 | Y44: \n10 | Z44: \n\u3000 | AA44: \n5 | AB44: \n39 | AC44: \n* | AD44: \n7 | AE44: \n71 | AF44: \n2 | AG44: \n\u3000 | AH44: \n40
A45: \n35 | B45: \n山东 | C45: \n王新光 | D45: \n36 | E45: \n\u3000 | F45: \n1 | G45: \n25 | H45: \n* | I45: \n1 | J45: \n8 | K45: \n\u3000 | L45: \n2 | M45: \n5 | N45: \n* | O45: \n2 | P45: \n30 | Q45: \n\u3000 | R45: \n2 | S45: \n39 | T45: \n* | U45: \n3 | V45: \n17 | W45: \n\u3000 | X45: \n5 | Y45: \n1 | Z45: \n* | AA45: \n7 | AB45: \n4 | AC45: \n\u3000 | AD45: \n7 | AE45: \n68 | AF45: \n2 | AG45: \n\u3000 | AH45: \n41
A46: \n44 | B46: \n广东 | C46: \n林进明 | D46: \n43 | E46: \n* | F46: \n0 | G46: \n47 | H46: \n\u3000 | I46: \n2 | J46: \n41 | K46: \n\u3000 | L46: \n2 | M46: \n21 | N46: \n* | O46: \n2 | P46: \n39 | Q46: \n\u3000 | R46: \n4 | S46: \n28 | T46: \n* | U46: \n4 | V46: \n1 | W46: \n\u3000 | X46: \n6 | Y46: \n40 | Z46: \n* | AA46: \n6 | AB46: \n42 | AC46: \n* | AD46: \n6 | AE46: \n70 | AF46: \n3 | AG46: \n\u3000 | AH46: \n42
A47: \n37 | B47: \n江苏 | C47: \n许波 | D47: \n38 | E47: \n* | F47: \n0 | G47: \n39 | H47: \n\u3000 | I47: \n1 | J47: \n28 | K47: \n\u3000 | L47: \n1 | M47: \n1 | N47: \n* | O47: \n3 | P47: \n4 | Q47: \n\u3000 | R47: \n3 | S47: \n26 | T47: \n\u3000 | U47: \n3 | V47: \n10 | W47: \n* | X47: \n4 | Y47: \n45 | Z47: \n* | AA47: \n6 | AB47: \n47 | AC47: \n\u3000 | AD47: \n6 | AE47: \n67 | AF47: \n2 | AG47: \n\u3000 | AH47: \n43
A48: \n10 | B48: \n广东 | C48: \n梁运龙 | D48: \n9 | E48: \n\u3000 | F48: \n0 | G48: \n28 | H48: \n* | I48: \n1 | J48: \n48 | K48: \n\u3000 | L48: \n1 | M48: \n30 | N48: \n* | O48: \n1 | P48: \n45 | Q48: \n\u3000 | R48: \n2 | S48: \n17 | T48: \n* | U48: \n3 | V48: \n37 | W48: \n\u3000 | X48: \n4 | Y48: \n19 | Z48: \n* | AA48: \n5 | AB48: \n21 | AC48: \n\u3000 | AD48: \n5 | AE48: \n65 | AF48: \n0 | AG48: \n\u3000 | AH48: \n44
A49: \n39 | B49: \n湖南 | C49: \n王清 | D49: \n40 | E49: \n\u3000 | F49: \n0 | G49: \n37 | H49: \n* | I49: \n1 | J49: \n12 | K49: \n\u3000 | L49: \n1 | M49: \n4 | N49: \n* | O49: \n2 | P49: \n44 | Q49: \n* | R49: \n2 | S49: \n35 | T49: \n\u3000 | U49: \n3 | V49: \n45 | W49: \n* | X49: \n3 | Y49: \n17 | Z49: \n* | AA49: \n5 | AB49: \n19 | AC49: \n\u3000 | AD49: \n5 | AE49: \n62 | AF49: \n1 | AG49: \n\u3000 | AH49: \n45
A50: \n1 | B50: \n湖南 | C50: \n梁林 | D50: \n2 | E50: \n* | F50: \n0 | G50: \n5 | H50: \n\u3000 | I50: \n2 | J50: \n23 | K50: \n* | L50: \n2 | M50: \n37 | N50: \n\u3000 | O50: \n2 | P50: \n32 | Q50: \n* | R50: \n2 | S50: \n45 | T50: \n\u3000 | U50: \n4 | V50: \n44 | W50: \n* | X50: \n4 | Y50: \n35 | Z50: \n\u3000 | AA50: \n4 | AB50: \n30 | AC50: \n* | AD50: \n4 | AE50: \n67 | AF50: \n2 | AG50: \n\u3000 | AH50: \n46
A51: \n17 | B51: \n山东 | C51: \n张卫东 | D51: \n18 | E51: \n* | F51: \n2 | G51: \n34 | H51: \n\u3000 | I51: \n2 | J51: \n20 | K51: \n* | L51: \n2 | M51: \n47 | N51: \n\u3000 | O51: \n2 | P51: \n26 | Q51: \n* | R51: \n2 | S51: \n10 | T51: \n\u3000 | U51: \n3 | V51: \n35 | W51: \n* | X51: \n3 | Y51: \n39 | Z51: \n\u3000 | AA51: \n3 | AB51: \n45 | AC51: \n\u3000 | AD51: \n4 | AE51: \n66 | AF51: \n1 | AG51: \n\u3000 | AH51: \n47
A52: \n45 | B52: \n广东 | C52: \n张亮 | D52: \n46 | E52: \n* | F52: \n0 | G52: \n3 | H52: \n- | I52: \n0 | J52: \n21 | K52: \n* | L52: \n0 | M52: \n32 | N52: \n\u3000 | O52: \n0 | P52: \n10 | Q52: \n* | R52: \n1 | S52: \n1 | T52: \n* | U52: \n1 | V52: \n39 | W52: \n\u3000 | X52: \n3 | Y52: \n37 | Z52: \n\u3000 | AA52: \n3 | AB52: \n17 | AC52: \n* | AD52: \n4 | AE52: \n62 | AF52: \n1 | AG52: \n\u3000 | AH52: \n48

A1: \n \n \n[此贴子已经被作者于2012-9-21 12:57:10编辑过]

A1: \n第五届“杨官璘杯”全国象棋公开赛 海外组 成绩表
A2: 比赛地点：凤岗镇体育馆 比赛时间：2012年9月17-21日 注：* 表示先手、 + 未对弈得分、- 弃权
A3: \n代号 | B3: \n代表队 | C3: \n姓名 | D3: \n第一轮 | G3: \n第二轮 | J3: \n第三轮 | M3: \n第四轮 | P3: \n第五轮 | S3: \n第六轮 | V3: \n第七轮 | Y3: \n第八轮 | AB3: \n第九轮 | AE3: \n对手分 | AF3: \n胜局 | AG3: \n备注 | AH3: \n名次
D4: \n对手 | F4: \n积分 | G4: \n对手 | I4: \n积分 | J4: \n对手 | L4: \n积分 | M4: \n对手 | O4: \n积分 | P4: \n对手 | R4: \n积分 | S4: \n对手 | U4: \n积分 | V4: \n对手 | X4: \n积分 | Y4: \n对手 | AA4: \n积分 | AB4: \n对手 | AD4: \n积分
A5: \n28 | B5: \n中国香港 | C5: \n梁达民 | D5: \n27 | E5: \n\u3000 | F5: \n2 | G5: \n31 | H5: \n* | I5: \n4 | J5: \n30 | K5: \n+ | L5: \n6 | M5: \n42 | N5: \n\u3000 | O5: \n7 | P5: \n53 | Q5: \n* | R5: \n9 | S5: \n13 | T5: \n* | U5: \n10 | V5: \n25 | W5: \n\u3000 | X5: \n11 | Y5: \n49 | Z5: \n* | AA5: \n13 | AB5: \n3 | AC5: \n* | AD5: \n14 | AE5: \n102 | AF5: \n5 | AG5: \n\u3000 | AH5: \n1
A6: \n3 | B6: \n中国香港 | C6: \n吴震熙 | D6: \n4 | E6: \n* | F6: \n2 | G6: \n1 | H6: \n* | I6: \n4 | J6: \n13 | K6: \n\u3000 | L6: \n4 | M6: \n55 | N6: \n* | O6: \n6 | P6: \n24 | Q6: \n\u3000 | R6: \n7 | S6: \n15 | T6: \n* | U6: \n9 | V6: \n33 | W6: \n\u3000 | X6: \n10 | Y6: \n16 | Z6: \n* | AA6: \n12 | AB6: \n28 | AC6: \n\u3000 | AD6: \n13 | AE6: \n102 | AF6: \n5 | AG6: \n\u3000 | AH6: \n2
A7: \n42 | B7: \n中国香港 | C7: \n陈振杰 | D7: \n41 | E7: \n\u3000 | F7: \n2 | G7: \n51 | H7: \n* | I7: \n4 | J7: \n48 | K7: \n\u3000 | L7: \n6 | M7: \n28 | N7: \n* | O7: \n7 | P7: \n13 | Q7: \n\u3000 | R7: \n8 | S7: \n40 | T7: \n* | U7: \n9 | V7: \n38 | W7: \n* | X7: \n11 | Y7: \n60 | Z7: \n\u3000 | AA7: \n12 | AB7: \n18 | AC7: \n* | AD7: \n13 | AE7: \n100 | AF7: \n4 | AG7: \n\u3000 | AH7: \n3
A8: \n13 | B8: \n越南 | C8: \n郑亚生 | D8: \n14 | E8: \n* | F8: \n2 | G8: \n10 | H8: \n\u3000 | I8: \n4 | J8: \n3 | K8: \n* | L8: \n6 | M8: \n60 | N8: \n\u3000 | O8: \n7 | P8: \n42 | Q8: \n* | R8: \n8 | S8: \n28 | T8: \n\u3000 | U8: \n9 | V8: \n40 | W8: \n* | X8: \n11 | Y8: \n18 | Z8: \n\u3000 | AA8: \n11 | AB8: \n24 | AC8: \n* | AD8: \n13 | AE8: \n98 | AF8: \n5 | AG8: \n\u3000 | AH8: \n4
A9: \n1 | B9: \n越南 | C9: \n阮成保 | D9: \n2 | E9: \n* | F9: \n2 | G9: \n3 | H9: \n\u3000 | I9: \n2 | J9: \n10 | K9: \n* | L9: \n4 | M9: \n11 | N9: \n\u3000 | O9: \n6 | P9: \n25 | Q9: \n* | R9: \n7 | S9: \n20 | T9: \n\u3000 | U9: \n9 | V9: \n18 | W9: \n* | X9: \n10 | Y9: \n48 | Z9: \n\u3000 | AA9: \n11 | AB9: \n60 | AC9: \n* | AD9: \n13 | AE9: \n96 | AF9: \n5 | AG9: \n\u3000 | AH9: \n5
A10: \n25 | B10: \n中国香港 | C10: \n赵汝权 | D10: \n26 | E10: \n* | F10: \n2 | G10: \n24 | H10: \n\u3000 | I10: \n2 | J10: \n14 | K10: \n* | L10: \n4 | M10: \n19 | N10: \n* | O10: \n6 | P10: \n1 | Q10: \n\u3000 | R10: \n7 | S10: \n22 | T10: \n\u3000 | U10: \n9 | V10: \n28 | W10: \n* | X10: \n10 | Y10: \n33 | Z10: \n\u3000 | AA10: \n11 | AB10: \n38 | AC10: \n* | AD10: \n13 | AE10: \n95 | AF10: \n5 | AG10: \n\u3000 | AH10: \n6
A11: \n18 | B11: \n中国澳门 | C11: \n曹岩磊 | D11: \n17 | E11: \n\u3000 | F11: \n2 | G11: \n15 | H11: \n* | I11: \n3 | J11: \n11 | K11: \n\u3000 | L11: \n4 | M11: \n30 | N11: \n* | O11: \n5 | P11: \n43 | Q11: \n\u3000 | R11: \n7 | S11: \n24 | T11: \n* | U11: \n9 | V11: \n1 | W11: \n\u3000 | X11: \n10 | Y11: \n13 | Z11: \n* | AA11: \n12 | AB11: \n42 | AC11: \n\u3000 | AD11: \n13 | AE11: \n92 | AF11: \n4 | AG11: \n\u3000 | AH11: \n7
A12: \n60 | B12: \n菲律宾 | C12: \n庄宏明 | D12: \n59 | E12: \n\u3000 | F12: \n2 | G12: \n57 | H12: \n* | I12: \n4 | J12: \n5 | K12: \n\u3000 | L12: \n6 | M12: \n13 | N12: \n* | O12: \n7 | P12: \n40 | Q12: \n\u3000 | R12: \n8 | S12: \n33 | T12: \n* | U12: \n9 | V12: \n39 | W12: \n\u3000 | X12: \n11 | Y12: \n42 | Z12: \n* | AA12: \n12 | AB12: \n1 | AC12: \n\u3000 | AD12: \n12 | AE12: \n100 | AF12: \n4 | AG12: \n\u3000 | AH12: \n8
A13: \n33 | B13: \n美国 | C13: \n牟海勤 | D13: \n34 | E13: \n* | F13: \n2 | G13: \n30 | H13: \n\u3000 | I13: \n2 | J13: \n20 | K13: \n* | L13: \n4 | M13: \n35 | N13: \n\u3000 | O13: \n6 | P13: \n16 | Q13: \n* | R13: \n8 | S13: \n60 | T13: \n\u3000 | U13: \n9 | V13: \n3 | W13: \n* | X13: \n10 | Y13: \n25 | Z13: \n* | AA13: \n11 | AB13: \n15 | AC13: \n\u3000 | AD13: \n12 | AE13: \n95 | AF13: \n4 | AG13: \n\u3000 | AH13: \n9
A14: \n53 | B14: \n越南 | C14: \n武明一 | D14: \n54 | E14: \n* | F14: \n1 | G14: \n6 | H14: \n\u3000 | I14: \n3 | J14: \n46 | K14: \n* | L14: \n5 | M14: \n15 | N14: \n* | O14: \n7 | P14: \n28 | Q14: \n\u3000 | R14: \n7 | S14: \n38 | T14: \n\u3000 | U14: \n7 | V14: \n36 | W14: \n* | X14: \n9 | Y14: \n40 | Z14: \n\u3000 | AA14: \n10 | AB14: \n4 | AC14: \n* | AD14: \n12 | AE14: \n92 | AF14: \n5 | AG14: \n\u3000 | AH14: \n10
A15: \n20 | B15: \n中华台北 | C15: \n刘安生 | D15: \n19 | E15: \n\u3000 | F15: \n0 | G15: \n21 | H15: \n* | I15: \n2 | J15: \n33 | K15: \n\u3000 | L15: \n2 | M15: \n14 | N15: \n* | O15: \n4 | P15: \n55 | Q15: \n\u3000 | R15: \n6 | S15: \n1 | T15: \n* | U15: \n6 | V15: \n11 | W15: \n\u3000 | X15: \n8 | Y15: \n59 | Z15: \n* | AA15: \n10 | AB15: \n57 | AC15: \n\u3000 | AD15: \n12 | AE15: \n88 | AF15: \n6 | AG15: \n\u3000 | AH15: \n11
A16: \n48 | B16: \n新加坡 | C16: \n许正豪 | D16: \n47 | E16: \n\u3000 | F16: \n2 | G16: \n61 | H16: \n* | I16: \n4 | J16: \n42 | K16: \n* | L16: \n4 | M16: \n34 | N16: \n\u3000 | O16: \n5 | P16: \n22 | Q16: \n* | R16: \n5 | S16: \n54 | T16: \n\u3000 | U16: \n7 | V16: \n37 | W16: \n\u3000 | X16: \n9 | Y16: \n1 | Z16: \n* | AA16: \n10 | AB16: \n40 | AC16: \n* | AD16: \n12 | AE16: \n86 | AF16: \n5 | AG16: \n\u3000 | AH16: \n12
A17: \n49 | B17: \n中国香港 | C17: \n黄学谦 | D17: \n50 | E17: \n* | F17: \n2 | G17: \n40 | H17: \n\u3000 | I17: \n2 | J17: \n51 | K17: \n* | L17: \n4 | M17: \n43 | N17: \n* | O17: \n5 | P17: \n6 | Q17: \n\u3000 | R17: \n6 | S17: \n57 | T17: \n* | U17: \n8 | V17: \n19 | W17: \n* | X17: \n10 | Y17: \n28 | Z17: \n\u3000 | AA17: \n10 | AB17: \n16 | AC17: \n\u3000 | AD17: \n12 | AE17: \n84 | AF17: \n5 | AG17: \n\u3000 | AH17: \n13
A18: \n24 | B18: \n越南 | C18: \n宗室日新 | D18: \n23 | E18: \n\u3000 | F18: \n2 | G18: \n25 | H18: \n* | I18: \n4 | J18: \n22 | K18: \n* | L18: \n5 | M18: \n38 | N18: \n\u3000 | O18: \n6 | P18: \n3 | Q18: \n* | R18: \n7 | S18: \n18 | T18: \n\u3000 | U18: \n7 | V18: \n34 | W18: \n* | X18: \n9 | Y18: \n39 | Z18: \n* | AA18: \n11 | AB18: \n13 | AC18: \n\u3000 | AD18: \n11 | AE18: \n99 | AF18: \n4 | AG18: \n\u3000 | AH18: \n14
A19: \n38 | B19: \n越南 | C19: \n阮黄林 | D19: \n37 | E19: \n\u3000 | F19: \n2 | G19: \n43 | H19: \n* | I19: \n4 | J19: \n40 | K19: \n\u3000 | L19: \n5 | M19: \n24 | N19: \n* | O19: \n6 | P19: \n39 | Q19: \n\u3000 | R19: \n7 | S19: \n53 | T19: \n* | U19: \n9 | V19: \n42 | W19: \n\u3000 | X19: \n9 | Y19: \n30 | Z19: \n* | AA19: \n11 | AB19: \n25 | AC19: \n\u3000 | AD19: \n11 | AE19: \n97 | AF19: \n4 | AG19: \n后胜1局 | AH19: \n15
A20: \n15 | B20: \n中国澳门 | C20: \n李锦欢 | D20: \n16 | E20: \n* | F20: \n2 | G20: \n18 | H20: \n\u3000 | I20: \n3 | J20: \n8 | K20: \n* | L20: \n5 | M20: \n53 | N20: \n\u3000 | O20: \n5 | P20: \n4 | Q20: \n* | R20: \n7 | S20: \n3 | T20: \n\u3000 | U20: \n7 | V20: \n12 | W20: \n* | X20: \n9 | Y20: \n21 | Z20: \n\u3000 | AA20: \n10 | AB20: \n33 | AC20: \n* | AD20: \n11 | AE20: \n97 | AF20: \n4 | AG20: \n后胜0局 | AH20: \n16
A21: \n22 | B21: \n中国香港 | C21: \n黄志强 | D21: \n21 | E21: \n\u3000 | F21: \n2 | G21: \n19 | H21: \n* | I21: \n4 | J21: \n24 | K21: \n\u3000 | L21: \n5 | M21: \n40 | N21: \n* | O21: \n5 | P21: \n48 | Q21: \n\u3000 | R21: \n7 | S21: \n25 | T21: \n* | U21: \n7 | V21: \n30 | W21: \n\u3000 | X21: \n7 | Y21: \n12 | Z21: \n* | AA21: \n9 | AB21: \n43 | AC21: \n\u3000 | AD21: \n11 | AE21: \n93 | AF21: \n5 | AG21: \n\u3000 | AH21: \n17
A22: \n39 | B22: \n马来西亚 | C22: \n陈有发 | D22: \n40 | E22: \n* | F22: \n0 | G22: \n50 | H22: \n\u3000 | I22: \n2 | J22: \n54 | K22: \n* | L22: \n4 | M22: \n41 | N22: \n\u3000 | O22: \n6 | P22: \n38 | Q22: \n* | R22: \n7 | S22: \n34 | T22: \n\u3000 | U22: \n9 | V22: \n60 | W22: \n* | X22: \n9 | Y22: \n24 | Z22: \n\u3000 | AA22: \n9 | AB22: \n36 | AC22: \n* | AD22: \n11 | AE22: \n84 | AF22: \n5 | AG22: \n\u3000 | AH22: \n18
A23: \n21 | B23: \n越南 | C23: \n范启源 | D23: \n22 | E23: \n* | F23: \n0 | G23: \n20 | H23: \n\u3000 | I23: \n0 | J23: \n17 | K23: \n\u3000 | L23: \n2 | M23: \n31 | N23: \n* | O23: \n4 | P23: \n57 | Q23: \n\u3000 | R23: \n4 | S23: \n14 | T23: \n* | U23: \n6 | V23: \n51 | W23: \n\u3000 | X23: \n8 | Y23: \n15 | Z23: \n* | AA23: \n9 | AB23: \n30 | AC23: \n\u3000 | AD23: \n11 | AE23: \n78 | AF23: \n5 | AG23: \n\u3000 | AH23: \n19
A24: \n40 | B24: \n中华台北 | C24: \n阮明昭 | D24: \n39 | E24: \n\u3000 | F24: \n2 | G24: \n49 | H24: \n* | I24: \n4 | J24: \n38 | K24: \n* | L24: \n5 | M24: \n22 | N24: \n\u3000 | O24: \n7 | P24: \n60 | Q24: \n* | R24: \n8 | S24: \n42 | T24: \n\u3000 | U24: \n9 | V24: \n13 | W24: \n\u3000 | X24: \n9 | Y24: \n53 | Z24: \n* | AA24: \n10 | AB24: \n48 | AC24: \n\u3000 | AD24: \n10 | AE24: \n107 | AF24: \n3 | AG24: \n\u3000 | AH24: \n20
A25: \n57 | B25: \n越南 | C25: \n阮黄燕(女) | D25: \n58 | E25: \n* | F25: \n2 | G25: \n60 | H25: \n\u3000 | I25: \n2 | J25: \n61 | K25: \n* | L25: \n4 | M25: \n16 | N25: \n\u3000 | O25: \n4 | P25: \n21 | Q25: \n* | R25: \n6 | S25: \n49 | T25: \n\u3000 | U25: \n6 | V25: \n29 | W25: \n* | X25: \n8 | Y25: \n6 | Z25: \n\u3000 | AA25: \n10 | AB25: \n20 | AC25: \n* | AD25: \n10 | AE25: \n90 | AF25: \n5 | AG25: \n\u3000 | AH25: \n21
A26: \n16 | B26: \n越南 | C26: \n阮明日光 | D26: \n15 | E26: \n\u3000 | F26: \n0 | G26: \n17 | H26: \n* | I26: \n2 | J26: \n31 | K26: \n\u3000 | L26: \n4 | M26: \n57 | N26: \n* | O26: \n6 | P26: \n33 | Q26: \n\u3000 | R26: \n6 | S26: \n51 | T26: \n* | U26: \n8 | V26: \n6 | W26: \n* | X26: \n10 | Y26: \n3 | Z26: \n\u3000 | AA26: \n10 | AB26: \n49 | AC26: \n* | AD26: \n10 | AE26: \n86 | AF26: \n5 | AG26: \n\u3000 | AH26: \n22
A27: \n59 | B27: \n马来西亚 | C27: \n黄运兴 | D27: \n60 | E27: \n* | F27: \n0 | G27: \n58 | H27: \n\u3000 | I27: \n1 | J27: \n32 | K27: \n* | L27: \n2 | M27: \n61 | N27: \n\u3000 | O27: \n4 | P27: \n46 | Q27: \n* | R27: \n6 | S27: \n6 | T27: \n\u3000 | U27: \n6 | V27: \n56 | W27: \n* | X27: \n8 | Y27: \n20 | Z27: \n\u3000 | AA27: \n8 | AB27: \n29 | AC27: \n* | AD27: \n10 | AE27: \n84 | AF27: \n4 | AG27: \n\u3000 | AH27: \n23
A28: \n4 | B28: \n越南 | C28: \n汪洋北 | D28: \n3 | E28: \n\u3000 | F28: \n0 | G28: \n2 | H28: \n* | I28: \n2 | J28: \n55 | K28: \n\u3000 | L28: \n3 | M28: \n58 | N28: \n* | O28: \n5 | P28: \n15 | Q28: \n\u3000 | R28: \n5 | S28: \n11 | T28: \n* | U28: \n6 | V28: \n5 | W28: \n\u3000 | X28: \n8 | Y28: \n19 | Z28: \n* | AA28: \n10 | AB28: \n53 | AC28: \n\u3000 | AD28: \n10 | AE28: \n83 | AF28: \n4 | AG28: \n\u3000 | AH28: \n24
A29: \n46 | B29: \n荷兰 | C29: \n吴永生 | D29: \n45 | E29: \n\u3000 | F29: \n2 | G29: \n55 | H29: \n* | I29: \n3 | J29: \n53 | K29: \n\u3000 | L29: \n3 | M29: \n5 | N29: \n* | O29: \n4 | P29: \n59 | Q29: \n\u3000 | R29: \n4 | S29: \n9 | T29: \n* | U29: \n6 | V29: \n41 | W29: \n\u3000 | X29: \n7 | Y29: \n32 | Z29: \n* | AA29: \n8 | AB29: \n27 | AC29: \n\u3000 | AD29: \n10 | AE29: \n77 | AF29: \n3 | AG29: \n\u3000 | AH29: \n25
A30: \n30 | B30: \n新加坡 | C30: \n黄俊铭 | D30: \n29 | E30: \n\u3000 | F30: \n2 | G30: \n33 | H30: \n* | I30: \n4 | J30: \n28 | K30: \n*- | L30: \n4 | M30: \n18 | N30: \n\u3000 | O30: \n5 | P30: \n34 | Q30: \n* | R30: \n5 | S30: \n26 | T30: \n\u3000 | U30: \n7 | V30: \n22 | W30: \n* | X30: \n9 | Y30: \n38 | Z30: \n\u3000 | AA30: \n9 | AB30: \n21 | AC30: \n* | AD30: \n9 | AE30: \n95 | AF30: \n4 | AG30: \n\u3000 | AH30: \n26
A31: \n19 | B31: \n中国香港 | C31: \n翁德強 | D31: \n20 | E31: \n* | F31: \n2 | G31: \n22 | H31: \n\u3000 | I31: \n2 | J31: \n12 | K31: \n* | L31: \n4 | M31: \n25 | N31: \n\u3000 | O31: \n4 | P31: \n41 | Q31: \n* | R31: \n6 | S31: \n5 | T31: \n* | U31: \n8 | V31: \n49 | W31: \n\u3000 | X31: \n8 | Y31: \n4 | Z31: \n\u3000 | AA31: \n8 | AB31: \n11 | AC31: \n* | AD31: \n9 | AE31: \n93 | AF31: \n4 | AG31: \n\u3000 | AH31: \n27
A32: \n11 | B32: \n越南 | C32: \n吴兰香(女) | D32: \n12 | E32: \n* | F32: \n2 | G32: \n8 | H32: \n\u3000 | I32: \n3 | J32: \n18 | K32: \n* | L32: \n4 | M32: \n1 | N32: \n* | O32: \n4 | P32: \n36 | Q32: \n\u3000 | R32: \n5 | S32: \n4 | T32: \n\u3000 | U32: \n6 | V32: \n20 | W32: \n* | X32: \n6 | Y32: \n9 | Z32: \n* | AA32: \n8 | AB32: \n19 | AC32: \n\u3000 | AD32: \n9 | AE32: \n90 | AF32: \n2 | AG32: \n\u3000 | AH32: \n28
A33: \n6 | B33: \n马来西亚 | C33: \n黎金福 | D33: \n5 | E33: \n\u3000 | F33: \n1 | G33: \n53 | H33: \n* | I33: \n1 | J33: \n27 | K33: \n\u3000 | L33: \n3 | M33: \n8 | N33: \n\u3000 | O33: \n5 | P33: \n49 | Q33: \n* | R33: \n6 | S33: \n59 | T33: \n* | U33: \n8 | V33: \n16 | W33: \n\u3000 | X33: \n8 | Y33: \n57 | Z33: \n* | AA33: \n8 | AB33: \n31 | AC33: \n\u3000 | AD33: \n9 | AE33: \n86 | AF33: \n3 | AG33: \n\u3000 | AH33: \n29
A34: \n31 | B34: \n德国 | C34: \n濮方尧 | D34: \n32 | E34: \n* | F34: \n2 | G34: \n28 | H34: \n\u3000 | I34: \n2 | J34: \n16 | K34: \n* | L34: \n2 | M34: \n21 | N34: \n\u3000 | O34: \n2 | P34: \n61 | Q34: \n* | R34: \n4 | S34: \n50 | T34: \n\u3000 | U34: \n5 | V34: \n26 | W34: \n* | X34: \n6 | Y34: \n56 | Z34: \n\u3000 | AA34: \n8 | AB34: \n6 | AC34: \n* | AD34: \n9 | AE34: \n85 | AF34: \n3 | AG34: \n\u3000 | AH34: \n30
A35: \n43 | B35: \n新加坡 | C35: \n康德荣 | D35: \n44 | E35: \n* | F35: \n2 | G35: \n38 | H35: \n\u3000 | I35: \n2 | J35: \n47 | K35: \n* | L35: \n4 | M35: \n49 | N35: \n\u3000 | O35: \n5 | P35: \n18 | Q35: \n* | R35: \n5 | S35: \n36 | T35: \n\u3000 | U35: \n5 | V35: \n50 | W35: \n* | X35: \n7 | Y35: \n34 | Z35: \n\u3000 | AA35: \n9 | AB35: \n22 | AC35: \n* | AD35: \n9 | AE35: \n80 | AF35: \n4 | AG35: \n\u3000 | AH35: \n31
A36: \n41 | B36: \n新加坡 | C36: \n蔡俊杰 | D36: \n42 | E36: \n* | F36: \n0 | G36: \n52 | H36: \n\u3000 | I36: \n2 | J36: \n56 | K36: \n* | L36: \n4 | M36: \n39 | N36: \n* | O36: \n4 | P36: \n19 | Q36: \n\u3000 | R36: \n4 | S36: \n58 | T36: \n\u3000 | U36: \n5 | V36: \n46 | W36: \n* | X36: \n6 | Y36: \n54 | Z36: \n\u3000 | AA36: \n7 | AB36: \n34 | AC36: \n* | AD36: \n9 | AE36: \n79 | AF36: \n3 | AG36: \n\u3000 | AH36: \n32
A37: \n36 | B37: \n中国香港 | C37: \n陈永乐 | D37: \n35 | E37: \n\u3000 | F37: \n1 | G37: \n5 | H37: \n* | I37: \n1 | J37: \n58 | K37: \n\u3000 | L37: \n2 | M37: \n44 | N37: \n\u3000 | O37: \n4 | P37: \n11 | Q37: \n* | R37: \n5 | S37: \n43 | T37: \n* | U37: \n7 | V37: \n53 | W37: \n\u3000 | X37: \n7 | Y37: \n37 | Z37: \n* | AA37: \n9 | AB37: \n39 | AC37: \n\u3000 | AD37: \n9 | AE37: \n77 | AF37: \n3 | AG37: \n\u3000 | AH37: \n33
A38: \n32 | B38: \n越南 | C38: \n黎明智 | D38: \n31 | E38: \n\u3000 | F38: \n0 | G38: \n27 | H38: \n* | I38: \n1 | J38: \n59 | K38: \n\u3000 | L38: \n2 | M38: \n26 | N38: \n* | O38: \n3 | P38: \n23 | Q38: \n\u3000 | R38: \n5 | S38: \n37 | T38: \n* | U38: \n5 | V38: \n8 | W38: \n* | X38: \n7 | Y38: \n46 | Z38: \n\u3000 | AA38: \n8 | AB38: \n61 | AC38: \n* | AD38: \n9 | AE38: \n77 | AF38: \n2 | AG38: \n\u3000 | AH38: \n34
A39: \n37 | B39: \n中国香港 | C39: \n蓝政鸿 | D39: \n38 | E39: \n* | F39: \n0 | G39: \n44 | H39: \n\u3000 | I39: \n2 | J39: \n34 | K39: \n* | L39: \n2 | M39: \n47 | N39: \n\u3000 | O39: \n4 | P39: \n12 | Q39: \n* | R39: \n5 | S39: \n32 | T39: \n\u3000 | U39: \n7 | V39: \n48 | W39: \n* | X39: \n7 | Y39: \n36 | Z39: \n\u3000 | AA39: \n7 | AB39: \n50 | AC39: \n* | AD39: \n9 | AE39: \n74 | AF39: \n4 | AG39: \n后胜3局 | AH39: \n35
A40: \n12 | B40: \n加拿大 | C40: \n顾亿庆 | D40: \n11 | E40: \n\u3000 | F40: \n0 | G40: \n7 | H40: \n* | I40: \n2 | J40: \n19 | K40: \n\u3000 | L40: \n2 | M40: \n10 | N40: \n* | O40: \n4 | P40: \n37 | Q40: \n\u3000 | R40: \n5 | S40: \n55 | T40: \n* | U40: \n7 | V40: \n15 | W40: \n\u3000 | X40: \n7 | Y40: \n22 | Z40: \n\u3000 | AA40: \n7 | AB40: \n8 | AC40: \n* | AD40: \n9 | AE40: \n74 | AF40: \n4 | AG40: \n后胜0局 | AH40: \n36
A41: \n61 | B41: \n马来西亚 | C41: \n吴将玮 | D41: \n62 | E41: \n*+ | F41: \n2 | G41: \n48 | H41: \n\u3000 | I41: \n2 | J41: \n57 | K41: \n\u3000 | L41: \n2 | M41: \n59 | N41: \n* | O41: \n2 | P41: \n31 | Q41: \n\u3000 | R41: \n2 | S41: \n45 | T41: \n* | U41: \n4 | V41: \n14 | W41: \n\u3000 | X41: \n6 | Y41: \n51 | Z41: \n* | AA41: \n8 | AB41: \n32 | AC41: \n\u3000 | AD41: \n9 | AE41: \n71 | AF41: \n4 | AG41: \n\u3000 | AH41: \n37
A42: \n55 | B42: \n马来西亚 | C42: \n姚威和 | D42: \n56 | E42: \n* | F42: \n2 | G42: \n46 | H42: \n\u3000 | I42: \n3 | J42: \n4 | K42: \n* | L42: \n4 | M42: \n3 | N42: \n\u3000 | O42: \n4 | P42: \n20 | Q42: \n* | R42: \n4 | S42: \n12 | T42: \n\u3000 | U42: \n4 | V42: \n52 | W42: \n\u3000 | X42: \n6 | Y42: \n58 | Z42: \n* | AA42: \n7 | AB42: \n54 | AC42: \n\u3000 | AD42: \n8 | AE42: \n83 | AF42: \n2 | AG42: \n\u3000 | AH42: \n38
A43: \n5 | B43: \n中国香港 | C43: \n雷雄才 | D43: \n6 | E43: \n* | F43: \n1 | G43: \n36 | H43: \n\u3000 | I43: \n3 | J43: \n60 | K43: \n* | L43: \n3 | M43: \n46 | N43: \n\u3000 | O43: \n4 | P43: \n35 | Q43: \n* | R43: \n6 | S43: \n19 | T43: \n\u3000 | U43: \n6 | V43: \n4 | W43: \n* | X43: \n6 | Y43: \n8 | Z43: \n\u3000 | AA43: \n6 | AB43: \n10 | AC43: \n\u3000 | AD43: \n8 | AE43: \n80 | AF43: \n3 | AG43: \n\u3000 | AH43: \n39
A44: \n54 | B44: \n中国香港 | C44: \n谭伟伦 | D44: \n53 | E44: \n\u3000 | F44: \n1 | G44: \n35 | H44: \n* | I44: \n2 | J44: \n39 | K44: \n\u3000 | L44: \n2 | M44: \n50 | N44: \n* | O44: \n3 | P44: \n10 | Q44: \n\u3000 | R44: \n5 | S44: \n48 | T44: \n* | U44: \n5 | V44: \n58 | W44: \n\u3000 | X44: \n6 | Y44: \n41 | Z44: \n* | AA44: \n7 | AB44: \n55 | AC44: \n* | AD44: \n8 | AE44: \n80 | AF44: \n1 | AG44: \n\u3000 | AH44: \n40
A45: \n26 | B45: \n中华台北 | C45: \n游原硕 | D45: \n25 | E45: \n\u3000 | F45: \n0 | G45: \n23 | H45: \n* | I45: \n2 | J45: \n35 | K45: \n\u3000 | L45: \n2 | M45: \n32 | N45: \n\u3000 | O45: \n3 | P45: \n8 | Q45: \n* | R45: \n5 | S45: \n30 | T45: \n* | U45: \n5 | V45: \n31 | W45: \n\u3000 | X45: \n6 | Y45: \n27 | Z45: \n* | AA45: \n6 | AB45: \n58 | AC45: \n\u3000 | AD45: \n8 | AE45: \n77 | AF45: \n3 | AG45: \n\u3000 | AH45: \n41
A46: \n27 | B46: \n马来西亚 | C46: \n苏怡龙 | D46: \n28 | E46: \n* | F46: \n0 | G46: \n32 | H46: \n\u3000 | I46: \n1 | J46: \n6 | K46: \n* | L46: \n1 | M46: \n29 | N46: \n\u3000 | O46: \n1 | P46: \n52 | Q46: \n* | R46: \n2 | S46: \n47 | T46: \n\u3000 | U46: \n4 | V46: \n17 | W46: \n* | X46: \n6 | Y46: \n26 | Z46: \n\u3000 | AA46: \n8 | AB46: \n46 | AC46: \n* | AD46: \n8 | AE46: \n74 | AF46: \n3 | AG46: \n\u3000 | AH46: \n42
A47: \n35 | B47: \n中华台北 | C47: \n许明龙 | D47: \n36 | E47: \n* | F47: \n1 | G47: \n54 | H47: \n\u3000 | I47: \n2 | J47: \n26 | K47: \n* | L47: \n4 | M47: \n33 | N47: \n* | O47: \n4 | P47: \n5 | Q47: \n\u3000 | R47: \n4 | S47: \n56 | T47: \n\u3000 | U47: \n4 | V47: \n2 | W47: \n* | X47: \n6 | Y47: \n29 | Z47: \n\u3000 | AA47: \n6 | AB47: \n14 | AC47: \n\u3000 | AD47: \n8 | AE47: \n73 | AF47: \n3 | AG47: \n\u3000 | AH47: \n43
A48: \n29 | B48: \n越南 | C48: \n陈慧莹(女) | D48: \n30 | E48: \n* | F48: \n0 | G48: \n34 | H48: \n\u3000 | I48: \n0 | J48: \n23 | K48: \n\u3000 | L48: \n1 | M48: \n27 | N48: \n* | O48: \n3 | P48: \n50 | Q48: \n\u3000 | R48: \n4 | S48: \n7 | T48: \n* | U48: \n6 | V48: \n57 | W48: \n\u3000 | X48: \n6 | Y48: \n35 | Z48: \n* | AA48: \n8 | AB48: \n59 | AC48: \n\u3000 | AD48: \n8 | AE48: \n70 | AF48: \n3 | AG48: \n\u3000 | AH48: \n44
A49: \n56 | B49: \n日本 | C49: \n所司和晴 | D49: \n55 | E49: \n\u3000 | F49: \n0 | G49: \n45 | H49: \n* | I49: \n2 | J49: \n41 | K49: \n\u3000 | L49: \n2 | M49: \n9 | N49: \n* | O49: \n4 | P49: \n51 | Q49: \n\u3000 | R49: \n4 | S49: \n35 | T49: \n* | U49: \n6 | V49: \n59 | W49: \n\u3000 | X49: \n6 | Y49: \n31 | Z49: \n* | AA49: \n6 | AB49: \n47 | AC49: \n\u3000 | AD49: \n8 | AE49: \n69 | AF49: \n4 | AG49: \n\u3000 | AH49: \n45
A50: \n9 | B50: \n美国 | C50: \n李新达 | D50: \n10 | E50: \n* | F50: \n0 | G50: \n14 | H50: \n\u3000 | I50: \n0 | J50: \n52 | K50: \n* | L50: \n2 | M50: \n56 | N50: \n\u3000 | O50: \n2 | P50: \n47 | Q50: \n* | R50: \n4 | S50: \n46 | T50: \n\u3000 | U50: \n4 | V50: \n7 | W50: \n* | X50: \n6 | Y50: \n11 | Z50: \n\u3000 | AA50: \n6 | AB50: \n51 | AC50: \n\u3000 | AD50: \n8 | AE50: \n61 | AF50: \n4 | AG50: \n\u3000 | AH50: \n46
A51: \n34 | B51: \n汶莱 | C51: \n庄力铭 | D51: \n33 | E51: \n\u3000 | F51: \n0 | G51: \n29 | H51: \n* | I51: \n2 | J51: \n37 | K51: \n\u3000 | L51: \n4 | M51: \n48 | N51: \n* | O51: \n5 | P51: \n30 | Q51: \n\u3000 | R51: \n7 | S51: \n39 | T51: \n* | U51: \n7 | V51: \n24 | W51: \n\u3000 | X51: \n7 | Y51: \n43 | Z51: \n* | AA51: \n7 | AB51: \n41 | AC51: \n\u3000 | AD51: \n7 | AE51: \n90 | AF51: \n3 | AG51: \n\u3000 | AH51: \n47
A52: \n50 | B52: \n新加坡 | C52: \n赵金山 | D52: \n49 | E52: \n\u3000 | F52: \n0 | G52: \n39 | H52: \n* | I52: \n0 | J52: \n7 | K52: \n\u3000 | L52: \n2 | M52: \n54 | N52: \n\u3000 | O52: \n3 | P52: \n29 | Q52: \n* | R52: \n4 | S52: \n31 | T52: \n* | U52: \n5 | V52: \n43 | W52: \n\u3000 | X52: \n5 | Y52: \n23 | Z52: \n* | AA52: \n7 | AB52: \n37 | AC52: \n\u3000 | AD52: \n7 | AE52: \n77 | AF52: \n2 | AG52: \n\u3000 | AH52: \n48
A53: \n58 | B53: \n中国香港 | C53: \n欧志强 | D53: \n57 | E53: \n\u3000 | F53: \n0 | G53: \n59 | H53: \n* | I53: \n1 | J53: \n36 | K53: \n* | L53: \n2 | M53: \n4 | N53: \n\u3000 | O53: \n2 | P53: \n45 | Q53: \n\u3000 | R53: \n4 | S53: \n41 | T53: \n* | U53: \n5 | V53: \n54 | W53: \n* | X53: \n6 | Y53: \n55 | Z53: \n\u3000 | AA53: \n7 | AB53: \n26 | AC53: \n* | AD53: \n7 | AE53: \n77 | AF53: \n1 | AG53: \n\u3000 | AH53: \n49
A54: \n8 | B54: \n法国 | C54: \n胡伟长 | D54: \n7 | E54: \n\u3000 | F54: \n2 | G54: \n11 | H54: \n* | I54: \n3 | J54: \n15 | K54: \n\u3000 | L54: \n3 | M54: \n6 | N54: \n* | O54: \n3 | P54: \n26 | Q54: \n\u3000 | R54: \n3 | S54: \n23 | T54: \n* | U54: \n5 | V54: \n32 | W54: \n\u3000 | X54: \n5 | Y54: \n5 | Z54: \n* | AA54: \n7 | AB54: \n12 | AC54: \n\u3000 | AD54: \n7 | AE54: \n74 | AF54: \n3 | AG54: \n\u3000 | AH54: \n50
A55: \n23 | B55: \n中国香港 | C55: \n黄树楷 | D55: \n24 | E55: \n* | F55: \n0 | G55: \n26 | H55: \n\u3000 | I55: \n0 | J55: \n29 | K55: \n* | L55: \n1 | M55: \n52 | N55: \n\u3000 | O55: \n3 | P55: \n32 | Q55: \n* | R55: \n3 | S55: \n8 | T55: \n\u3000 | U55: \n3 | V55: \n44 | W55: \n* | X55: \n5 | Y55: \n50 | Z55: \n\u3000 | AA55: \n5 | AB55: \n17 | AC55: \n*+ | AD55: \n7 | AE55: \n64 | AF55: \n3 | AG55: \n\u3000 | AH55: \n51
A56: \n14 | B56: \n新加坡 | C56: \n巫宇斌 | D56: \n13 | E56: \n\u3000 | F56: \n0 | G56: \n9 | H56: \n* | I56: \n2 | J56: \n25 | K56: \n\u3000 | L56: \n2 | M56: \n20 | N56: \n\u3000 | O56: \n2 | P56: \n2 | Q56: \n* | R56: \n4 | S56: \n21 | T56: \n\u3000 | U56: \n4 | V56: \n61 | W56: \n* | X56: \n4 | Y56: \n17 | Z56: \n\u3000 | AA56: \n6 | AB56: \n35 | AC56: \n* | AD56: \n6 | AE56: \n84 | AF56: \n3 | AG56: \n\u3000 | AH56: \n52
A57: \n51 | B57: \n英国 | C57: \n彭铂 | D57: \n52 | E57: \n* | F57: \n2 | G57: \n42 | H57: \n\u3000 | I57: \n2 | J57: \n49 | K57: \n\u3000 | L57: \n2 | M57: \n45 | N57: \n* | O57: \n4 | P57: \n56 | Q57: \n* | R57: \n6 | S57: \n16 | T57: \n\u3000 | U57: \n6 | V57: \n21 | W57: \n* | X57: \n6 | Y57: \n61 | Z57: \n\u3000 | AA57: \n6 | AB57: \n9 | AC57: \n* | AD57: \n6 | AE57: \n82 | AF57: \n3 | AG57: \n\u3000 | AH57: \n53
A58: \n10 | B58: \n中国香港 | C58: \n黄照 | D58: \n9 | E58: \n\u3000 | F58: \n2 | G58: \n13 | H58: \n* | I58: \n2 | J58: \n1 | K58: \n\u3000 | L58: \n2 | M58: \n12 | N58: \n\u3000 | O58: \n2 | P58: \n54 | Q58: \n* | R58: \n2 | S58: \n2 | T58: \n\u3000 | U58: \n2 | V58: \n62 | W58: \n*+ | X58: \n4 | Y58: \n7 | Z58: \n\u3000 | AA58: \n6 | AB58: \n5 | AC58: \n* | AD58: \n6 | AE58: \n73 | AF58: \n3 | AG58: \n\u3000 | AH58: \n54
A59: \n47 | B59: \n澳大利亚 | C59: \n邓宜兵 | D59: \n48 | E59: \n* | F59: \n0 | G59: \n62 | H59: \n+ | I59: \n2 | J59: \n43 | K59: \n\u3000 | L59: \n2 | M59: \n37 | N59: \n* | O59: \n2 | P59: \n9 | Q59: \n\u3000 | R59: \n2 | S59: \n27 | T59: \n* | U59: \n2 | V59: \n45 | W59: \n\u3000 | X59: \n4 | Y59: \n2 | Z59: \n\u3000 | AA59: \n6 | AB59: \n56 | AC59: \n* | AD59: \n6 | AE59: \n69 | AF59: \n3 | AG59: \n\u3000 | AH59: \n55
A60: \n2 | B60: \n加拿大 | C60: \n郑世豪 | D60: \n1 | E60: \n\u3000 | F60: \n0 | G60: \n4 | H60: \n\u3000 | I60: \n0 | J60: \n44 | K60: \n* | L60: \n0 | M60: \n17 | N60: \n* | O60: \n2 | P60: \n14 | Q60: \n\u3000 | R60: \n2 | S60: \n10 | T60: \n* | U60: \n4 | V60: \n35 | W60: \n\u3000 | X60: \n4 | Y60: \n47 | Z60: \n* | AA60: \n4 | AB60: \n62 | AC60: \n*+ | AD60: \n6 | AE60: \n61 | AF60: \n3 | AG60: \n\u3000 | AH60: \n56
A61: \n52 | B61: \n澳大利亚 | C61: \n余穗康 | D61: \n51 | E61: \n\u3000 | F61: \n0 | G61: \n41 | H61: \n* | I61: \n0 | J61: \n9 | K61: \n\u3000 | L61: \n0 | M61: \n23 | N61: \n* | O61: \n0 | P61: \n27 | Q61: \n\u3000 | R61: \n1 | S61: \n62 | T61: \n+ | U61: \n3 | V61: \n55 | W61: \n* | X61: \n3 | Y61: \n45 | Z61: \n* | AA61: \n4 | AB61: \n7 | AC61: \n\u3000 | AD61: \n6 | AE61: \n59 | AF61: \n2 | AG61: \n\u3000 | AH61: \n57
A62: \n45 | B62: \n芬兰 | C62: \n邓明高 | D62: \n46 | E62: \n* | F62: \n0 | G62: \n56 | H62: \n\u3000 | I62: \n0 | J62: \n62 | K62: \n*+ | L62: \n2 | M62: \n51 | N62: \n\u3000 | O62: \n2 | P62: \n58 | Q62: \n* | R62: \n2 | S62: \n61 | T62: \n\u3000 | U62: \n2 | V62: \n47 | W62: \n* | X62: \n2 | Y62: \n52 | Z62: \n\u3000 | AA62: \n3 | AB62: \n44 | AC62: \n* | AD62: \n5 | AE62: \n60 | AF62: \n2 | AG62: \n\u3000 | AH62: \n58
A63: \n17 | B63: \n荷兰 | C63: \n余晓兰(女) | D63: \n18 | E63: \n* | F63: \n0 | G63: \n16 | H63: \n\u3000 | I63: \n0 | J63: \n21 | K63: \n* | L63: \n0 | M63: \n2 | N63: \n\u3000 | O63: \n0 | P63: \n62 | Q63: \n*+ | R63: \n2 | S63: \n44 | T63: \n\u3000 | U63: \n4 | V63: \n27 | W63: \n\u3000 | X63: \n4 | Y63: \n14 | Z63: \n* | AA63: \n4 | AB63: \n23 | AC63: \n- | AD63: \n4 | AE63: \n69 | AF63: \n2 | AG63: \n\u3000 | AH63: \n59
A64: \n7 | B64: \n澳大利亚 | C64: \n陈一鸣 | D64: \n8 | E64: \n* | F64: \n0 | G64: \n12 | H64: \n\u3000 | I64: \n0 | J64: \n50 | K64: \n* | L64: \n0 | M64: \n62 | N64: \n+ | O64: \n2 | P64: \n44 | Q64: \n* | R64: \n4 | S64: \n29 | T64: \n\u3000 | U64: \n4 | V64: \n9 | W64: \n\u3000 | X64: \n4 | Y64: \n10 | Z64: \n* | AA64: \n4 | AB64: \n52 | AC64: \n* | AD64: \n4 | AE64: \n59 | AF64: \n2 | AG64: \n\u3000 | AH64: \n60
A65: \n44 | B65: \n日本 | C65: \n三桥泰朗 | D65: \n43 | E65: \n\u3000 | F65: \n0 | G65: \n37 | H65: \n* | I65: \n0 | J65: \n2 | K65: \n\u3000 | L65: \n2 | M65: \n36 | N65: \n* | O65: \n2 | P65: \n7 | Q65: \n\u3000 | R65: \n2 | S65: \n17 | T65: \n* | U65: \n2 | V65: \n23 | W65: \n\u3000 | X65: \n2 | Y65: \n62 | Z65: \n*+ | AA65: \n4 | AB65: \n45 | AC65: \n\u3000 | AD65: \n4 | AE65: \n57 | AF65: \n2 | AG65: \n\u3000 | AH65: \n61
A66: \n62 | B66: \n轮空 | C66: \n轮空 | D66: \n61 | E66: \n- | F66: \n0 | G66: \n47 | H66: \n*- | I66: \n0 | J66: \n45 | K66: \n- | L66: \n0 | M66: \n7 | N66: \n*- | O66: \n0 | P66: \n17 | Q66: \n- | R66: \n0 | S66: \n52 | T66: \n*- | U66: \n0 | V66: \n10 | W66: \n- | X66: \n0 | Y66: \n44 | Z66: \n- | AA66: \n0 | AB66: \n2 | AC66: \n*- | AD66: \n0 | AE66: \n50 | AF66: \n0 | AG66: \n\u3000 | AH66: \n62

A1: \n \n \n \n裁判长：蔡伟林 2012年9月17日—21日·凤岗 \n[此贴子已经被作者于2012-9-21 12:43:04编辑过]

A1: \n第5届“杨官璘杯”全国象棋公开赛 专业组（男子）名次
A2: \n | B2: \n | C2: \n | D2: \n | E2: \n | F2: \n | G2: \n | H2: \n
A3: \n名次 | B3: \n代表队 | C3: \n姓 名 | D3: \n积分 | E3: \n对手分 | F3: \n胜局 | G3: \n犯规 | H3: \n备注
A4: \n 1 | B4: \n湖北 | C4: \n洪 智 | D4: \n14 | E4: \n88 | F4: \n5 | G4: \n\u3000 | H4: \n\u3000
A5: \n 2 | B5: \n湖北 | C5: \n汪 洋 | D5: \n13 | E5: \n92 | F5: \n4 | G5: \n\u3000 | H5: \n\u3000
A6: \n 3 | B6: \n浙江 | C6: \n赵鑫鑫 | D6: \n12 | E6: \n95 | F6: \n3 | G6: \n\u3000 | H6: \n\u3000
A7: \n 4 | B7: \n厦门 | C7: \n郑一泓 | D7: \n11 | E7: \n88 | F7: \n4 | G7: \n\u3000 | H7: \n\u3000
A8: \n 5 | B8: \n北京 | C8: \n蒋 川 | D8: \n10 | E8: \n89 | F8: \n2 | G8: \n\u3000 | H8: \n\u3000
A9: \n 6 | B9: \n上海 | C9: \n孙勇征 | D9: \n10 | E9: \n87 | F9: \n3 | G9: \n\u3000 | H9: \n\u3000
A10: \n 7 | B10: \n河北 | C10: \n申 鹏 | D10: \n10 | E10: \n85 | F10: \n3 | G10: \n\u3000 | H10: \n\u3000
A11: \n 8 | B11: \n北京 | C11: \n张 强 | D11: \n10 | E11: \n84 | F11: \n3 | G11: \n\u3000 | H11: \n\u3000
A12: \n 9 | B12: \n黑龙江 | C12: \n聂铁文 | D12: \n9 | E12: \n93 | F12: \n2 | G12: \n\u3000 | H12: \n\u3000
A13: \n10 | B13: \n四川 | C13: \n郑惟桐 | D13: \n9 | E13: \n89 | F13: \n2 | G13: \n\u3000 | H13: \n\u3000
A14: \n11 | B14: \n浙江 | C14: \n黄竹风 | D14: \n9 | E14: \n88 | F14: \n1 | G14: \n\u3000 | H14: \n\u3000
A15: \n12 | B15: \n上海 | C15: \n谢 靖 | D15: \n9 | E15: \n87 | F15: \n2 | G15: \n\u3000 | H15: \n\u3000
A16: \n13 | B16: \n上海 | C16: \n万春林 | D16: \n9 | E16: \n73 | F16: \n3 | G16: \n\u3000 | H16: \n\u3000
A17: \n14 | B17: \n浙江 | C17: \n于幼华 | D17: \n9 | E17: \n67 | F17: \n3 | G17: \n\u3000 | H17: \n\u3000
A18: \n15 | B18: \n广东 | C18: \n张学潮 | D18: \n8 | E18: \n80 | F18: \n2 | G18: \n\u3000 | H18: \n\u3000
A19: \n16 | B19: \n河南 | C19: \n李少庚 | D19: \n8 | E19: \n73 | F19: \n2 | G19: \n\u3000 | H19: \n\u3000
A20: \n17 | B20: \n湖北 | C20: \n李雪松 | D20: \n8 | E20: \n64 | F20: \n0 | G20: \n\u3000 | H20: \n\u3000
A21: \n18 | B21: \n江苏 | C21: \n徐天红 | D21: \n7 | E21: \n75 | F21: \n1 | G21: \n\u3000 | H21: \n\u3000
A22: \n19 | B22: \n湖北 | C22: \n柳大华 | D22: \n7 | E22: \n72 | F22: \n2 | G22: \n\u3000 | H22: \n\u3000
A23: \n20 | B23: \n黑龙江 | C23: \n陶汉明 | D23: \n7 | E23: \n70 | F23: \n2 | G23: \n\u3000 | H23: \n\u3000
A24: \n21 | B24: \n河北 | C24: \n陆伟韬 | D24: \n6 | E24: \n71 | F24: \n1 | G24: \n\u3000 | H24: \n\u3000
A25: \n22 | B25: \n火车头 | C25: \n孙 博 | D25: \n3 | E25: \n72 | F25: \n1 | G25: \n\u3000 | H25: \n\u3000
A26: \n

A1: \n \n \n \n \n比赛地点：凤岗 比赛时间：2012年9月17-21日 \n裁判长：蔡伟林 编排：刘 征 \n[此贴子已经被作者于2012-9-21 12:33:45编辑过]

A1: \n第五届“杨官璘杯”全国象棋公开赛 女子组 成绩表
A3: \n代号 | B3: \n单 位 | C3: \n姓 名 | D3: \n对手号及成绩 | N3: \n积 分 | O3: \n小 分 | P3: \n胜局 | Q3: \n备注 | R3: \n名次
D4: \n1 | E4: \n2 | F4: \n3 | G4: \n4 | H4: \n5 | I4: \n6 | J4: \n7 | K4: \n8 | L4: \n9 | M4: \n10
A5: \n1 | B5: \n云南 | C5: \n \n \n | D5: \n\u3000 | E5: 1 | F5: 1 | G5: 0 | H5: 1 | I5: 1 | J5: 0 | K5: 2 | L5: 1 | M5: 2 | N5: =SUM(D5:M5) -> 9 | O5: =(D5*N$5+E5*N$6+F5*N$7+G5*N$8+H5*N$9+I5*N$10+J5*N$11+K5*N$12+L5*N$13+M5*N$14)/2 -> 37 | P5: =COUNTIF(D5:M5,2) -> \n2 | Q5: \n\u3000 | R5: \n7
A6: \n2 | B6: \n江苏 | C6: \n杨伊 | D6: 1 | E6: \n\u3000 | F6: 0 | G6: 1 | H6: 1 | I6: 2 | J6: 1 | K6: 1 | L6: 0 | M6: 2 | N6: =SUM(D6:M6) -> 9 | O6: =(D6*N$5+E6*N$6+F6*N$7+G6*N$8+H6*N$9+I6*N$10+J6*N$11+K6*N$12+L6*N$13+M6*N$14)/2 -> 37 | P6: =COUNTIF(D6:M6,2) -> \n2 | Q6: \n对局时后走 | R6: \n6
A7: \n3 | B7: \n河北 | C7: \n玉思源 | D7: 1 | E7: 2 | F7: \n\u3000 | G7: 1 | H7: 1 | I7: 1 | J7: 1 | K7: 1 | L7: 0 | M7: 1 | N7: =SUM(D7:M7) -> 9 | O7: =(D7*N$5+E7*N$6+F7*N$7+G7*N$8+H7*N$9+I7*N$10+J7*N$11+K7*N$12+L7*N$13+M7*N$14)/2 -> 39 | P7: =COUNTIF(D7:M7,2) -> \n1 | Q7: \n\u3000 | R7: \n5
A8: \n4 | B8: \n广东 | C8: \n陈幸琳 | D8: 2 | E8: 1 | F8: 1 | G8: \n\u3000 | H8: 1 | I8: 2 | J8: 0 | K8: 1 | L8: 0 | M8: 0 | N8: =SUM(D8:M8) -> 8 | O8: =(D8*N$5+E8*N$6+F8*N$7+G8*N$8+H8*N$9+I8*N$10+J8*N$11+K8*N$12+L8*N$13+M8*N$14)/2 -> 29.5 | P8: =COUNTIF(D8:M8,2) -> \n2 | Q8: \n\u3000 | R8: \n8
A9: \n5 | B9: \n河北 | C9: \n张婷婷 | D9: 1 | E9: 1 | F9: 1 | G9: 1 | H9: \n\u3000 | I9: 1 | J9: 0 | K9: 2 | L9: 1 | M9: 2 | N9: =SUM(D9:M9) -> 10 | O9: =(D9*N$5+E9*N$6+F9*N$7+G9*N$8+H9*N$9+I9*N$10+J9*N$11+K9*N$12+L9*N$13+M9*N$14)/2 -> 40.5 | P9: =COUNTIF(D9:M9,2) -> \n2 | Q9: \n\u3000 | R9: \n4
A10: \n6 | B10: \n广东 | C10: \n蒋倩仪 | D10: 1 | E10: 0 | F10: 1 | G10: 0 | H10: 1 | I10: \n\u3000 | J10: 0 | K10: 1 | L10: 0 | M10: 0 | N10: =SUM(D10:M10) -> 4 | O10: =(D10*N$5+E10*N$6+F10*N$7+G10*N$8+H10*N$9+I10*N$10+J10*N$11+K10*N$12+L10*N$13+M10*N$14)/2 -> 16.5 | P10: =COUNTIF(D10:M10,2) -> \n0 | Q10: \n\u3000 | R10: \n10
A11: \n7 | B11: \n北京 | C11: \n唐丹 | D11: 2 | E11: 1 | F11: 1 | G11: 2 | H11: 2 | I11: 2 | J11: \n\u3000 | K11: 2 | L11: 1 | M11: 1 | N11: =SUM(D11:M11) -> 14 | O11: =(D11*N$5+E11*N$6+F11*N$7+G11*N$8+H11*N$9+I11*N$10+J11*N$11+K11*N$12+L11*N$13+M11*N$14)/2 -> 56 | P11: =COUNTIF(D11:M11,2) -> \n5 | Q11: \n\u3000 | R11: \n1
A12: \n8 | B12: \n广东 | C12: \n时凤兰 | D12: 0 | E12: 1 | F12: 1 | G12: 1 | H12: 0 | I12: 1 | J12: 0 | K12: \n\u3000 | L12: 1 | M12: 0 | N12: =SUM(D12:M12) -> 5 | O12: =(D12*N$5+E12*N$6+F12*N$7+G12*N$8+H12*N$9+I12*N$10+J12*N$11+K12*N$12+L12*N$13+M12*N$14)/2 -> 21 | P12: =COUNTIF(D12:M12,2) -> \n0 | Q12: \n\u3000 | R12: \n9
A13: \n9 | B13: \n河北 | C13: \n尤颖钦 | D13: 1 | E13: 2 | F13: 2 | G13: 2 | H13: 1 | I13: 2 | J13: 1 | K13: 1 | L13: \n\u3000 | M13: 0 | N13: =SUM(D13:M13) -> 12 | O13: =(D13*N$5+E13*N$6+F13*N$7+G13*N$8+H13*N$9+I13*N$10+J13*N$11+K13*N$12+L13*N$13+M13*N$14)/2 -> 49 | P13: =COUNTIF(D13:M13,2) -> \n4 | Q13: \n\u3000 | R13: \n2
A14: \n10 | B14: \n广东 | C14: \n陈丽淳 | D14: 0 | E14: 0 | F14: 1 | G14: 2 | H14: 0 | I14: 2 | J14: 1 | K14: 2 | L14: 2 | M14: \n\u3000 | N14: =SUM(D14:M14) -> 10 | O14: =(D14*N$5+E14*N$6+F14*N$7+G14*N$8+H14*N$9+I14*N$10+J14*N$11+K14*N$12+L14*N$13+M14*N$14)/2 -> 40.5 | P14: =COUNTIF(D14:M14,2) -> \n4 | Q14: \n\u3000 | R14: \n3

A1: 党国蕾

A1: \n \n \n[此贴子已经被作者于2012-9-21 12:53:15编辑过]

A1: \n \n第五届“杨官璘杯”全国象棋公开赛 公开组 成绩表 \n
A2: 比赛地点：凤岗镇体育馆 比赛时间：2012年9月17-21日 注：* 表示先手、 + 未对弈得分、- 弃权
A3: \n代号 | B3: \n代表队 | C3: \n姓名 | D3: \n第一轮 | G3: \n第二轮 | J3: \n第三轮 | M3: \n第四轮 | P3: \n第五轮 | S3: \n第六轮 | V3: \n第七轮 | Y3: \n第八轮 | AB3: \n第九轮 | AE3: \n对手分 | AF3: \n胜局 | AG3: \n备注 | AH3: \n名次
D4: \n对手 | F4: \n积分 | G4: \n对手 | I4: \n积分 | J4: \n对手 | L4: \n积分 | M4: \n对手 | O4: \n积分 | P4: \n对手 | R4: \n积分 | S4: \n对手 | U4: \n积分 | V4: \n对手 | X4: \n积分 | Y4: \n对手 | AA4: \n积分 | AB4: \n对手 | AD4: \n积分
A5: \n22 | B5: \n河南 | C5: \n姚洪新 | D5: \n21 | E5: \n\u3000 | F5: \n2 | G5: \n27 | H5: \n* | I5: \n4 | J5: \n14 | K5: \n* | L5: \n6 | M5: \n34 | N5: \n\u3000 | O5: \n7 | P5: \n11 | Q5: \n* | R5: \n9 | S5: \n46 | T5: \n* | U5: \n11 | V5: \n38 | W5: \n\u3000 | X5: \n12 | Y5: \n48 | Z5: \n\u3000 | AA5: \n13 | AB5: \n29 | AC5: \n* | AD5: \n15 | AE5: \n100 | AF5: \n6 | AG5: \n\u3000 | AH5: \n1
A6: \n11 | B6: \n山东 | C6: \n张申宏 | D6: \n12 | E6: \n\u3000 | F6: \n1 | G6: \n8 | H6: \n* | I6: \n3 | J6: \n15 | K6: \n\u3000 | L6: \n5 | M6: \n43 | N6: \n* | O6: \n7 | P6: \n22 | Q6: \n\u3000 | R6: \n7 | S6: \n6 | T6: \n* | U6: \n9 | V6: \n46 | W6: \n\u3000 | X6: \n10 | Y6: \n16 | Z6: \n* | AA6: \n12 | AB6: \n34 | AC6: \n* | AD6: \n14 | AE6: \n98 | AF6: \n6 | AG6: \n\u3000 | AH6: \n2
A7: \n46 | B7: \n上海 | C7: \n赵玮 | D7: \n45 | E7: \n\u3000 | F7: \n2 | G7: \n48 | H7: \n* | I7: \n4 | J7: \n43 | K7: \n\u3000 | L7: \n5 | M7: \n31 | N7: \n* | O7: \n7 | P7: \n34 | Q7: \n* | R7: \n9 | S7: \n22 | T7: \n\u3000 | U7: \n9 | V7: \n11 | W7: \n* | X7: \n10 | Y7: \n36 | Z7: \n\u3000 | AA7: \n12 | AB7: \n38 | AC7: \n* | AD7: \n13 | AE7: \n94 | AF7: \n5 | AG7: \n\u3000 | AH7: \n3
A8: \n48 | B8: \n广西 | C8: \n唐中平 | D8: \n47 | E8: \n* | F8: \n2 | G8: \n46 | H8: \n\u3000 | I8: \n2 | J8: \n10 | K8: \n* | L8: \n4 | M8: \n20 | N8: \n\u3000 | O8: \n4 | P8: \n41 | Q8: \n\u3000 | R8: \n6 | S8: \n43 | T8: \n* | U8: \n8 | V8: \n6 | W8: \n\u3000 | X8: \n10 | Y8: \n22 | Z8: \n* | AA8: \n11 | AB8: \n5 | AC8: \n\u3000 | AD8: \n13 | AE8: \n87 | AF8: \n6 | AG8: \n\u3000 | AH8: \n4
A9: \n38 | B9: \n广东 | C9: \n陈富杰 | D9: \n37 | E9: \n\u3000 | F9: \n2 | G9: \n29 | H9: \n* | I9: \n3 | J9: \n6 | K9: \n\u3000 | L9: \n4 | M9: \n41 | N9: \n* | O9: \n6 | P9: \n12 | Q9: \n\u3000 | R9: \n7 | S9: \n13 | T9: \n* | U9: \n9 | V9: \n22 | W9: \n* | X9: \n10 | Y9: \n34 | Z9: \n\u3000 | AA9: \n11 | AB9: \n46 | AC9: \n\u3000 | AD9: \n12 | AE9: \n95 | AF9: \n3 | AG9: \n\u3000 | AH9: \n5
A10: \n15 | B10: \n山东 | C10: \n赵勇霖 | D10: \n16 | E10: \n\u3000 | F10: \n1 | G10: \n12 | H10: \n* | I10: \n3 | J10: \n11 | K10: \n* | L10: \n3 | M10: \n2 | N10: \n\u3000 | O10: \n4 | P10: \n24 | Q10: \n* | R10: \n6 | S10: \n5 | T10: \n* | U10: \n7 | V10: \n13 | W10: \n\u3000 | X10: \n8 | Y10: \n20 | Z10: \n* | AA10: \n10 | AB10: \n7 | AC10: \n\u3000 | AD10: \n12 | AE10: \n94 | AF10: \n4 | AG10: \n\u3000 | AH10: \n6
A11: \n13 | B11: \n湖北 | C11: \n刘宗泽 | D11: \n14 | E11: \n* | F11: \n0 | G11: \n21 | H11: \n\u3000 | I11: \n2 | J11: \n42 | K11: \n* | L11: \n3 | M11: \n27 | N11: \n\u3000 | O11: \n5 | P11: \n23 | Q11: \n* | R11: \n7 | S11: \n38 | T11: \n\u3000 | U11: \n7 | V11: \n15 | W11: \n* | X11: \n8 | Y11: \n12 | Z11: \n\u3000 | AA11: \n10 | AB11: \n3 | AC11: \n* | AD11: \n12 | AE11: \n87 | AF11: \n5 | AG11: \n\u3000 | AH11: \n7
A12: \n34 | B12: \n北京 | C12: \n才溢 | D12: \n33 | E12: \n\u3000 | F12: \n2 | G12: \n17 | H12: \n* | I12: \n4 | J12: \n31 | K12: \n\u3000 | L12: \n6 | M12: \n22 | N12: \n* | O12: \n7 | P12: \n46 | Q12: \n\u3000 | R12: \n7 | S12: \n29 | T12: \n* | U12: \n8 | V12: \n7 | W12: \n\u3000 | X12: \n10 | Y12: \n38 | Z12: \n* | AA12: \n11 | AB12: \n11 | AC12: \n\u3000 | AD12: \n11 | AE12: \n97 | AF12: \n4 | AG12: \n\u3000 | AH12: \n8
A13: \n29 | B13: \n广东 | C13: \n李鸿嘉 | D13: \n30 | E13: \n* | F13: \n2 | G13: \n38 | H13: \n\u3000 | I13: \n3 | J13: \n7 | K13: \n* | L13: \n4 | M13: \n23 | N13: \n\u3000 | O13: \n5 | P13: \n33 | Q13: \n* | R13: \n7 | S13: \n34 | T13: \n\u3000 | U13: \n8 | V13: \n3 | W13: \n* | X13: \n9 | Y13: \n14 | Z13: \n\u3000 | AA13: \n11 | AB13: \n22 | AC13: \n\u3000 | AD13: \n11 | AE13: \n96 | AF13: \n3 | AG13: \n\u3000 | AH13: \n9
A14: \n16 | B14: \n湖南 | C14: \n向有权 | D14: \n15 | E14: \n* | F14: \n1 | G14: \n19 | H14: \n\u3000 | I14: \n3 | J14: \n2 | K14: \n* | L14: \n4 | M14: \n7 | N14: \n\u3000 | O14: \n4 | P14: \n25 | Q14: \n* | R14: \n6 | S14: \n31 | T14: \n\u3000 | U14: \n8 | V14: \n14 | W14: \n* | X14: \n10 | Y14: \n11 | Z14: \n\u3000 | AA14: \n10 | AB14: \n33 | AC14: \n* | AD14: \n11 | AE14: \n89 | AF14: \n4 | AG14: \n\u3000 | AH14: \n10
A15: \n33 | B15: \n山东 | C15: \n李翰林 | D15: \n34 | E15: \n* | F15: \n0 | G15: \n30 | H15: \n\u3000 | I15: \n2 | J15: \n24 | K15: \n\u3000 | L15: \n3 | M15: \n40 | N15: \n* | O15: \n5 | P15: \n29 | Q15: \n\u3000 | R15: \n5 | S15: \n8 | T15: \n* | U15: \n7 | V15: \n20 | W15: \n\u3000 | X15: \n8 | Y15: \n26 | Z15: \n* | AA15: \n10 | AB15: \n16 | AC15: \n\u3000 | AD15: \n11 | AE15: \n88 | AF15: \n4 | AG15: \n\u3000 | AH15: \n11
A16: \n14 | B16: \n广东 | C16: \n许国义 | D16: \n13 | E16: \n\u3000 | F16: \n2 | G16: \n6 | H16: \n* | I16: \n4 | J16: \n22 | K16: \n\u3000 | L16: \n4 | M16: \n25 | N16: \n* | O16: \n6 | P16: \n20 | Q16: \n\u3000 | R16: \n8 | S16: \n7 | T16: \n* | U16: \n9 | V16: \n16 | W16: \n\u3000 | X16: \n9 | Y16: \n29 | Z16: \n* | AA16: \n9 | AB16: \n8 | AC16: \n\u3000 | AD16: \n10 | AE16: \n96 | AF16: \n4 | AG16: \n\u3000 | AH16: \n12
A17: \n7 | B17: \n江苏 | C17: \n程鸣 | D17: \n8 | E17: \n\u3000 | F17: \n1 | G17: \n4 | H17: \n* | I17: \n3 | J17: \n29 | K17: \n\u3000 | L17: \n4 | M17: \n16 | N17: \n* | O17: \n6 | P17: \n3 | Q17: \n* | R17: \n7 | S17: \n14 | T17: \n\u3000 | U17: \n8 | V17: \n34 | W17: \n* | X17: \n8 | Y17: \n47 | Z17: \n\u3000 | AA17: \n10 | AB17: \n15 | AC17: \n* | AD17: \n10 | AE17: \n93 | AF17: \n3 | AG17: \n\u3000 | AH17: \n13
A18: \n8 | B18: \n广东 | C18: \n黄海林 | D18: \n7 | E18: \n* | F18: \n1 | G18: \n11 | H18: \n\u3000 | I18: \n1 | J18: \n35 | K18: \n* | L18: \n2 | M18: \n26 | N18: \n\u3000 | O18: \n4 | P18: \n9 | Q18: \n* | R18: \n5 | S18: \n33 | T18: \n\u3000 | U18: \n5 | V18: \n25 | W18: \n* | X18: \n7 | Y18: \n2 | Z18: \n\u3000 | AA18: \n9 | AB18: \n14 | AC18: \n* | AD18: \n10 | AE18: \n86 | AF18: \n3 | AG18: \n\u3000 | AH18: \n14
A19: \n23 | B19: \n福建 | C19: \n卓赞烽 | D19: \n24 | E19: \n\u3000 | F19: \n1 | G19: \n20 | H19: \n* | I19: \n2 | J19: \n1 | K19: \n\u3000 | L19: \n4 | M19: \n29 | N19: \n* | O19: \n5 | P19: \n13 | Q19: \n\u3000 | R19: \n5 | S19: \n40 | T19: \n* | U19: \n7 | V19: \n12 | W19: \n\u3000 | X19: \n8 | Y19: \n28 | Z19: \n* | AA19: \n9 | AB19: \n36 | AC19: \n* | AD19: \n10 | AE19: \n85 | AF19: \n2 | AG19: \n\u3000 | AH19: \n15
A20: \n24 | B20: \n厦门 | C20: \n林文汉 | D20: \n23 | E20: \n* | F20: \n1 | G20: \n26 | H20: \n\u3000 | I20: \n2 | J20: \n33 | K20: \n* | L20: \n3 | M20: \n42 | N20: \n\u3000 | O20: \n4 | P20: \n15 | Q20: \n\u3000 | R20: \n4 | S20: \n30 | T20: \n* | U20: \n6 | V20: \n43 | W20: \n\u3000 | X20: \n7 | Y20: \n6 | Z20: \n* | AA20: \n9 | AB20: \n28 | AC20: \n\u3000 | AD20: \n10 | AE20: \n84 | AF20: \n2 | AG20: \n\u3000 | AH20: \n16
A21: \n3 | B21: \n广东 | C21: \n朱少钧 | D21: \n4 | E21: \n\u3000 | F21: \n1 | G21: \n45 | H21: \n*+ | I21: \n3 | J21: \n25 | K21: \n\u3000 | L21: \n4 | M21: \n9 | N21: \n* | O21: \n6 | P21: \n7 | Q21: \n\u3000 | R21: \n7 | S21: \n20 | T21: \n* | U21: \n8 | V21: \n29 | W21: \n\u3000 | X21: \n9 | Y21: \n5 | Z21: \n* | AA21: \n10 | AB21: \n13 | AC21: \n\u3000 | AD21: \n10 | AE21: \n81 | AF21: \n2 | AG21: \n\u3000 | AH21: \n17
A22: \n5 | B22: \n浙江 | C22: \n程吉俊 | D22: \n6 | E22: \n* | F22: \n0 | G22: \n1 | H22: \n* | I22: \n0 | J22: \n32 | K22: \n\u3000 | L22: \n2 | M22: \n35 | N22: \n\u3000 | O22: \n4 | P22: \n42 | Q22: \n* | R22: \n6 | S22: \n15 | T22: \n\u3000 | U22: \n7 | V22: \n2 | W22: \n* | X22: \n9 | Y22: \n3 | Z22: \n\u3000 | AA22: \n10 | AB22: \n48 | AC22: \n* | AD22: \n10 | AE22: \n80 | AF22: \n4 | AG22: \n\u3000 | AH22: \n18
A23: \n36 | B23: \n江苏 | C23: \n朱晓虎 | D23: \n35 | E23: \n* | F23: \n1 | G23: \n42 | H23: \n\u3000 | I23: \n2 | J23: \n40 | K23: \n\u3000 | L23: \n3 | M23: \n28 | N23: \n* | O23: \n4 | P23: \n43 | Q23: \n\u3000 | R23: \n5 | S23: \n21 | T23: \n* | U23: \n7 | V23: \n18 | W23: \n\u3000 | X23: \n9 | Y23: \n46 | Z23: \n* | AA23: \n9 | AB23: \n23 | AC23: \n\u3000 | AD23: \n10 | AE23: \n80 | AF23: \n2 | AG23: \n\u3000 | AH23: \n19
A24: \n40 | B24: \n广东 | C24: \n林楚强 | D24: \n39 | E24: \n* | F24: \n2 | G24: \n43 | H24: \n\u3000 | I24: \n2 | J24: \n36 | K24: \n* | L24: \n3 | M24: \n33 | N24: \n\u3000 | O24: \n3 | P24: \n27 | Q24: \n* | R24: \n5 | S24: \n23 | T24: \n\u3000 | U24: \n5 | V24: \n42 | W24: \n* | X24: \n6 | Y24: \n44 | Z24: \n\u3000 | AA24: \n8 | AB24: \n32 | AC24: \n* | AD24: \n10 | AE24: \n75 | AF24: \n4 | AG24: \n\u3000 | AH24: \n20
A25: \n28 | B25: \n河南 | C25: \n李海 | D25: \n27 | E25: \n* | F25: \n0 | G25: \n10 | H25: \n\u3000 | I25: \n1 | J25: \n37 | K25: \n* | L25: \n3 | M25: \n36 | N25: \n\u3000 | O25: \n4 | P25: \n31 | Q25: \n* | R25: \n4 | S25: \n44 | T25: \n\u3000 | U25: \n6 | V25: \n9 | W25: \n* | X25: \n8 | Y25: \n23 | Z25: \n\u3000 | AA25: \n9 | AB25: \n24 | AC25: \n* | AD25: \n10 | AE25: \n70 | AF25: \n3 | AG25: \n\u3000 | AH25: \n21
A26: \n6 | B26: \n广东 | C26: \n吴亚利 | D26: \n5 | E26: \n\u3000 | F26: \n2 | G26: \n14 | H26: \n\u3000 | I26: \n2 | J26: \n38 | K26: \n* | L26: \n3 | M26: \n18 | N26: \n\u3000 | O26: \n5 | P26: \n2 | Q26: \n* | R26: \n7 | S26: \n11 | T26: \n\u3000 | U26: \n7 | V26: \n48 | W26: \n* | X26: \n7 | Y26: \n24 | Z26: \n\u3000 | AA26: \n7 | AB26: \n31 | AC26: \n* | AD26: \n9 | AE26: \n92 | AF26: \n4 | AG26: \n\u3000 | AH26: \n22
A27: \n12 | B27: \n广东 | C27: \n黎德志 | D27: \n11 | E27: \n* | F27: \n1 | G27: \n15 | H27: \n\u3000 | I27: \n1 | J27: \n39 | K27: \n* | L27: \n3 | M27: \n19 | N27: \n\u3000 | O27: \n5 | P27: \n38 | Q27: \n* | R27: \n6 | S27: \n9 | T27: \n\u3000 | U27: \n7 | V27: \n23 | W27: \n* | X27: \n8 | Y27: \n13 | Z27: \n* | AA27: \n8 | AB27: \n20 | AC27: \n\u3000 | AD27: \n9 | AE27: \n88 | AF27: \n2 | AG27: \n\u3000 | AH27: \n23
A28: \n20 | B28: \n广东 | C28: \n刘立山 | D28: \n19 | E28: \n* | F28: \n1 | G28: \n23 | H28: \n\u3000 | I28: \n2 | J28: \n17 | K28: \n\u3000 | L28: \n4 | M28: \n48 | N28: \n* | O28: \n6 | P28: \n14 | Q28: \n* | R28: \n6 | S28: \n3 | T28: \n\u3000 | U28: \n7 | V28: \n33 | W28: \n* | X28: \n8 | Y28: \n15 | Z28: \n\u3000 | AA28: \n8 | AB28: \n12 | AC28: \n* | AD28: \n9 | AE28: \n86 | AF28: \n2 | AG28: \n\u3000 | AH28: \n24
A29: \n27 | B29: \n广东 | C29: \n伍世钦 | D29: \n28 | E29: \n\u3000 | F29: \n2 | G29: \n22 | H29: \n\u3000 | I29: \n2 | J29: \n18 | K29: \n* | L29: \n3 | M29: \n13 | N29: \n* | O29: \n3 | P29: \n40 | Q29: \n\u3000 | R29: \n3 | S29: \n19 | T29: \n* | U29: \n5 | V29: \n21 | W29: \n\u3000 | X29: \n7 | Y29: \n43 | Z29: \n* | AA29: \n8 | AB29: \n26 | AC29: \n\u3000 | AD29: \n9 | AE29: \n85 | AF29: \n3 | AG29: \n\u3000 | AH29: \n25
A30: \n2 | B30: \n广东 | C30: \n李进 | D30: \n1 | E30: \n\u3000 | F30: \n2 | G30: \n41 | H30: \n* | I30: \n3 | J30: \n16 | K30: \n\u3000 | L30: \n4 | M30: \n15 | N30: \n* | O30: \n5 | P30: \n6 | Q30: \n\u3000 | R30: \n5 | S30: \n32 | T30: \n* | U30: \n7 | V30: \n5 | W30: \n\u3000 | X30: \n7 | Y30: \n8 | Z30: \n* | AA30: \n7 | AB30: \n43 | AC30: \n\u3000 | AD30: \n9 | AE30: \n81 | AF30: \n3 | AG30: \n\u3000 | AH30: \n26
A31: \n25 | B31: \n湖南 | C31: \n刘泉 | D31: \n26 | E31: \n* | F31: \n1 | G31: \n35 | H31: \n\u3000 | I31: \n3 | J31: \n3 | K31: \n* | L31: \n4 | M31: \n14 | N31: \n\u3000 | O31: \n4 | P31: \n16 | Q31: \n\u3000 | R31: \n4 | S31: \n41 | T31: \n* | U31: \n5 | V31: \n8 | W31: \n\u3000 | X31: \n5 | Y31: \n30 | Z31: \n\u3000 | AA31: \n7 | AB31: \n9 | AC31: \n* | AD31: \n9 | AE31: \n80 | AF31: \n3 | AG31: \n\u3000 | AH31: \n27
A32: \n41 | B32: \n福建 | C32: \n黄卿耀 | D32: \n42 | E32: \n* | F32: \n1 | G32: \n2 | H32: \n\u3000 | I32: \n2 | J32: \n44 | K32: \n* | L32: \n4 | M32: \n38 | N32: \n\u3000 | O32: \n4 | P32: \n48 | Q32: \n* | R32: \n4 | S32: \n25 | T32: \n\u3000 | U32: \n5 | V32: \n32 | W32: \n\u3000 | X32: \n5 | Y32: \n21 | Z32: \n* | AA32: \n7 | AB32: \n18 | AC32: \n\u3000 | AD32: \n9 | AE32: \n79 | AF32: \n3 | AG32: \n\u3000 | AH32: \n28
A33: \n26 | B33: \n广东 | C33: \n陈红标 | D33: \n25 | E33: \n\u3000 | F33: \n1 | G33: \n24 | H33: \n* | I33: \n2 | J33: \n9 | K33: \n\u3000 | L33: \n2 | M33: \n8 | N33: \n* | O33: \n2 | P33: \n17 | Q33: \n\u3000 | R33: \n4 | S33: \n37 | T33: \n* | U33: \n6 | V33: \n31 | W33: \n* | X33: \n8 | Y33: \n33 | Z33: \n\u3000 | AA33: \n8 | AB33: \n27 | AC33: \n* | AD33: \n9 | AE33: \n73 | AF33: \n3 | AG33: \n\u3000 | AH33: \n29
A34: \n47 | B34: \n安徽 | C34: \n王建鸣 | D34: \n48 | E34: \n\u3000 | F34: \n0 | G34: \n44 | H34: \n* | I34: \n0 | J34: \n30 | K34: \n\u3000 | L34: \n2 | M34: \n17 | N34: \n* | O34: \n4 | P34: \n21 | Q34: \n\u3000 | R34: \n5 | S34: \n18 | T34: \n* | U34: \n6 | V34: \n4 | W34: \n\u3000 | X34: \n7 | Y34: \n7 | Z34: \n* | AA34: \n7 | AB34: \n37 | AC34: \n* | AD34: \n9 | AE34: \n69 | AF34: \n3 | AG34: \n\u3000 | AH34: \n30
A35: \n4 | B35: \n沈阳 | C35: \n苗永鹏 | D35: \n3 | E35: \n* | F35: \n1 | G35: \n7 | H35: \n\u3000 | I35: \n1 | J35: \n19 | K35: \n* | L35: \n1 | M35: \n39 | N35: \n\u3000 | O35: \n2 | P35: \n37 | Q35: \n* | R35: \n4 | S35: \n42 | T35: \n\u3000 | U35: \n5 | V35: \n47 | W35: \n* | X35: \n6 | Y35: \n9 | Z35: \n\u3000 | AA35: \n7 | AB35: \n35 | AC35: \n* | AD35: \n9 | AE35: \n69 | AF35: \n2 | AG35: \n\u3000 | AH35: \n31
A36: \n43 | B36: \n湖北 | C36: \n肖八武 | D36: \n44 | E36: \n\u3000 | F36: \n2 | G36: \n40 | H36: \n* | I36: \n4 | J36: \n46 | K36: \n* | L36: \n5 | M36: \n11 | N36: \n\u3000 | O36: \n5 | P36: \n36 | Q36: \n* | R36: \n6 | S36: \n48 | T36: \n\u3000 | U36: \n6 | V36: \n24 | W36: \n* | X36: \n7 | Y36: \n27 | Z36: \n\u3000 | AA36: \n8 | AB36: \n2 | AC36: \n* | AD36: \n8 | AE36: \n94 | AF36: \n2 | AG36: \n\u3000 | AH36: \n32
A37: \n42 | B37: \n广东 | C37: \n林进春 | D37: \n41 | E37: \n\u3000 | F37: \n1 | G37: \n36 | H37: \n* | I37: \n2 | J37: \n13 | K37: \n\u3000 | L37: \n3 | M37: \n24 | N37: \n* | O37: \n4 | P37: \n5 | Q37: \n\u3000 | R37: \n4 | S37: \n4 | T37: \n* | U37: \n5 | V37: \n40 | W37: \n\u3000 | X37: \n6 | Y37: \n32 | Z37: \n* | AA37: \n6 | AB37: \n44 | AC37: \n\u3000 | AD37: \n8 | AE37: \n84 | AF37: \n1 | AG37: \n\u3000 | AH37: \n33
A38: \n32 | B38: \n宁波 | C38: \n谢丹枫 | D38: \n31 | E38: \n* | F38: \n0 | G38: \n18 | H38: \n\u3000 | I38: \n0 | J38: \n5 | K38: \n* | L38: \n0 | M38: \n45 | N38: \n* | O38: \n2 | P38: \n1 | Q38: \n\u3000 | R38: \n4 | S38: \n2 | T38: \n\u3000 | U38: \n4 | V38: \n41 | W38: \n* | X38: \n6 | Y38: \n42 | Z38: \n\u3000 | AA38: \n8 | AB38: \n40 | AC38: \n\u3000 | AD38: \n8 | AE38: \n68 | AF38: \n4 | AG38: \n\u3000 | AH38: \n34
A39: \n31 | B39: \n湖北 | C39: \n胡克华 | D39: \n32 | E39: \n\u3000 | F39: \n2 | G39: \n9 | H39: \n* | I39: \n4 | J39: \n34 | K39: \n* | L39: \n4 | M39: \n46 | N39: \n\u3000 | O39: \n4 | P39: \n28 | Q39: \n\u3000 | R39: \n6 | S39: \n16 | T39: \n* | U39: \n6 | V39: \n26 | W39: \n\u3000 | X39: \n6 | Y39: \n18 | Z39: \n* | AA39: \n7 | AB39: \n6 | AC39: \n\u3000 | AD39: \n7 | AE39: \n85 | AF39: \n3 | AG39: \n\u3000 | AH39: \n35
A40: \n21 | B40: \n北京 | C40: \n周涛 | D40: \n22 | E40: \n* | F40: \n0 | G40: \n13 | H40: \n* | I40: \n0 | J40: \n45 | K40: \n\u3000 | L40: \n2 | M40: \n44 | N40: \n\u3000 | O40: \n4 | P40: \n47 | Q40: \n* | R40: \n5 | S40: \n36 | T40: \n\u3000 | U40: \n5 | V40: \n27 | W40: \n* | X40: \n5 | Y40: \n41 | Z40: \n\u3000 | AA40: \n5 | AB40: \n10 | AC40: \n* | AD40: \n7 | AE40: \n79 | AF40: \n3 | AG40: \n\u3000 | AH40: \n36
A41: \n9 | B41: \n河南 | C41: \n赵子雨 | D41: \n10 | E41: \n* | F41: \n2 | G41: \n31 | H41: \n\u3000 | I41: \n2 | J41: \n26 | K41: \n* | L41: \n4 | M41: \n3 | N41: \n\u3000 | O41: \n4 | P41: \n8 | Q41: \n\u3000 | R41: \n5 | S41: \n12 | T41: \n* | U41: \n6 | V41: \n28 | W41: \n\u3000 | X41: \n6 | Y41: \n4 | Z41: \n* | AA41: \n7 | AB41: \n25 | AC41: \n\u3000 | AD41: \n7 | AE41: \n78 | AF41: \n2 | AG41: \n\u3000 | AH41: \n37
A42: \n30 | B42: \n广西 | C42: \n欧照芳 | D42: \n29 | E42: \n\u3000 | F42: \n0 | G42: \n33 | H42: \n* | I42: \n0 | J42: \n47 | K42: \n* | L42: \n0 | M42: \n10 | N42: \n\u3000 | O42: \n2 | P42: \n35 | Q42: \n* | R42: \n4 | S42: \n24 | T42: \n\u3000 | U42: \n4 | V42: \n19 | W42: \n\u3000 | X42: \n5 | Y42: \n25 | Z42: \n* | AA42: \n5 | AB42: \n1 | AC42: \n\u3000 | AD42: \n7 | AE42: \n73 | AF42: \n3 | AG42: \n\u3000 | AH42: \n38
A43: \n18 | B43: \n四川 | C43: \n梁妍婷（女） | D43: \n17 | E43: \n\u3000 | F43: \n0 | G43: \n32 | H43: \n* | I43: \n2 | J43: \n27 | K43: \n\u3000 | L43: \n3 | M43: \n6 | N43: \n* | O43: \n3 | P43: \n19 | Q43: \n* | R43: \n5 | S43: \n47 | T43: \n\u3000 | U43: \n6 | V43: \n36 | W43: \n* | X43: \n6 | Y43: \n31 | Z43: \n\u3000 | AA43: \n7 | AB43: \n41 | AC43: \n* | AD43: \n7 | AE43: \n72 | AF43: \n2 | AG43: \n\u3000 | AH43: \n39
A44: \n19 | B44: \n湖北 | C44: \n王文志 | D44: \n20 | E44: \n\u3000 | F44: \n1 | G44: \n16 | H44: \n* | I44: \n1 | J44: \n4 | K44: \n\u3000 | L44: \n3 | M44: \n12 | N44: \n* | O44: \n3 | P44: \n18 | Q44: \n\u3000 | R44: \n3 | S44: \n27 | T44: \n\u3000 | U44: \n3 | V44: \n30 | W44: \n* | X44: \n4 | Y44: \n10 | Z44: \n\u3000 | AA44: \n5 | AB44: \n39 | AC44: \n* | AD44: \n7 | AE44: \n71 | AF44: \n2 | AG44: \n\u3000 | AH44: \n40
A45: \n35 | B45: \n山东 | C45: \n王新光 | D45: \n36 | E45: \n\u3000 | F45: \n1 | G45: \n25 | H45: \n* | I45: \n1 | J45: \n8 | K45: \n\u3000 | L45: \n2 | M45: \n5 | N45: \n* | O45: \n2 | P45: \n30 | Q45: \n\u3000 | R45: \n2 | S45: \n39 | T45: \n* | U45: \n3 | V45: \n17 | W45: \n\u3000 | X45: \n5 | Y45: \n1 | Z45: \n* | AA45: \n7 | AB45: \n4 | AC45: \n\u3000 | AD45: \n7 | AE45: \n68 | AF45: \n2 | AG45: \n\u3000 | AH45: \n41
A46: \n44 | B46: \n广东 | C46: \n林进明 | D46: \n43 | E46: \n* | F46: \n0 | G46: \n47 | H46: \n\u3000 | I46: \n2 | J46: \n41 | K46: \n\u3000 | L46: \n2 | M46: \n21 | N46: \n* | O46: \n2 | P46: \n39 | Q46: \n\u3000 | R46: \n4 | S46: \n28 | T46: \n* | U46: \n4 | V46: \n1 | W46: \n\u3000 | X46: \n6 | Y46: \n40 | Z46: \n* | AA46: \n6 | AB46: \n42 | AC46: \n* | AD46: \n6 | AE46: \n70 | AF46: \n3 | AG46: \n\u3000 | AH46: \n42
A47: \n37 | B47: \n江苏 | C47: \n许波 | D47: \n38 | E47: \n* | F47: \n0 | G47: \n39 | H47: \n\u3000 | I47: \n1 | J47: \n28 | K47: \n\u3000 | L47: \n1 | M47: \n1 | N47: \n* | O47: \n3 | P47: \n4 | Q47: \n\u3000 | R47: \n3 | S47: \n26 | T47: \n\u3000 | U47: \n3 | V47: \n10 | W47: \n* | X47: \n4 | Y47: \n45 | Z47: \n* | AA47: \n6 | AB47: \n47 | AC47: \n\u3000 | AD47: \n6 | AE47: \n67 | AF47: \n2 | AG47: \n\u3000 | AH47: \n43
A48: \n10 | B48: \n广东 | C48: \n梁运龙 | D48: \n9 | E48: \n\u3000 | F48: \n0 | G48: \n28 | H48: \n* | I48: \n1 | J48: \n48 | K48: \n\u3000 | L48: \n1 | M48: \n30 | N48: \n* | O48: \n1 | P48: \n45 | Q48: \n\u3000 | R48: \n2 | S48: \n17 | T48: \n* | U48: \n3 | V48: \n37 | W48: \n\u3000 | X48: \n4 | Y48: \n19 | Z48: \n* | AA48: \n5 | AB48: \n21 | AC48: \n\u3000 | AD48: \n5 | AE48: \n65 | AF48: \n0 | AG48: \n\u3000 | AH48: \n44
A49: \n39 | B49: \n湖南 | C49: \n王清 | D49: \n40 | E49: \n\u3000 | F49: \n0 | G49: \n37 | H49: \n* | I49: \n1 | J49: \n12 | K49: \n\u3000 | L49: \n1 | M49: \n4 | N49: \n* | O49: \n2 | P49: \n44 | Q49: \n* | R49: \n2 | S49: \n35 | T49: \n\u3000 | U49: \n3 | V49: \n45 | W49: \n* | X49: \n3 | Y49: \n17 | Z49: \n* | AA49: \n5 | AB49: \n19 | AC49: \n\u3000 | AD49: \n5 | AE49: \n62 | AF49: \n1 | AG49: \n\u3000 | AH49: \n45
A50: \n1 | B50: \n湖南 | C50: \n梁林 | D50: \n2 | E50: \n* | F50: \n0 | G50: \n5 | H50: \n\u3000 | I50: \n2 | J50: \n23 | K50: \n* | L50: \n2 | M50: \n37 | N50: \n\u3000 | O50: \n2 | P50: \n32 | Q50: \n* | R50: \n2 | S50: \n45 | T50: \n\u3000 | U50: \n4 | V50: \n44 | W50: \n* | X50: \n4 | Y50: \n35 | Z50: \n\u3000 | AA50: \n4 | AB50: \n30 | AC50: \n* | AD50: \n4 | AE50: \n67 | AF50: \n2 | AG50: \n\u3000 | AH50: \n46
A51: \n17 | B51: \n山东 | C51: \n张卫东 | D51: \n18 | E51: \n* | F51: \n2 | G51: \n34 | H51: \n\u3000 | I51: \n2 | J51: \n20 | K51: \n* | L51: \n2 | M51: \n47 | N51: \n\u3000 | O51: \n2 | P51: \n26 | Q51: \n* | R51: \n2 | S51: \n10 | T51: \n\u3000 | U51: \n3 | V51: \n35 | W51: \n* | X51: \n3 | Y51: \n39 | Z51: \n\u3000 | AA51: \n3 | AB51: \n45 | AC51: \n\u3000 | AD51: \n4 | AE51: \n66 | AF51: \n1 | AG51: \n\u3000 | AH51: \n47
A52: \n45 | B52: \n广东 | C52: \n张亮 | D52: \n46 | E52: \n* | F52: \n0 | G52: \n3 | H52: \n- | I52: \n0 | J52: \n21 | K52: \n* | L52: \n0 | M52: \n32 | N52: \n\u3000 | O52: \n0 | P52: \n10 | Q52: \n* | R52: \n1 | S52: \n1 | T52: \n* | U52: \n1 | V52: \n39 | W52: \n\u3000 | X52: \n3 | Y52: \n37 | Z52: \n\u3000 | AA52: \n3 | AB52: \n17 | AC52: \n* | AD52: \n4 | AE52: \n62 | AF52: \n1 | AG52: \n\u3000 | AH52: \n48

A1: \n \n \n[此贴子已经被作者于2012-9-21 12:57:10编辑过]

A1: \n第五届“杨官璘杯”全国象棋公开赛 海外组 成绩表
A2: 比赛地点：凤岗镇体育馆 比赛时间：2012年9月17-21日 注：* 表示先手、 + 未对弈得分、- 弃权
A3: \n代号 | B3: \n代表队 | C3: \n姓名 | D3: \n第一轮 | G3: \n第二轮 | J3: \n第三轮 | M3: \n第四轮 | P3: \n第五轮 | S3: \n第六轮 | V3: \n第七轮 | Y3: \n第八轮 | AB3: \n第九轮 | AE3: \n对手分 | AF3: \n胜局 | AG3: \n备注 | AH3: \n名次
D4: \n对手 | F4: \n积分 | G4: \n对手 | I4: \n积分 | J4: \n对手 | L4: \n积分 | M4: \n对手 | O4: \n积分 | P4: \n对手 | R4: \n积分 | S4: \n对手 | U4: \n积分 | V4: \n对手 | X4: \n积分 | Y4: \n对手 | AA4: \n积分 | AB4: \n对手 | AD4: \n积分
A5: \n28 | B5: \n中国香港 | C5: \n梁达民 | D5: \n27 | E5: \n\u3000 | F5: \n2 | G5: \n31 | H5: \n* | I5: \n4 | J5: \n30 | K5: \n+ | L5: \n6 | M5: \n42 | N5: \n\u3000 | O5: \n7 | P5: \n53 | Q5: \n* | R5: \n9 | S5: \n13 | T5: \n* | U5: \n10 | V5: \n25 | W5: \n\u3000 | X5: \n11 | Y5: \n49 | Z5: \n* | AA5: \n13 | AB5: \n3 | AC5: \n* | AD5: \n14 | AE5: \n102 | AF5: \n5 | AG5: \n\u3000 | AH5: \n1
A6: \n3 | B6: \n中国香港 | C6: \n吴震熙 | D6: \n4 | E6: \n* | F6: \n2 | G6: \n1 | H6: \n* | I6: \n4 | J6: \n13 | K6: \n\u3000 | L6: \n4 | M6: \n55 | N6: \n* | O6: \n6 | P6: \n24 | Q6: \n\u3000 | R6: \n7 | S6: \n15 | T6: \n* | U6: \n9 | V6: \n33 | W6: \n\u3000 | X6: \n10 | Y6: \n16 | Z6: \n* | AA6: \n12 | AB6: \n28 | AC6: \n\u3000 | AD6: \n13 | AE6: \n102 | AF6: \n5 | AG6: \n\u3000 | AH6: \n2
A7: \n42 | B7: \n中国香港 | C7: \n陈振杰 | D7: \n41 | E7: \n\u3000 | F7: \n2 | G7: \n51 | H7: \n* | I7: \n4 | J7: \n48 | K7: \n\u3000 | L7: \n6 | M7: \n28 | N7: \n* | O7: \n7 | P7: \n13 | Q7: \n\u3000 | R7: \n8 | S7: \n40 | T7: \n* | U7: \n9 | V7: \n38 | W7: \n* | X7: \n11 | Y7: \n60 | Z7: \n\u3000 | AA7: \n12 | AB7: \n18 | AC7: \n* | AD7: \n13 | AE7: \n100 | AF7: \n4 | AG7: \n\u3000 | AH7: \n3
A8: \n13 | B8: \n越南 | C8: \n郑亚生 | D8: \n14 | E8: \n* | F8: \n2 | G8: \n10 | H8: \n\u3000 | I8: \n4 | J8: \n3 | K8: \n* | L8: \n6 | M8: \n60 | N8: \n\u3000 | O8: \n7 | P8: \n42 | Q8: \n* | R8: \n8 | S8: \n28 | T8: \n\u3000 | U8: \n9 | V8: \n40 | W8: \n* | X8: \n11 | Y8: \n18 | Z8: \n\u3000 | AA8: \n11 | AB8: \n24 | AC8: \n* | AD8: \n13 | AE8: \n98 | AF8: \n5 | AG8: \n\u3000 | AH8: \n4
A9: \n1 | B9: \n越南 | C9: \n阮成保 | D9: \n2 | E9: \n* | F9: \n2 | G9: \n3 | H9: \n\u3000 | I9: \n2 | J9: \n10 | K9: \n* | L9: \n4 | M9: \n11 | N9: \n\u3000 | O9: \n6 | P9: \n25 | Q9: \n* | R9: \n7 | S9: \n20 | T9: \n\u3000 | U9: \n9 | V9: \n18 | W9: \n* | X9: \n10 | Y9: \n48 | Z9: \n\u3000 | AA9: \n11 | AB9: \n60 | AC9: \n* | AD9: \n13 | AE9: \n96 | AF9: \n5 | AG9: \n\u3000 | AH9: \n5
A10: \n25 | B10: \n中国香港 | C10: \n赵汝权 | D10: \n26 | E10: \n* | F10: \n2 | G10: \n24 | H10: \n\u3000 | I10: \n2 | J10: \n14 | K10: \n* | L10: \n4 | M10: \n19 | N10: \n* | O10: \n6 | P10: \n1 | Q10: \n\u3000 | R10: \n7 | S10: \n22 | T10: \n\u3000 | U10: \n9 | V10: \n28 | W10: \n* | X10: \n10 | Y10: \n33 | Z10: \n\u3000 | AA10: \n11 | AB10: \n38 | AC10: \n* | AD10: \n13 | AE10: \n95 | AF10: \n5 | AG10: \n\u3000 | AH10: \n6
A11: \n18 | B11: \n中国澳门 | C11: \n曹岩磊 | D11: \n17 | E11: \n\u3000 | F11: \n2 | G11: \n15 | H11: \n* | I11: \n3 | J11: \n11 | K11: \n\u3000 | L11: \n4 | M11: \n30 | N11: \n* | O11: \n5 | P11: \n43 | Q11: \n\u3000 | R11: \n7 | S11: \n24 | T11: \n* | U11: \n9 | V11: \n1 | W11: \n\u3000 | X11: \n10 | Y11: \n13 | Z11: \n* | AA11: \n12 | AB11: \n42 | AC11: \n\u3000 | AD11: \n13 | AE11: \n92 | AF11: \n4 | AG11: \n\u3000 | AH11: \n7
A12: \n60 | B12: \n菲律宾 | C12: \n庄宏明 | D12: \n59 | E12: \n\u3000 | F12: \n2 | G12: \n57 | H12: \n* | I12: \n4 | J12: \n5 | K12: \n\u3000 | L12: \n6 | M12: \n13 | N12: \n* | O12: \n7 | P12: \n40 | Q12: \n\u3000 | R12: \n8 | S12: \n33 | T12: \n* | U12: \n9 | V12: \n39 | W12: \n\u3000 | X12: \n11 | Y12: \n42 | Z12: \n* | AA12: \n12 | AB12: \n1 | AC12: \n\u3000 | AD12: \n12 | AE12: \n100 | AF12: \n4 | AG12: \n\u3000 | AH12: \n8
A13: \n33 | B13: \n美国 | C13: \n牟海勤 | D13: \n34 | E13: \n* | F13: \n2 | G13: \n30 | H13: \n\u3000 | I13: \n2 | J13: \n20 | K13: \n* | L13: \n4 | M13: \n35 | N13: \n\u3000 | O13: \n6 | P13: \n16 | Q13: \n* | R13: \n8 | S13: \n60 | T13: \n\u3000 | U13: \n9 | V13: \n3 | W13: \n* | X13: \n10 | Y13: \n25 | Z13: \n* | AA13: \n11 | AB13: \n15 | AC13: \n\u3000 | AD13: \n12 | AE13: \n95 | AF13: \n4 | AG13: \n\u3000 | AH13: \n9
A14: \n53 | B14: \n越南 | C14: \n武明一 | D14: \n54 | E14: \n* | F14: \n1 | G14: \n6 | H14: \n\u3000 | I14: \n3 | J14: \n46 | K14: \n* | L14: \n5 | M14: \n15 | N14: \n* | O14: \n7 | P14: \n28 | Q14: \n\u3000 | R14: \n7 | S14: \n38 | T14: \n\u3000 | U14: \n7 | V14: \n36 | W14: \n* | X14: \n9 | Y14: \n40 | Z14: \n\u3000 | AA14: \n10 | AB14: \n4 | AC14: \n* | AD14: \n12 | AE14: \n92 | AF14: \n5 | AG14: \n\u3000 | AH14: \n10
A15: \n20 | B15: \n中华台北 | C15: \n刘安生 | D15: \n19 | E15: \n\u3000 | F15: \n0 | G15: \n21 | H15: \n* | I15: \n2 | J15: \n33 | K15: \n\u3000 | L15: \n2 | M15: \n14 | N15: \n* | O15: \n4 | P15: \n55 | Q15: \n\u3000 | R15: \n6 | S15: \n1 | T15: \n* | U15: \n6 | V15: \n11 | W15: \n\u3000 | X15: \n8 | Y15: \n59 | Z15: \n* | AA15: \n10 | AB15: \n57 | AC15: \n\u3000 | AD15: \n12 | AE15: \n88 | AF15: \n6 | AG15: \n\u3000 | AH15: \n11
A16: \n48 | B16: \n新加坡 | C16: \n许正豪 | D16: \n47 | E16: \n\u3000 | F16: \n2 | G16: \n61 | H16: \n* | I16: \n4 | J16: \n42 | K16: \n* | L16: \n4 | M16: \n34 | N16: \n\u3000 | O16: \n5 | P16: \n22 | Q16: \n* | R16: \n5 | S16: \n54 | T16: \n\u3000 | U16: \n7 | V16: \n37 | W16: \n\u3000 | X16: \n9 | Y16: \n1 | Z16: \n* | AA16: \n10 | AB16: \n40 | AC16: \n* | AD16: \n12 | AE16: \n86 | AF16: \n5 | AG16: \n\u3000 | AH16: \n12
A17: \n49 | B17: \n中国香港 | C17: \n黄学谦 | D17: \n50 | E17: \n* | F17: \n2 | G17: \n40 | H17: \n\u3000 | I17: \n2 | J17: \n51 | K17: \n* | L17: \n4 | M17: \n43 | N17: \n* | O17: \n5 | P17: \n6 | Q17: \n\u3000 | R17: \n6 | S17: \n57 | T17: \n* | U17: \n8 | V17: \n19 | W17: \n* | X17: \n10 | Y17: \n28 | Z17: \n\u3000 | AA17: \n10 | AB17: \n16 | AC17: \n\u3000 | AD17: \n12 | AE17: \n84 | AF17: \n5 | AG17: \n\u3000 | AH17: \n13
A18: \n24 | B18: \n越南 | C18: \n宗室日新 | D18: \n23 | E18: \n\u3000 | F18: \n2 | G18: \n25 | H18: \n* | I18: \n4 | J18: \n22 | K18: \n* | L18: \n5 | M18: \n38 | N18: \n\u3000 | O18: \n6 | P18: \n3 | Q18: \n* | R18: \n7 | S18: \n18 | T18: \n\u3000 | U18: \n7 | V18: \n34 | W18: \n* | X18: \n9 | Y18: \n39 | Z18: \n* | AA18: \n11 | AB18: \n13 | AC18: \n\u3000 | AD18: \n11 | AE18: \n99 | AF18: \n4 | AG18: \n\u3000 | AH18: \n14
A19: \n38 | B19: \n越南 | C19: \n阮黄林 | D19: \n37 | E19: \n\u3000 | F19: \n2 | G19: \n43 | H19: \n* | I19: \n4 | J19: \n40 | K19: \n\u3000 | L19: \n5 | M19: \n24 | N19: \n* | O19: \n6 | P19: \n39 | Q19: \n\u3000 | R19: \n7 | S19: \n53 | T19: \n* | U19: \n9 | V19: \n42 | W19: \n\u3000 | X19: \n9 | Y19: \n30 | Z19: \n* | AA19: \n11 | AB19: \n25 | AC19: \n\u3000 | AD19: \n11 | AE19: \n97 | AF19: \n4 | AG19: \n后胜1局 | AH19: \n15
A20: \n15 | B20: \n中国澳门 | C20: \n李锦欢 | D20: \n16 | E20: \n* | F20: \n2 | G20: \n18 | H20: \n\u3000 | I20: \n3 | J20: \n8 | K20: \n* | L20: \n5 | M20: \n53 | N20: \n\u3000 | O20: \n5 | P20: \n4 | Q20: \n* | R20: \n7 | S20: \n3 | T20: \n\u3000 | U20: \n7 | V20: \n12 | W20: \n* | X20: \n9 | Y20: \n21 | Z20: \n\u3000 | AA20: \n10 | AB20: \n33 | AC20: \n* | AD20: \n11 | AE20: \n97 | AF20: \n4 | AG20: \n后胜0局 | AH20: \n16
A21: \n22 | B21: \n中国香港 | C21: \n黄志强 | D21: \n21 | E21: \n\u3000 | F21: \n2 | G21: \n19 | H21: \n* | I21: \n4 | J21: \n24 | K21: \n\u3000 | L21: \n5 | M21: \n40 | N21: \n* | O21: \n5 | P21: \n48 | Q21: \n\u3000 | R21: \n7 | S21: \n25 | T21: \n* | U21: \n7 | V21: \n30 | W21: \n\u3000 | X21: \n7 | Y21: \n12 | Z21: \n* | AA21: \n9 | AB21: \n43 | AC21: \n\u3000 | AD21: \n11 | AE21: \n93 | AF21: \n5 | AG21: \n\u3000 | AH21: \n17
A22: \n39 | B22: \n马来西亚 | C22: \n陈有发 | D22: \n40 | E22: \n* | F22: \n0 | G22: \n50 | H22: \n\u3000 | I22: \n2 | J22: \n54 | K22: \n* | L22: \n4 | M22: \n41 | N22: \n\u3000 | O22: \n6 | P22: \n38 | Q22: \n* | R22: \n7 | S22: \n34 | T22: \n\u3000 | U22: \n9 | V22: \n60 | W22: \n* | X22: \n9 | Y22: \n24 | Z22: \n\u3000 | AA22: \n9 | AB22: \n36 | AC22: \n* | AD22: \n11 | AE22: \n84 | AF22: \n5 | AG22: \n\u3000 | AH22: \n18
A23: \n21 | B23: \n越南 | C23: \n范启源 | D23: \n22 | E23: \n* | F23: \n0 | G23: \n20 | H23: \n\u3000 | I23: \n0 | J23: \n17 | K23: \n\u3000 | L23: \n2 | M23: \n31 | N23: \n* | O23: \n4 | P23: \n57 | Q23: \n\u3000 | R23: \n4 | S23: \n14 | T23: \n* | U23: \n6 | V23: \n51 | W23: \n\u3000 | X23: \n8 | Y23: \n15 | Z23: \n* | AA23: \n9 | AB23: \n30 | AC23: \n\u3000 | AD23: \n11 | AE23: \n78 | AF23: \n5 | AG23: \n\u3000 | AH23: \n19
A24: \n40 | B24: \n中华台北 | C24: \n阮明昭 | D24: \n39 | E24: \n\u3000 | F24: \n2 | G24: \n49 | H24: \n* | I24: \n4 | J24: \n38 | K24: \n* | L24: \n5 | M24: \n22 | N24: \n\u3000 | O24: \n7 | P24: \n60 | Q24: \n* | R24: \n8 | S24: \n42 | T24: \n\u3000 | U24: \n9 | V24: \n13 | W24: \n\u3000 | X24: \n9 | Y24: \n53 | Z24: \n* | AA24: \n10 | AB24: \n48 | AC24: \n\u3000 | AD24: \n10 | AE24: \n107 | AF24: \n3 | AG24: \n\u3000 | AH24: \n20
A25: \n57 | B25: \n越南 | C25: \n阮黄燕(女) | D25: \n58 | E25: \n* | F25: \n2 | G25: \n60 | H25: \n\u3000 | I25: \n2 | J25: \n61 | K25: \n* | L25: \n4 | M25: \n16 | N25: \n\u3000 | O25: \n4 | P25: \n21 | Q25: \n* | R25: \n6 | S25: \n49 | T25: \n\u3000 | U25: \n6 | V25: \n29 | W25: \n* | X25: \n8 | Y25: \n6 | Z25: \n\u3000 | AA25: \n10 | AB25: \n20 | AC25: \n* | AD25: \n10 | AE25: \n90 | AF25: \n5 | AG25: \n\u3000 | AH25: \n21
A26: \n16 | B26: \n越南 | C26: \n阮明日光 | D26: \n15 | E26: \n\u3000 | F26: \n0 | G26: \n17 | H26: \n* | I26: \n2 | J26: \n31 | K26: \n\u3000 | L26: \n4 | M26: \n57 | N26: \n* | O26: \n6 | P26: \n33 | Q26: \n\u3000 | R26: \n6 | S26: \n51 | T26: \n* | U26: \n8 | V26: \n6 | W26: \n* | X26: \n10 | Y26: \n3 | Z26: \n\u3000 | AA26: \n10 | AB26: \n49 | AC26: \n* | AD26: \n10 | AE26: \n86 | AF26: \n5 | AG26: \n\u3000 | AH26: \n22
A27: \n59 | B27: \n马来西亚 | C27: \n黄运兴 | D27: \n60 | E27: \n* | F27: \n0 | G27: \n58 | H27: \n\u3000 | I27: \n1 | J27: \n32 | K27: \n* | L27: \n2 | M27: \n61 | N27: \n\u3000 | O27: \n4 | P27: \n46 | Q27: \n* | R27: \n6 | S27: \n6 | T27: \n\u3000 | U27: \n6 | V27: \n56 | W27: \n* | X27: \n8 | Y27: \n20 | Z27: \n\u3000 | AA27: \n8 | AB27: \n29 | AC27: \n* | AD27: \n10 | AE27: \n84 | AF27: \n4 | AG27: \n\u3000 | AH27: \n23
A28: \n4 | B28: \n越南 | C28: \n汪洋北 | D28: \n3 | E28: \n\u3000 | F28: \n0 | G28: \n2 | H28: \n* | I28: \n2 | J28: \n55 | K28: \n\u3000 | L28: \n3 | M28: \n58 | N28: \n* | O28: \n5 | P28: \n15 | Q28: \n\u3000 | R28: \n5 | S28: \n11 | T28: \n* | U28: \n6 | V28: \n5 | W28: \n\u3000 | X28: \n8 | Y28: \n19 | Z28: \n* | AA28: \n10 | AB28: \n53 | AC28: \n\u3000 | AD28: \n10 | AE28: \n83 | AF28: \n4 | AG28: \n\u3000 | AH28: \n24
A29: \n46 | B29: \n荷兰 | C29: \n吴永生 | D29: \n45 | E29: \n\u3000 | F29: \n2 | G29: \n55 | H29: \n* | I29: \n3 | J29: \n53 | K29: \n\u3000 | L29: \n3 | M29: \n5 | N29: \n* | O29: \n4 | P29: \n59 | Q29: \n\u3000 | R29: \n4 | S29: \n9 | T29: \n* | U29: \n6 | V29: \n41 | W29: \n\u3000 | X29: \n7 | Y29: \n32 | Z29: \n* | AA29: \n8 | AB29: \n27 | AC29: \n\u3000 | AD29: \n10 | AE29: \n77 | AF29: \n3 | AG29: \n\u3000 | AH29: \n25
A30: \n30 | B30: \n新加坡 | C30: \n黄俊铭 | D30: \n29 | E30: \n\u3000 | F30: \n2 | G30: \n33 | H30: \n* | I30: \n4 | J30: \n28 | K30: \n*- | L30: \n4 | M30: \n18 | N30: \n\u3000 | O30: \n5 | P30: \n34 | Q30: \n* | R30: \n5 | S30: \n26 | T30: \n\u3000 | U30: \n7 | V30: \n22 | W30: \n* | X30: \n9 | Y30: \n38 | Z30: \n\u3000 | AA30: \n9 | AB30: \n21 | AC30: \n* | AD30: \n9 | AE30: \n95 | AF30: \n4 | AG30: \n\u3000 | AH30: \n26
A31: \n19 | B31: \n中国香港 | C31: \n翁德強 | D31: \n20 | E31: \n* | F31: \n2 | G31: \n22 | H31: \n\u3000 | I31: \n2 | J31: \n12 | K31: \n* | L31: \n4 | M31: \n25 | N31: \n\u3000 | O31: \n4 | P31: \n41 | Q31: \n* | R31: \n6 | S31: \n5 | T31: \n* | U31: \n8 | V31: \n49 | W31: \n\u3000 | X31: \n8 | Y31: \n4 | Z31: \n\u3000 | AA31: \n8 | AB31: \n11 | AC31: \n* | AD31: \n9 | AE31: \n93 | AF31: \n4 | AG31: \n\u3000 | AH31: \n27
A32: \n11 | B32: \n越南 | C32: \n吴兰香(女) | D32: \n12 | E32: \n* | F32: \n2 | G32: \n8 | H32: \n\u3000 | I32: \n3 | J32: \n18 | K32: \n* | L32: \n4 | M32: \n1 | N32: \n* | O32: \n4 | P32: \n36 | Q32: \n\u3000 | R32: \n5 | S32: \n4 | T32: \n\u3000 | U32: \n6 | V32: \n20 | W32: \n* | X32: \n6 | Y32: \n9 | Z32: \n* | AA32: \n8 | AB32: \n19 | AC32: \n\u3000 | AD32: \n9 | AE32: \n90 | AF32: \n2 | AG32: \n\u3000 | AH32: \n28
A33: \n6 | B33: \n马来西亚 | C33: \n黎金福 | D33: \n5 | E33: \n\u3000 | F33: \n1 | G33: \n53 | H33: \n* | I33: \n1 | J33: \n27 | K33: \n\u3000 | L33: \n3 | M33: \n8 | N33: \n\u3000 | O33: \n5 | P33: \n49 | Q33: \n* | R33: \n6 | S33: \n59 | T33: \n* | U33: \n8 | V33: \n16 | W33: \n\u3000 | X33: \n8 | Y33: \n57 | Z33: \n* | AA33: \n8 | AB33: \n31 | AC33: \n\u3000 | AD33: \n9 | AE33: \n86 | AF33: \n3 | AG33: \n\u3000 | AH33: \n29
A34: \n31 | B34: \n德国 | C34: \n濮方尧 | D34: \n32 | E34: \n* | F34: \n2 | G34: \n28 | H34: \n\u3000 | I34: \n2 | J34: \n16 | K34: \n* | L34: \n2 | M34: \n21 | N34: \n\u3000 | O34: \n2 | P34: \n61 | Q34: \n* | R34: \n4 | S34: \n50 | T34: \n\u3000 | U34: \n5 | V34: \n26 | W34: \n* | X34: \n6 | Y34: \n56 | Z34: \n\u3000 | AA34: \n8 | AB34: \n6 | AC34: \n* | AD34: \n9 | AE34: \n85 | AF34: \n3 | AG34: \n\u3000 | AH34: \n30
A35: \n43 | B35: \n新加坡 | C35: \n康德荣 | D35: \n44 | E35: \n* | F35: \n2 | G35: \n38 | H35: \n\u3000 | I35: \n2 | J35: \n47 | K35: \n* | L35: \n4 | M35: \n49 | N35: \n\u3000 | O35: \n5 | P35: \n18 | Q35: \n* | R35: \n5 | S35: \n36 | T35: \n\u3000 | U35: \n5 | V35: \n50 | W35: \n* | X35: \n7 | Y35: \n34 | Z35: \n\u3000 | AA35: \n9 | AB35: \n22 | AC35: \n* | AD35: \n9 | AE35: \n80 | AF35: \n4 | AG35: \n\u3000 | AH35: \n31
A36: \n41 | B36: \n新加坡 | C36: \n蔡俊杰 | D36: \n42 | E36: \n* | F36: \n0 | G36: \n52 | H36: \n\u3000 | I36: \n2 | J36: \n56 | K36: \n* | L36: \n4 | M36: \n39 | N36: \n* | O36: \n4 | P36: \n19 | Q36: \n\u3000 | R36: \n4 | S36: \n58 | T36: \n\u3000 | U36: \n5 | V36: \n46 | W36: \n* | X36: \n6 | Y36: \n54 | Z36: \n\u3000 | AA36: \n7 | AB36: \n34 | AC36: \n* | AD36: \n9 | AE36: \n79 | AF36: \n3 | AG36: \n\u3000 | AH36: \n32
A37: \n36 | B37: \n中国香港 | C37: \n陈永乐 | D37: \n35 | E37: \n\u3000 | F37: \n1 | G37: \n5 | H37: \n* | I37: \n1 | J37: \n58 | K37: \n\u3000 | L37: \n2 | M37: \n44 | N37: \n\u3000 | O37: \n4 | P37: \n11 | Q37: \n* | R37: \n5 | S37: \n43 | T37: \n* | U37: \n7 | V37: \n53 | W37: \n\u3000 | X37: \n7 | Y37: \n37 | Z37: \n* | AA37: \n9 | AB37: \n39 | AC37: \n\u3000 | AD37: \n9 | AE37: \n77 | AF37: \n3 | AG37: \n\u3000 | AH37: \n33
A38: \n32 | B38: \n越南 | C38: \n黎明智 | D38: \n31 | E38: \n\u3000 | F38: \n0 | G38: \n27 | H38: \n* | I38: \n1 | J38: \n59 | K38: \n\u3000 | L38: \n2 | M38: \n26 | N38: \n* | O38: \n3 | P38: \n23 | Q38: \n\u3000 | R38: \n5 | S38: \n37 | T38: \n* | U38: \n5 | V38: \n8 | W38: \n* | X38: \n7 | Y38: \n46 | Z38: \n\u3000 | AA38: \n8 | AB38: \n61 | AC38: \n* | AD38: \n9 | AE38: \n77 | AF38: \n2 | AG38: \n\u3000 | AH38: \n34
A39: \n37 | B39: \n中国香港 | C39: \n蓝政鸿 | D39: \n38 | E39: \n* | F39: \n0 | G39: \n44 | H39: \n\u3000 | I39: \n2 | J39: \n34 | K39: \n* | L39: \n2 | M39: \n47 | N39: \n\u3000 | O39: \n4 | P39: \n12 | Q39: \n* | R39: \n5 | S39: \n32 | T39: \n\u3000 | U39: \n7 | V39: \n48 | W39: \n* | X39: \n7 | Y39: \n36 | Z39: \n\u3000 | AA39: \n7 | AB39: \n50 | AC39: \n* | AD39: \n9 | AE39: \n74 | AF39: \n4 | AG39: \n后胜3局 | AH39: \n35
A40: \n12 | B40: \n加拿大 | C40: \n顾亿庆 | D40: \n11 | E40: \n\u3000 | F40: \n0 | G40: \n7 | H40: \n* | I40: \n2 | J40: \n19 | K40: \n\u3000 | L40: \n2 | M40: \n10 | N40: \n* | O40: \n4 | P40: \n37 | Q40: \n\u3000 | R40: \n5 | S40: \n55 | T40: \n* | U40: \n7 | V40: \n15 | W40: \n\u3000 | X40: \n7 | Y40: \n22 | Z40: \n\u3000 | AA40: \n7 | AB40: \n8 | AC40: \n* | AD40: \n9 | AE40: \n74 | AF40: \n4 | AG40: \n后胜0局 | AH40: \n36
A41: \n61 | B41: \n马来西亚 | C41: \n吴将玮 | D41: \n62 | E41: \n*+ | F41: \n2 | G41: \n48 | H41: \n\u3000 | I41: \n2 | J41: \n57 | K41: \n\u3000 | L41: \n2 | M41: \n59 | N41: \n* | O41: \n2 | P41: \n31 | Q41: \n\u3000 | R41: \n2 | S41: \n45 | T41: \n* | U41: \n4 | V41: \n14 | W41: \n\u3000 | X41: \n6 | Y41: \n51 | Z41: \n* | AA41: \n8 | AB41: \n32 | AC41: \n\u3000 | AD41: \n9 | AE41: \n71 | AF41: \n4 | AG41: \n\u3000 | AH41: \n37
A42: \n55 | B42: \n马来西亚 | C42: \n姚威和 | D42: \n56 | E42: \n* | F42: \n2 | G42: \n46 | H42: \n\u3000 | I42: \n3 | J42: \n4 | K42: \n* | L42: \n4 | M42: \n3 | N42: \n\u3000 | O42: \n4 | P42: \n20 | Q42: \n* | R42: \n4 | S42: \n12 | T42: \n\u3000 | U42: \n4 | V42: \n52 | W42: \n\u3000 | X42: \n6 | Y42: \n58 | Z42: \n* | AA42: \n7 | AB42: \n54 | AC42: \n\u3000 | AD42: \n8 | AE42: \n83 | AF42: \n2 | AG42: \n\u3000 | AH42: \n38
A43: \n5 | B43: \n中国香港 | C43: \n雷雄才 | D43: \n6 | E43: \n* | F43: \n1 | G43: \n36 | H43: \n\u3000 | I43: \n3 | J43: \n60 | K43: \n* | L43: \n3 | M43: \n46 | N43: \n\u3000 | O43: \n4 | P43: \n35 | Q43: \n* | R43: \n6 | S43: \n19 | T43: \n\u3000 | U43: \n6 | V43: \n4 | W43: \n* | X43: \n6 | Y43: \n8 | Z43: \n\u3000 | AA43: \n6 | AB43: \n10 | AC43: \n\u3000 | AD43: \n8 | AE43: \n80 | AF43: \n3 | AG43: \n\u3000 | AH43: \n39
A44: \n54 | B44: \n中国香港 | C44: \n谭伟伦 | D44: \n53 | E44: \n\u3000 | F44: \n1 | G44: \n35 | H44: \n* | I44: \n2 | J44: \n39 | K44: \n\u3000 | L44: \n2 | M44: \n50 | N44: \n* | O44: \n3 | P44: \n10 | Q44: \n\u3000 | R44: \n5 | S44: \n48 | T44: \n* | U44: \n5 | V44: \n58 | W44: \n\u3000 | X44: \n6 | Y44: \n41 | Z44: \n* | AA44: \n7 | AB44: \n55 | AC44: \n* | AD44: \n8 | AE44: \n80 | AF44: \n1 | AG44: \n\u3000 | AH44: \n40
A45: \n26 | B45: \n中华台北 | C45: \n游原硕 | D45: \n25 | E45: \n\u3000 | F45: \n0 | G45: \n23 | H45: \n* | I45: \n2 | J45: \n35 | K45: \n\u3000 | L45: \n2 | M45: \n32 | N45: \n\u3000 | O45: \n3 | P45: \n8 | Q45: \n* | R45: \n5 | S45: \n30 | T45: \n* | U45: \n5 | V45: \n31 | W45: \n\u3000 | X45: \n6 | Y45: \n27 | Z45: \n* | AA45: \n6 | AB45: \n58 | AC45: \n\u3000 | AD45: \n8 | AE45: \n77 | AF45: \n3 | AG45: \n\u3000 | AH45: \n41
A46: \n27 | B46: \n马来西亚 | C46: \n苏怡龙 | D46: \n28 | E46: \n* | F46: \n0 | G46: \n32 | H46: \n\u3000 | I46: \n1 | J46: \n6 | K46: \n* | L46: \n1 | M46: \n29 | N46: \n\u3000 | O46: \n1 | P46: \n52 | Q46: \n* | R46: \n2 | S46: \n47 | T46: \n\u3000 | U46: \n4 | V46: \n17 | W46: \n* | X46: \n6 | Y46: \n26 | Z46: \n\u3000 | AA46: \n8 | AB46: \n46 | AC46: \n* | AD46: \n8 | AE46: \n74 | AF46: \n3 | AG46: \n\u3000 | AH46: \n42
A47: \n35 | B47: \n中华台北 | C47: \n许明龙 | D47: \n36 | E47: \n* | F47: \n1 | G47: \n54 | H47: \n\u3000 | I47: \n2 | J47: \n26 | K47: \n* | L47: \n4 | M47: \n33 | N47: \n* | O47: \n4 | P47: \n5 | Q47: \n\u3000 | R47: \n4 | S47: \n56 | T47: \n\u3000 | U47: \n4 | V47: \n2 | W47: \n* | X47: \n6 | Y47: \n29 | Z47: \n\u3000 | AA47: \n6 | AB47: \n14 | AC47: \n\u3000 | AD47: \n8 | AE47: \n73 | AF47: \n3 | AG47: \n\u3000 | AH47: \n43
A48: \n29 | B48: \n越南 | C48: \n陈慧莹(女) | D48: \n30 | E48: \n* | F48: \n0 | G48: \n34 | H48: \n\u3000 | I48: \n0 | J48: \n23 | K48: \n\u3000 | L48: \n1 | M48: \n27 | N48: \n* | O48: \n3 | P48: \n50 | Q48: \n\u3000 | R48: \n4 | S48: \n7 | T48: \n* | U48: \n6 | V48: \n57 | W48: \n\u3000 | X48: \n6 | Y48: \n35 | Z48: \n* | AA48: \n8 | AB48: \n59 | AC48: \n\u3000 | AD48: \n8 | AE48: \n70 | AF48: \n3 | AG48: \n\u3000 | AH48: \n44
A49: \n56 | B49: \n日本 | C49: \n所司和晴 | D49: \n55 | E49: \n\u3000 | F49: \n0 | G49: \n45 | H49: \n* | I49: \n2 | J49: \n41 | K49: \n\u3000 | L49: \n2 | M49: \n9 | N49: \n* | O49: \n4 | P49: \n51 | Q49: \n\u3000 | R49: \n4 | S49: \n35 | T49: \n* | U49: \n6 | V49: \n59 | W49: \n\u3000 | X49: \n6 | Y49: \n31 | Z49: \n* | AA49: \n6 | AB49: \n47 | AC49: \n\u3000 | AD49: \n8 | AE49: \n69 | AF49: \n4 | AG49: \n\u3000 | AH49: \n45
A50: \n9 | B50: \n美国 | C50: \n李新达 | D50: \n10 | E50: \n* | F50: \n0 | G50: \n14 | H50: \n\u3000 | I50: \n0 | J50: \n52 | K50: \n* | L50: \n2 | M50: \n56 | N50: \n\u3000 | O50: \n2 | P50: \n47 | Q50: \n* | R50: \n4 | S50: \n46 | T50: \n\u3000 | U50: \n4 | V50: \n7 | W50: \n* | X50: \n6 | Y50: \n11 | Z50: \n\u3000 | AA50: \n6 | AB50: \n51 | AC50: \n\u3000 | AD50: \n8 | AE50: \n61 | AF50: \n4 | AG50: \n\u3000 | AH50: \n46
A51: \n34 | B51: \n汶莱 | C51: \n庄力铭 | D51: \n33 | E51: \n\u3000 | F51: \n0 | G51: \n29 | H51: \n* | I51: \n2 | J51: \n37 | K51: \n\u3000 | L51: \n4 | M51: \n48 | N51: \n* | O51: \n5 | P51: \n30 | Q51: \n\u3000 | R51: \n7 | S51: \n39 | T51: \n* | U51: \n7 | V51: \n24 | W51: \n\u3000 | X51: \n7 | Y51: \n43 | Z51: \n* | AA51: \n7 | AB51: \n41 | AC51: \n\u3000 | AD51: \n7 | AE51: \n90 | AF51: \n3 | AG51: \n\u3000 | AH51: \n47
A52: \n50 | B52: \n新加坡 | C52: \n赵金山 | D52: \n49 | E52: \n\u3000 | F52: \n0 | G52: \n39 | H52: \n* | I52: \n0 | J52: \n7 | K52: \n\u3000 | L52: \n2 | M52: \n54 | N52: \n\u3000 | O52: \n3 | P52: \n29 | Q52: \n* | R52: \n4 | S52: \n31 | T52: \n* | U52: \n5 | V52: \n43 | W52: \n\u3000 | X52: \n5 | Y52: \n23 | Z52: \n* | AA52: \n7 | AB52: \n37 | AC52: \n\u3000 | AD52: \n7 | AE52: \n77 | AF52: \n2 | AG52: \n\u3000 | AH52: \n48
A53: \n58 | B53: \n中国香港 | C53: \n欧志强 | D53: \n57 | E53: \n\u3000 | F53: \n0 | G53: \n59 | H53: \n* | I53: \n1 | J53: \n36 | K53: \n* | L53: \n2 | M53: \n4 | N53: \n\u3000 | O53: \n2 | P53: \n45 | Q53: \n\u3000 | R53: \n4 | S53: \n41 | T53: \n* | U53: \n5 | V53: \n54 | W53: \n* | X53: \n6 | Y53: \n55 | Z53: \n\u3000 | AA53: \n7 | AB53: \n26 | AC53: \n* | AD53: \n7 | AE53: \n77 | AF53: \n1 | AG53: \n\u3000 | AH53: \n49
A54: \n8 | B54: \n法国 | C54: \n胡伟长 | D54: \n7 | E54: \n\u3000 | F54: \n2 | G54: \n11 | H54: \n* | I54: \n3 | J54: \n15 | K54: \n\u3000 | L54: \n3 | M54: \n6 | N54: \n* | O54: \n3 | P54: \n26 | Q54: \n\u3000 | R54: \n3 | S54: \n23 | T54: \n* | U54: \n5 | V54: \n32 | W54: \n\u3000 | X54: \n5 | Y54: \n5 | Z54: \n* | AA54: \n7 | AB54: \n12 | AC54: \n\u3000 | AD54: \n7 | AE54: \n74 | AF54: \n3 | AG54: \n\u3000 | AH54: \n50
A55: \n23 | B55: \n中国香港 | C55: \n黄树楷 | D55: \n24 | E55: \n* | F55: \n0 | G55: \n26 | H55: \n\u3000 | I55: \n0 | J55: \n29 | K55: \n* | L55: \n1 | M55: \n52 | N55: \n\u3000 | O55: \n3 | P55: \n32 | Q55: \n* | R55: \n3 | S55: \n8 | T55: \n\u3000 | U55: \n3 | V55: \n44 | W55: \n* | X55: \n5 | Y55: \n50 | Z55: \n\u3000 | AA55: \n5 | AB55: \n17 | AC55: \n*+ | AD55: \n7 | AE55: \n64 | AF55: \n3 | AG55: \n\u3000 | AH55: \n51
A56: \n14 | B56: \n新加坡 | C56: \n巫宇斌 | D56: \n13 | E56: \n\u3000 | F56: \n0 | G56: \n9 | H56: \n* | I56: \n2 | J56: \n25 | K56: \n\u3000 | L56: \n2 | M56: \n20 | N56: \n\u3000 | O56: \n2 | P56: \n2 | Q56: \n* | R56: \n4 | S56: \n21 | T56: \n\u3000 | U56: \n4 | V56: \n61 | W56: \n* | X56: \n4 | Y56: \n17 | Z56: \n\u3000 | AA56: \n6 | AB56: \n35 | AC56: \n* | AD56: \n6 | AE56: \n84 | AF56: \n3 | AG56: \n\u3000 | AH56: \n52
A57: \n51 | B57: \n英国 | C57: \n彭铂 | D57: \n52 | E57: \n* | F57: \n2 | G57: \n42 | H57: \n\u3000 | I57: \n2 | J57: \n49 | K57: \n\u3000 | L57: \n2 | M57: \n45 | N57: \n* | O57: \n4 | P57: \n56 | Q57: \n* | R57: \n6 | S57: \n16 | T57: \n\u3000 | U57: \n6 | V57: \n21 | W57: \n* | X57: \n6 | Y57: \n61 | Z57: \n\u3000 | AA57: \n6 | AB57: \n9 | AC57: \n* | AD57: \n6 | AE57: \n82 | AF57: \n3 | AG57: \n\u3000 | AH57: \n53
A58: \n10 | B58: \n中国香港 | C58: \n黄照 | D58: \n9 | E58: \n\u3000 | F58: \n2 | G58: \n13 | H58: \n* | I58: \n2 | J58: \n1 | K58: \n\u3000 | L58: \n2 | M58: \n12 | N58: \n\u3000 | O58: \n2 | P58: \n54 | Q58: \n* | R58: \n2 | S58: \n2 | T58: \n\u3000 | U58: \n2 | V58: \n62 | W58: \n*+ | X58: \n4 | Y58: \n7 | Z58: \n\u3000 | AA58: \n6 | AB58: \n5 | AC58: \n* | AD58: \n6 | AE58: \n73 | AF58: \n3 | AG58: \n\u3000 | AH58: \n54
A59: \n47 | B59: \n澳大利亚 | C59: \n邓宜兵 | D59: \n48 | E59: \n* | F59: \n0 | G59: \n62 | H59: \n+ | I59: \n2 | J59: \n43 | K59: \n\u3000 | L59: \n2 | M59: \n37 | N59: \n* | O59: \n2 | P59: \n9 | Q59: \n\u3000 | R59: \n2 | S59: \n27 | T59: \n* | U59: \n2 | V59: \n45 | W59: \n\u3000 | X59: \n4 | Y59: \n2 | Z59: \n\u3000 | AA59: \n6 | AB59: \n56 | AC59: \n* | AD59: \n6 | AE59: \n69 | AF59: \n3 | AG59: \n\u3000 | AH59: \n55
A60: \n2 | B60: \n加拿大 | C60: \n郑世豪 | D60: \n1 | E60: \n\u3000 | F60: \n0 | G60: \n4 | H60: \n\u3000 | I60: \n0 | J60: \n44 | K60: \n* | L60: \n0 | M60: \n17 | N60: \n* | O60: \n2 | P60: \n14 | Q60: \n\u3000 | R60: \n2 | S60: \n10 | T60: \n* | U60: \n4 | V60: \n35 | W60: \n\u3000 | X60: \n4 | Y60: \n47 | Z60: \n* | AA60: \n4 | AB60: \n62 | AC60: \n*+ | AD60: \n6 | AE60: \n61 | AF60: \n3 | AG60: \n\u3000 | AH60: \n56
A61: \n52 | B61: \n澳大利亚 | C61: \n余穗康 | D61: \n51 | E61: \n\u3000 | F61: \n0 | G61: \n41 | H61: \n* | I61: \n0 | J61: \n9 | K61: \n\u3000 | L61: \n0 | M61: \n23 | N61: \n* | O61: \n0 | P61: \n27 | Q61: \n\u3000 | R61: \n1 | S61: \n62 | T61: \n+ | U61: \n3 | V61: \n55 | W61: \n* | X61: \n3 | Y61: \n45 | Z61: \n* | AA61: \n4 | AB61: \n7 | AC61: \n\u3000 | AD61: \n6 | AE61: \n59 | AF61: \n2 | AG61: \n\u3000 | AH61: \n57
A62: \n45 | B62: \n芬兰 | C62: \n邓明高 | D62: \n46 | E62: \n* | F62: \n0 | G62: \n56 | H62: \n\u3000 | I62: \n0 | J62: \n62 | K62: \n*+ | L62: \n2 | M62: \n51 | N62: \n\u3000 | O62: \n2 | P62: \n58 | Q62: \n* | R62: \n2 | S62: \n61 | T62: \n\u3000 | U62: \n2 | V62: \n47 | W62: \n* | X62: \n2 | Y62: \n52 | Z62: \n\u3000 | AA62: \n3 | AB62: \n44 | AC62: \n* | AD62: \n5 | AE62: \n60 | AF62: \n2 | AG62: \n\u3000 | AH62: \n58
A63: \n17 | B63: \n荷兰 | C63: \n余晓兰(女) | D63: \n18 | E63: \n* | F63: \n0 | G63: \n16 | H63: \n\u3000 | I63: \n0 | J63: \n21 | K63: \n* | L63: \n0 | M63: \n2 | N63: \n\u3000 | O63: \n0 | P63: \n62 | Q63: \n*+ | R63: \n2 | S63: \n44 | T63: \n\u3000 | U63: \n4 | V63: \n27 | W63: \n\u3000 | X63: \n4 | Y63: \n14 | Z63: \n* | AA63: \n4 | AB63: \n23 | AC63: \n- | AD63: \n4 | AE63: \n69 | AF63: \n2 | AG63: \n\u3000 | AH63: \n59
A64: \n7 | B64: \n澳大利亚 | C64: \n陈一鸣 | D64: \n8 | E64: \n* | F64: \n0 | G64: \n12 | H64: \n\u3000 | I64: \n0 | J64: \n50 | K64: \n* | L64: \n0 | M64: \n62 | N64: \n+ | O64: \n2 | P64: \n44 | Q64: \n* | R64: \n4 | S64: \n29 | T64: \n\u3000 | U64: \n4 | V64: \n9 | W64: \n\u3000 | X64: \n4 | Y64: \n10 | Z64: \n* | AA64: \n4 | AB64: \n52 | AC64: \n* | AD64: \n4 | AE64: \n59 | AF64: \n2 | AG64: \n\u3000 | AH64: \n60
A65: \n44 | B65: \n日本 | C65: \n三桥泰朗 | D65: \n43 | E65: \n\u3000 | F65: \n0 | G65: \n37 | H65: \n* | I65: \n0 | J65: \n2 | K65: \n\u3000 | L65: \n2 | M65: \n36 | N65: \n* | O65: \n2 | P65: \n7 | Q65: \n\u3000 | R65: \n2 | S65: \n17 | T65: \n* | U65: \n2 | V65: \n23 | W65: \n\u3000 | X65: \n2 | Y65: \n62 | Z65: \n*+ | AA65: \n4 | AB65: \n45 | AC65: \n\u3000 | AD65: \n4 | AE65: \n57 | AF65: \n2 | AG65: \n\u3000 | AH65: \n61
A66: \n62 | B66: \n轮空 | C66: \n轮空 | D66: \n61 | E66: \n- | F66: \n0 | G66: \n47 | H66: \n*- | I66: \n0 | J66: \n45 | K66: \n- | L66: \n0 | M66: \n7 | N66: \n*- | O66: \n0 | P66: \n17 | Q66: \n- | R66: \n0 | S66: \n52 | T66: \n*- | U66: \n0 | V66: \n10 | W66: \n- | X66: \n0 | Y66: \n44 | Z66: \n- | AA66: \n0 | AB66: \n2 | AC66: \n*- | AD66: \n0 | AE66: \n50 | AF66: \n0 | AG66: \n\u3000 | AH66: \n62

A1: \n \n\t \n\t热烈祝贺姚洪新夺得公开组冠军！他才是真正的大师！ \n\t \n \n